text,conversation,file,nome,idade,gênero,por_que_escolheu_andar_de_bicicleta?,ha_quanto_tempo_utiliza?,qual_e_o_principal_problema_que_voce_enfrenta_ao_andar_de_bicicleta_em_fortaleza,tem_medo_de_sofrer_acidentes_andando_de_bicicleta_em_Fortaleza?,sofreu_algum_acidente_no_último_ano?,gostaria_de_trocar_a_bicicleta_por_outro_meio_de_transporte,existe_alguma_rua_em_fortaleza_em_que_gostaria_de_ver_uma_ciclovia,por_que_escolheu_ou_escolhe_andar_de_bicicleta_agrupado,ha_quanto_tempo_utiliza_agrupado,qual_e_o_principal_problema_que_voce_enfrenta_ao_andar_de_bicicleta_em_fortaleza_agrupado,tem_medo_de_sofrer_acidentes_andando_de_bicicleta_em_Fortaleza_agrupado,sofreu_algum_acidente_no_último_ano_agrupado,gostaria_de_trocar_a_bicicleta_por_outro_meio_de_transporte_agrupado
"Qual o seu nome e a sua idade? Juliana, eu tenho 31 anos. Por que você escolhe andar de bicicleta e a quanto tempo utiliza, mais ou menos? Porque pra mim é mais fácil, porque a minha vida é corrida, eu faço bolo, eu ajudo a minha vó, aí eu moro perto, aí é pra mim ir mais rápido, né? Qual o principal problema que você enfrenta andando de bicicleta? Ah, é as motos e os carros que querem passar por cima da gente. Você tem medo de sofrer acidente, Nando? Tenho, mas graças a Deus eu nunca sofri. Você gostaria de trocar por outro meio de transporte? Ah, se eu pudesse comprar um carro ou uma moto é melhor, porque eu tenho três crianças. Existe alguma rua que você gostaria de ver uma ciclovia aqui em Fortaleza? Assim como eu ando muito no bairro só, aí eu não tenho muito acesso às outras não, mas pelo bairro tá tudo tranquilo. Ótimo.","Pessoa A: Qual o seu nome e a sua idade? Juliana, eu tenho 31 anos. Por que você escolhe andar de bicicleta e a quanto tempo utiliza, mais ou menos? Porque pra mim é mais fácil, porque a minha vida é corrida, eu faço bolo, eu ajudo a minha vó, aí eu moro perto, aí é pra mim ir mais rápido, né? Qual o principal problema que você enfrenta andando de bicicleta? Ah, é as motos e os carros que querem passar por cima da gente. Você tem medo de sofrer acidente, Nando? Tenho, mas graças a Deus eu nunca sofri. Você gostaria de trocar por outro meio de transporte? Ah, se eu pudesse comprar um carro ou uma moto é melhor, porque eu tenho três crianças. Existe alguma rua que você gostaria de ver uma ciclovia aqui em Fortaleza? Assim como eu ando muito no bairro só, aí eu não tenho muito acesso às outras não, mas pelo bairro tá tudo tranquilo. Ótimo.",00000025-AUDIO-2025-10-30-11-30-00,Juliana,31 anos,Feminino,"Porque pra mim é mais fácil, porque a minha vida é corrida, eu faço bolo, eu ajudo a minha vó, aí eu moro perto, aí é pra mim ir mais rápido, né?","A pessoa não menciona há quanto tempo utiliza a bicicleta, apenas explica por que a escolheu: ""Porque pra mim é mais fácil, porque a minha vida é corrida, eu faço bolo, eu ajudo a minha vó, aí eu moro perto, aí é pra mim ir mais rápido, né?""","""Ah, é as motos e os carros que querem passar por cima da gente.""","Tenho, mas graças a Deus eu nunca sofri.","Tenho, mas graças a Deus eu nunca sofri.","Você gostaria de trocar por outro meio de transporte? Ah, se eu pudesse comprar um carro ou uma moto é melhor, porque eu tenho três crianças.","Assim como eu ando muito no bairro só, aí eu não tenho muito acesso às outras não, mas pelo bairro tá tudo tranquilo. Ótimo.",Rapidez \ Tempo; Mais fácil; Praticidade e conveniência,"Não se aplica, pois a pessoa não menciona há quanto tempo utiliza a bicicleta.",Desrespeito dos motoristas ou Trânsito; Risco de acidentes,"Sim, tenho medo de acidentes",Não,"Sim, por uma moto ou por um carro"
"Faça o nome e sua idade, por favor. É Maria Lila, tenho 43 anos. Por que você escolheu andar de bicicleta? Porque eu ando de bicicleta desde criança. Eu sei que é perigoso, mas eu não estou nem aí. Eu ando e é mesmo. Porque eu não gosto de andar a pé. Porque para todo canto que a gente vai, para o mercantil é longe. Para todo canto é longe. Você tem medo de sofrer acidente? Mulher tenho, eu morro de medo. Mas eu boto na mão do senhor e ele vai na frente, né? Você já sofreu algum acidente? Já. Quer contar como foi? Deixa pra lá. Eu vinha, né, do mercantil, aí quando eu fui subir na bicicleta, aí o pneu entrou naquelas brechinhas ali, ó. Só que aquelas brechinhas da calçada, onde passa a água da chuva, não tinha essa proteção. Aí o pneu entrou dentro, eu caí, taquei a cara no chão. Quer ver a cara todinha? Você gostaria de trocar a bicicleta por outro meio de transporte? Não. Eu queria uma moto, mas não sei andar. Existe alguma rua em Fortaleza que você gostaria que tivesse uma ciclovia? Mulher, eu gostaria que tivesse mais ciclovias, né? Eu sei que tem muitas, só que não é suficiente, né? Pra proteger o ciclista, né? Que o ciclista é frágil, né? Pelo menos é frágil, porque tá numa bicicleta, né? A bicicleta é um desafio frágil, né? Eu já te perguntei qual o principal problema que você enfrenta a andar de bicicleta? Mulher, é a quantidade de carro que tem, né? Tem muito carro, muita moto, caminhão, fica morrendo de medo, mas... Está bom. Muito obrigada, bom dia. Eu que agradeço.","Pessoa B: Faça o nome e sua idade, por favor.
Pessoa A: É Maria Lila, tenho 43 anos.
Pessoa B: Por que você escolheu andar de bicicleta?
Pessoa A: Porque eu ando de bicicleta desde criança. Eu sei que é perigoso, mas eu não estou nem aí. Eu ando e é mesmo. Porque eu não gosto de andar a pé. Porque para todo canto que a gente vai, para o mercantil é longe. Para todo canto é longe.
Pessoa B: Você tem medo de sofrer acidente?
Pessoa A: Mulher tenho, eu morro de medo. Mas eu boto na mão do senhor e ele vai na frente, né?
Pessoa B: Você já sofreu algum acidente?
Pessoa A: Já.
Pessoa B: Quer contar como foi? Deixa pra lá.
Pessoa A: Eu vinha, né, do mercantil, aí quando eu fui subir na bicicleta, aí o pneu entrou naquelas brechinhas ali, ó. Só que aquelas brechinhas da calçada, onde passa a água da chuva, não tinha essa proteção. Aí o pneu entrou dentro, eu caí, taquei a cara no chão. Quer ver a cara todinha?
Pessoa B: Você gostaria de trocar a bicicleta por outro meio de transporte?
Pessoa A: Não. Eu queria uma moto, mas não sei andar.
Pessoa B: Existe alguma rua em Fortaleza que você gostaria que tivesse uma ciclovia?
Pessoa A: Mulher, eu gostaria que tivesse mais ciclovias, né? Eu sei que tem muitas, só que não é suficiente, né? Pra proteger o ciclista, né? Que o ciclista é frágil, né? Pelo menos é frágil, porque tá numa bicicleta, né? A bicicleta é um desafio frágil, né?
Pessoa B: Eu já te perguntei qual o principal problema que você enfrenta a andar de bicicleta?
Pessoa A: Mulher, é a quantidade de carro que tem, né? Tem muito carro, muita moto, caminhão, fica morrendo de medo, mas... Está bom. Muito obrigada, bom dia. Eu que agradeço.",00000026-AUDIO-2025-10-30-11-32-17,Maria Lila,43 anos,Feminino,"Porque eu ando de bicicleta desde criança. Eu sei que é perigoso, mas eu não estou nem aí. Eu ando e é mesmo. Porque eu não gosto de andar a pé. Porque para todo canto que a gente vai, para o mercantil é longe. Para todo canto é longe.",Porque eu ando de bicicleta desde criança.,"é a quantidade de carro que tem, né? Tem muito carro, muita moto, caminhão, fica morrendo de medo.","Você tem medo de sofrer acidente? Mulher tenho, eu morro de medo. Mas eu boto na mão do senhor e ele vai na frente, né?","Você já sofreu algum acidente? Já. Quer contar como foi? Deixa pra lá. Eu vinha, né, do mercantil, aí quando eu fui subir na bicicleta, aí o pneu entrou naquelas brechinhas ali, ó. Só que aquelas brechinhas da calçada, onde passa a água da chuva, não tinha essa proteção. Aí o pneu entrou dentro, eu caí, taquei a cara no chão. Quer ver a cara todinha?","Você gostaria de trocar a bicicleta por outro meio de transporte? Não. Eu queria uma moto, mas não sei andar.","Mulher, eu gostaria que tivesse mais ciclovias, né? Eu sei que tem muitas, só que não é suficiente, né? Pra proteger o ciclista, né? Que o ciclista é frágil, né? Pelo menos é frágil, porque tá numa bicicleta, né? A bicicleta é um desafio frágil, né?",Praticidade e conveniência; Preferência pessoal,Mais de 5 anos,Desrespeito dos motoristas ou Trânsito; Risco de acidentes,"Sim, tenho medo de acidentes",Sim,Não
"Qual é o seu nome e sua idade? É Francisco. Minha idade é 65 anos. Por que você escolhe andar de bicicleta e quanto tempo utiliza? Eu acho bom andar de bicicleta. Quanto tempo você usa, mais ou menos? Eu uso mais de 20 minutos. Qual é o principal problema que você enfrenta andando de bicicleta? O problema? Talvez a gente se enfrente a cansaço, viu? A rua mesmo? A rua, a rua, a passar e quando a gente vai passar. Você tem medo de sofrer acidente no bicicleta? Aconteceu comigo, cara. Aqui? Por aqui? Não, foi na Mosaico Centro. Você gostaria de trocar bicicleta por outro transporte? Não, não, não. E existe alguma rua que você gostaria que tivesse ciclovia? Ah, tem rua que ciclovia aí na... Você gostaria de ir a mais algum. Lugar aqui que você anda? Gostaria.","Pessoa B: Qual é o seu nome e sua idade?
Pessoa A: É Francisco. Minha idade é 65 anos.
Pessoa B: Por que você escolhe andar de bicicleta e quanto tempo utiliza?
Pessoa A: Eu acho bom andar de bicicleta.
Pessoa B: Quanto tempo você usa, mais ou menos?
Pessoa A: Eu uso mais de 20 minutos.
Pessoa B: Qual é o principal problema que você enfrenta andando de bicicleta?
Pessoa A: O problema? Talvez a gente se enfrente a cansaço, viu?
Pessoa B: A rua mesmo?
Pessoa A: A rua, a rua, a passar e quando a gente vai passar.
Pessoa B: Você tem medo de sofrer acidente no bicicleta?
Pessoa A: Aconteceu comigo, cara.
Pessoa B: Aqui? Por aqui?
Pessoa A: Não, foi na Mosaico Centro.
Pessoa B: Você gostaria de trocar bicicleta por outro transporte?
Pessoa A: Não, não, não.
Pessoa B: E existe alguma rua que você gostaria que tivesse ciclovia?
Pessoa A: Ah, tem rua que ciclovia aí na... Você gostaria de ir a mais algum.
Pessoa B: Lugar aqui que você anda?
Pessoa A: Gostaria.",00000027-AUDIO-2025-10-30-11-32-39,Francisco,65 anos,Masculino,Eu acho bom andar de bicicleta.,"Quanto tempo você usa, mais ou menos? Eu uso mais de 20 minutos.","O problema? Talvez a gente se enfrente a cansaço, viu? A rua mesmo? A rua, a rua, a passar e quando a gente vai passar.","Você tem medo de sofrer acidente no bicicleta? Aconteceu comigo, cara. Aqui? Por aqui? Não, foi na Mosaico Centro.","Você tem medo de sofrer acidente no bicicleta? Aconteceu comigo, cara. Aqui? Por aqui? Não, foi na Mosaico Centro.","Você gostaria de trocar bicicleta por outro transporte? Não, não, não.","E existe alguma rua que você gostaria que tivesse ciclovia? Ah, tem rua que ciclovia aí na...",Preferência pessoal,,Calor ou clima; Desrespeito dos motoristas ou Trânsito,"Sim, tenho medo de acidentes",Sim,Não
"Aí, qual tua nome e idade? É... Francisco Guilherme da Silva Júnior, 59 anos. Quase 60, hein? É. Por que que tu escolheu andar de bicicleta e há quanto tempo o senhor utiliza? Rapaz, tem. 58 anos. E... consegue ver algum problema que... pra enfrentar andar de bicicleta de Fortaleza? Rapaz, não. Só ali na... Na Misterral ali que não tem ciclofia, né? Alí da Doutora Bezerra pra... pro rumo da Califórnia que não tem, né? Tem, tem. O senhor tem medo de sofrer acidente andando de bicicleta? Quase tenho. E sofreu algum acidente no último ano? Não, graças a Deus não. E gostaria de trocar de bicicleta por outro meio de transporte? Rapaz, se eu pudesse eu gostaria. E existe alguma rua aqui em Fortaleza, Dubai, que o senhor gostaria que tivesse uma ciclovia, ciclofaixa? Rapaz... Pra mim, se todos estivessem, era melhor. Perfeito!","Pessoa A: Aí, qual tua nome e idade?
Pessoa B: É... Francisco Guilherme da Silva Júnior, 59 anos.
Pessoa A: Quase 60, hein?
Pessoa B: É.
Pessoa A: Por que que tu escolheu andar de bicicleta e há quanto tempo o senhor utiliza?
Pessoa B: Rapaz, tem.
Pessoa A: 58 anos.
Pessoa A: E... consegue ver algum problema que... pra enfrentar andar de bicicleta de Fortaleza?
Pessoa B: Rapaz, não. Só ali na... Na Misterral ali que não tem ciclofia, né? Alí da Doutora Bezerra pra... pro rumo da Califórnia que não tem, né?
Pessoa A: Tem, tem. O senhor tem medo de sofrer acidente andando de bicicleta?
Pessoa B: Quase tenho.
Pessoa A: E sofreu algum acidente no último ano?
Pessoa B: Não, graças a Deus não.
Pessoa A: E gostaria de trocar de bicicleta por outro meio de transporte?
Pessoa B: Rapaz, se eu pudesse eu gostaria.
Pessoa A: E existe alguma rua aqui em Fortaleza, Dubai, que o senhor gostaria que tivesse uma ciclovia, ciclofaixa?
Pessoa B: Rapaz... Pra mim, se todos estivessem, era melhor.
Pessoa A: Perfeito!",00000028-AUDIO-2025-10-30-11-33-27,Francisco Guilherme da Silva Júnior,59 anos,Masculino,"O motivo pelo qual a pessoa escolheu andar de bicicleta não está explícito no trecho. A resposta que segue a pergunta sobre a escolha e o tempo de uso é apenas sobre o tempo de uso: ""Rapaz, tem. 58 anos.""","Rapaz, tem. 58 anos.","Só ali na... Na Misterral ali que não tem ciclofia, né? Alí da Doutora Bezerra pra... pro rumo da Califórnia que não tem, né? Tem, tem.",O senhor tem medo de sofrer acidente andando de bicicleta? Quase tenho.,"E sofreu algum acidente no último ano? Não, graças a Deus não.","Rapaz, se eu pudesse eu gostaria.","E existe alguma rua aqui em Fortaleza, Dubai, que o senhor gostaria que tivesse uma ciclovia, ciclofaixa? Rapaz... Pra mim, se todos estivessem, era melhor.",,Mais de 5 anos,Falta de ciclovias,"Sim, tenho medo de acidentes",Não,"Sim, mas não especifica qual meio"
"Qual o seu nome e sua idade? Meu nome é Márcio Antônio Silva da Silva, 60 anos. Por que você escolheu andar de bicicleta e há quanto tempo utiliza? É porque não tenho carro nenhuma mota. Qual é o principal problema que você enfrenta ao andar? Rapaz, é porque é bem distante e é mais rápido também, né? É o seu trabalho. Mas problema, sim? Não, problema nenhum. Você. Tem medo de sofrer acidente? Rapaz, nós todos temos, mas só... é Deus aí, né? Pronto, você já sofreu algum acidente? Já. Quer contar como foi ou deixa pra lá? Não, deixa quieto, é muito triste. Tá certo, tá certo. Terri minha esposa, acabou disso. Ai meu Deus, eu sinto muito. Você gostaria de trocar a bicicleta por outro meio de transporte? Rapaz, no total eu gostaria, mas falta só o dinheiro, né? Sei. Existe alguma rua em Fortaleza que você gostaria que tivesse uma cicloquagem, uma ciclovia? Que ainda não tem? Ou uma que tá ruim e que podia melhorar? Rapaz, só lá em cima lá, lá na... Não sei o que chama, Marujali. Muito obrigada! Bom dia!","Pessoa A: Qual o seu nome e sua idade?
Pessoa B: Meu nome é Márcio Antônio Silva da Silva, 60 anos.
Pessoa A: Por que você escolheu andar de bicicleta e há quanto tempo utiliza?
Pessoa B: É porque não tenho carro nenhuma mota.
Pessoa A: Qual é o principal problema que você enfrenta ao andar?
Pessoa B: Rapaz, é porque é bem distante e é mais rápido também, né? É o seu trabalho.
Pessoa A: Mas problema, sim?
Pessoa B: Não, problema nenhum. Você.
Pessoa A: Tem medo de sofrer acidente?
Pessoa B: Rapaz, nós todos temos, mas só... é Deus aí, né?
Pessoa A: Pronto, você já sofreu algum acidente?
Pessoa B: Já.
Pessoa A: Quer contar como foi ou deixa pra lá?
Pessoa B: Não, deixa quieto, é muito triste.
Pessoa A: Tá certo, tá certo.
Pessoa B: Terri minha esposa, acabou disso.
Pessoa A: Ai meu Deus, eu sinto muito. Você gostaria de trocar a bicicleta por outro meio de transporte?
Pessoa B: Rapaz, no total eu gostaria, mas falta só o dinheiro, né?
Pessoa A: Sei. Existe alguma rua em Fortaleza que você gostaria que tivesse uma cicloquagem, uma ciclovia? Que ainda não tem? Ou uma que tá ruim e que podia melhorar?
Pessoa B: Rapaz, só lá em cima lá, lá na... Não sei o que chama, Marujali.
Pessoa A: Muito obrigada!
Pessoa B: Bom dia!",00000029-AUDIO-2025-10-30-11-34-25,Márcio Antônio Silva da Silva,60 anos,Masculino,"É porque não tenho carro nenhuma mota. Qual é o principal problema que você enfrenta ao andar? Rapaz, é porque é bem distante e é mais rápido também, né? É o seu trabalho.",A informação de há quanto tempo a pessoa utiliza a bicicleta não é mencionada no texto.,"Rapaz, é porque é bem distante e é mais rápido também, né? É o seu trabalho. Mas problema, sim? Não, problema nenhum.","Você. Tem medo de sofrer acidente? Rapaz, nós todos temos, mas só... é Deus aí, né?","Pronto, você já sofreu algum acidente? Já. Quer contar como foi ou deixa pra lá? Não, deixa quieto, é muito triste. Tá certo, tá certo. Terri minha esposa, acabou disso. Ai meu Deus, eu sinto muito.","Você gostaria de trocar a bicicleta por outro meio de transporte? Rapaz, no total eu gostaria, mas falta só o dinheiro, né? Sei.","Rapaz, só lá em cima lá, lá na... Não sei o que chama, Marujali.",Única opção; Rapidez \ Tempo,,,"Sim, tenho medo de acidentes",Sim,"Sim, mas não especifica qual meio"
"Qual é o seu nome e sua idade? Meu nome é Thiago Barbosa da Silva. Qual a sua idade? 18. Por que você escolheu andar de bicicleta e quanto tempo usa? Essa bicicleta não é minha, não é emprestada. Mas você escolheu por quê? Por graça do locomotor? Por lazer? Mais pra ir na minha casa. Entendi. Qual o principal problema que você vê andando de bicicleta nas ruas? É, os carros não respeitam, né? Sim. Você tem medo de sofrer acidente? Tenho. Já sofreu algum? Não. Você gostaria de trocar a bicicleta por algum outro transporte? Sim. Qual? Moto. Existe alguma rua que você gostaria de ter uma ciclovia? Aqui, por onde você anda, ou em outro lugar? Por aqui mesmo. Pronto.","Pessoa A: Qual é o seu nome e sua idade?
Pessoa B: Meu nome é Thiago Barbosa da Silva.
Pessoa A: Qual a sua idade?
Pessoa B: 18.
Pessoa A: Por que você escolheu andar de bicicleta e quanto tempo usa?
Pessoa B: Essa bicicleta não é minha, não é emprestada.
Pessoa A: Mas você escolheu por quê? Por graça do locomotor? Por lazer?
Pessoa B: Mais pra ir na minha casa.
Pessoa A: Entendi. Qual o principal problema que você vê andando de bicicleta nas ruas?
Pessoa B: É, os carros não respeitam, né?
Pessoa A: Sim. Você tem medo de sofrer acidente?
Pessoa B: Tenho.
Pessoa A: Já sofreu algum?
Pessoa B: Não.
Pessoa A: Você gostaria de trocar a bicicleta por algum outro transporte?
Pessoa B: Sim.
Pessoa A: Qual?
Pessoa B: Moto.
Pessoa A: Existe alguma rua que você gostaria de ter uma ciclovia? Aqui, por onde você anda, ou em outro lugar?
Pessoa B: Por aqui mesmo. Pronto.",00000030-AUDIO-2025-10-30-11-39-52,Thiago Barbosa da Silva,18,Masculino,Mais pra ir na minha casa.,"Essa bicicleta não é minha, não é emprestada.","É, os carros não respeitam, né? Sim.",Você tem medo de sofrer acidente? Tenho.,Já sofreu algum? Não.,Você gostaria de trocar a bicicleta por algum outro transporte? Sim. Qual? Moto.,"Existe alguma rua que você gostaria de ter uma ciclovia? Aqui, por onde você anda, ou em outro lugar? Por aqui mesmo. Pronto.",Praticidade e conveniência,,Desrespeito dos motoristas ou Trânsito,"Sim, tenho medo de acidentes",Não,"Sim, por uma moto"
"Qual o seu nome e a sua idade, por favor? Sou Fiat, tenho 12 anos. Show! Por que você escolheu andar de bicicleta e faz quanto tempo? Ah, tipo, acho que já faz uns dois, três anos. É porque eu gosto, sabe? E eu também ajudo minha mãe, aí eu sempre vou com ela. Ai, que legal! Qual o principal problema que tu enfrenta ao andar de bicicleta? É porque é muito carro, moto, aí às vezes é um. Pouco difícil pra mim. Sim. Você tem medo de sofrer acidente? É, tenho. Já sofreu algum? Não. Sei. Você gostaria de trocar a bicicleta por outro meio de transporte. Quando crescer? Ah, por uma. Moto, assim. Massa. Existe alguma rua que você gostaria que tivesse uma ciclofaixa? Fortaleza? Tipo assim, nessa rua que o pessoal vai embora pra escola, que é mais perigoso, que passa muito carro. Tá certo. Muito obrigada. Obrigada.","Pessoa A: Qual o seu nome e a sua idade, por favor?
Pessoa B: Sou Fiat, tenho 12 anos.
Pessoa A: Show! Por que você escolheu andar de bicicleta e faz quanto tempo?
Pessoa B: Ah, tipo, acho que já faz uns dois, três anos. É porque eu gosto, sabe? E eu também ajudo minha mãe, aí eu sempre vou com ela.
Pessoa A: Ai, que legal! Qual o principal problema que tu enfrenta ao andar de bicicleta?
Pessoa B: É porque é muito carro, moto, aí às vezes é um.
Pessoa A: Pouco difícil pra mim.
Pessoa B: Sim.
Pessoa A: Você tem medo de sofrer acidente? É, tenho. Já sofreu algum?
Pessoa B: Não.
Pessoa A: Sei. Você gostaria de trocar a bicicleta por outro meio de transporte.
Pessoa B: Quando crescer?
Pessoa A: Ah, por uma.
Pessoa B: Moto, assim.
Pessoa A: Massa. Existe alguma rua que você gostaria que tivesse uma ciclofaixa? Fortaleza?
Pessoa B: Tipo assim, nessa rua que o pessoal vai embora pra escola, que é mais perigoso, que passa muito carro.
Pessoa A: Tá certo. Muito obrigada.
Pessoa B: Obrigada.",00000031-AUDIO-2025-10-30-11-39-56,Fiat,12 anos,Masculino,"É porque eu gosto, sabe? E eu também ajudo minha mãe, aí eu sempre vou com ela.","Ah, tipo, acho que já faz uns dois, três anos.","É porque é muito carro, moto, aí às vezes é um. Pouco difícil pra mim. Sim.","Você tem medo de sofrer acidente? É, tenho. Já sofreu algum? Não.",Já sofreu algum? Não.,"Você gostaria de trocar a bicicleta por outro meio de transporte. Quando crescer? Ah, por uma. Moto, assim. Massa.","Existe alguma rua que você gostaria que tivesse uma ciclofaixa? Fortaleza? Tipo assim, nessa rua que o pessoal vai embora pra escola, que é mais perigoso, que passa muito carro.",Preferência pessoal,Entre 2 e 3 anos,Desrespeito dos motoristas ou Trânsito,"Sim, tenho medo de acidentes",Não,"Sim, por uma moto"
"Qual a sua idade, por favor? Francisca D'Ayrton Lares de Mello, tenho 47 anos. Por que você escolheu andar de bicicleta e faz quanto tempo? Desde pequeno. Qual o principal problema que você encontra ao andar de bicicleta em Fortaleza? É só o trânsito mesmo. O carro, o moto, as coisas. Não respeito. Você tem medo de sofrer acidente? Lógico. Quem é que não tem? Já sofreu algum? Não. Você gostaria de trocar a bicicleta por outro meio de transporte? Pra trabalho, sim. Certo. Existe alguma rua em Fortaleza que você gostaria que tivesse uma ciclofaixa? Que ainda não tem? Não, não me recordo agora, não. Tá bom, muito obrigada.","Pessoa A: Qual a sua idade, por favor?
Pessoa B: Francisca D'Ayrton Lares de Mello, tenho 47 anos.
Pessoa A: Por que você escolheu andar de bicicleta e faz quanto tempo?
Pessoa B: Desde pequeno.
Pessoa A: Qual o principal problema que você encontra ao andar de bicicleta em Fortaleza?
Pessoa B: É só o trânsito mesmo. O carro, o moto, as coisas. Não respeito.
Pessoa A: Você tem medo de sofrer acidente?
Pessoa B: Lógico. Quem é que não tem?
Pessoa A: Já sofreu algum?
Pessoa B: Não.
Pessoa A: Você gostaria de trocar a bicicleta por outro meio de transporte?
Pessoa B: Pra trabalho, sim.
Pessoa A: Certo. Existe alguma rua em Fortaleza que você gostaria que tivesse uma ciclofaixa? Que ainda não tem?
Pessoa B: Não, não me recordo agora, não.
Pessoa A: Tá bom, muito obrigada.",00000032-AUDIO-2025-10-30-11-47-17,Francisca D'Ayrton Lares de Mello,47 anos,Feminino,Desde pequeno.,Desde pequeno.,"É só o trânsito mesmo. O carro, o moto, as coisas. Não respeito.",Você tem medo de sofrer acidente? Lógico. Quem é que não tem?,Já sofreu algum? Não.,"Você gostaria de trocar a bicicleta por outro meio de transporte? Pra trabalho, sim.","Existe alguma rua em Fortaleza que você gostaria que tivesse uma ciclofaixa? Que ainda não tem? Não, não me recordo agora, não.",Preferência pessoal,Mais de 5 anos,Desrespeito dos motoristas ou Trânsito,"Sim, tenho medo de acidentes",Não,"Sim, mas não especifica qual meio"
