text,conversation,file,nome,idade,gênero,por_que_escolheu_andar_de_bicicleta?,ha_quanto_tempo_utiliza?,qual_e_o_principal_problema_que_voce_enfrenta_ao_andar_de_bicicleta_em_fortaleza,tem_medo_de_sofrer_acidentes_andando_de_bicicleta_em_Fortaleza?,sofreu_algum_acidente_no_último_ano?,gostaria_de_trocar_a_bicicleta_por_outro_meio_de_transporte,existe_alguma_rua_em_fortaleza_em_que_gostaria_de_ver_uma_ciclovia,por_que_escolheu_ou_escolhe_andar_de_bicicleta_agrupado,ha_quanto_tempo_utiliza_agrupado,qual_e_o_principal_problema_que_voce_enfrenta_ao_andar_de_bicicleta_em_fortaleza_agrupado,tem_medo_de_sofrer_acidentes_andando_de_bicicleta_em_Fortaleza_agrupado,sofreu_algum_acidente_no_último_ano_agrupado,gostaria_de_trocar_a_bicicleta_por_outro_meio_de_transporte_agrupado
"Nome e idade? Gabriel, tenho 21 anos. Certo. Por que você escolheu andar de bicicleta e quanto tempo você utiliza, mais ou menos? Eu utilizo dia todo, noite, porque vai bem a saúde, o esporte mesmo. Qual o principal problema que você enfrenta ao andar de bicicleta aqui? Nenhum. Nenhum problema. Só em termos das faixas, né? De ciclovia que tem que ser mais voltado nas avenidas. Você tem medo de sofrer algum tipo de acidente andando de bicicleta? Sim, tenho. Dos carros. Dos carros, né? É. Você já sofreu algum acidente? Não. Não? Ainda bem. Você gostaria de trocar a bicicleta por algum outro meio de transporte ou satisfeito? Não, satisfeito com a bicicleta. Ótimo. Existe alguma rua em Fortaleza que você gostaria de ter ciclovia? Não. Todos os cantos em Fortaleza deveriam ter, né? Pelo céu? Sim. Mas pelos locais que você anda, já tem. Já tem. Sério. Pronto, é isso.","Pessoa A: Nome e idade?
Pessoa B: Gabriel, tenho 21 anos.
Pessoa A: Certo. Por que você escolheu andar de bicicleta e quanto tempo você utiliza, mais ou menos?
Pessoa B: Eu utilizo dia todo, noite, porque vai bem a saúde, o esporte mesmo.
Pessoa A: Qual o principal problema que você enfrenta ao andar de bicicleta aqui?
Pessoa B: Nenhum. Nenhum problema. Só em termos das faixas, né? De ciclovia que tem que ser mais voltado nas avenidas.
Pessoa A: Você tem medo de sofrer algum tipo de acidente andando de bicicleta?
Pessoa B: Sim, tenho. Dos carros.
Pessoa A: Dos carros, né?
Pessoa B: É.
Pessoa A: Você já sofreu algum acidente?
Pessoa B: Não.
Pessoa A: Não? Ainda bem. Você gostaria de trocar a bicicleta por algum outro meio de transporte ou satisfeito?
Pessoa B: Não, satisfeito com a bicicleta.
Pessoa A: Ótimo. Existe alguma rua em Fortaleza que você gostaria de ter ciclovia?
Pessoa B: Não. Todos os cantos em Fortaleza deveriam ter, né? Pelo céu?
Pessoa A: Sim. Mas pelos locais que você anda, já tem.
Pessoa B: Já tem.
Pessoa A: Sério. Pronto, é isso.",00000005-AUDIO-2025-10-30-10-45-50,Gabriel,21 anos,Masculino,"Eu utilizo dia todo, noite, porque vai bem a saúde, o esporte mesmo.","Eu utilizo dia todo, noite, porque vai bem a saúde, o esporte mesmo.","Nenhum. Nenhum problema. Só em termos das faixas, né? De ciclovia que tem que ser mais voltado nas avenidas.","Sim, tenho. Dos carros.",Você já sofreu algum acidente? Não. Não? Ainda bem.,"Não, satisfeito com a bicicleta.","Existe alguma rua em Fortaleza que você gostaria de ter ciclovia? Não. Todos os cantos em Fortaleza deveriam ter, né? Pelo céu? Sim. Mas pelos locais que você anda, já tem. Já tem.",Exercício e saúde,,Falta de ciclovias,"Sim, tenho medo de acidentes",Não,Não
"Qual o seu nome e sua idade? Simone. A idade? 39. Por que você escolheu andar de bicicleta e quanto tempo mais ou menos utiliza? É mais rápida e. Evita. Muito constrangimento no trânsito. Sim. Você já utiliza há muito tempo? Muito tempo. Qual o principal problema que você enfrenta ao andar de bicicleta? Mais na sinalização do semáforo. Você tem medo de sofrer acidente andando de bicicleta? Sim. Você já sofreu um acidente? De bicicleta, não. Graças a Deus, né? Você gostaria de trocar a bicicleta por algum outro meio de transporte? Não. E existe alguma rua em Fortaleza que você gostaria de ter uma ciclovia? Você anda assim, sente falta? Sim, principalmente na faixa de onde passam os colégios e tem muita movimentação na hora de pegar a criança e de deixar. Eu vi que tem bastante. É. Pronto, é isso.","Pessoa A: Qual o seu nome e sua idade?
Pessoa B: Simone.
Pessoa A: A idade?
Pessoa B: 39.
Pessoa A: Por que você escolheu andar de bicicleta e quanto tempo mais ou menos utiliza?
Pessoa B: É mais rápida e.
Pessoa A: Evita.
Pessoa B: Muito constrangimento no trânsito.
Pessoa A: Sim. Você já utiliza há muito tempo?
Pessoa B: Muito tempo.
Pessoa A: Qual o principal problema que você enfrenta ao andar de bicicleta?
Pessoa B: Mais na sinalização do semáforo.
Pessoa A: Você tem medo de sofrer acidente andando de bicicleta? Sim. Você já sofreu um acidente?
Pessoa B: De bicicleta, não.
Pessoa A: Graças a Deus, né? Você gostaria de trocar a bicicleta por algum outro meio de transporte?
Pessoa B: Não.
Pessoa A: E existe alguma rua em Fortaleza que você gostaria de ter uma ciclovia? Você anda assim, sente falta?
Pessoa B: Sim, principalmente na faixa de onde passam os colégios e tem muita movimentação na hora de pegar a criança e de deixar.
Pessoa A: Eu vi que tem bastante. É. Pronto, é isso.",00000006-AUDIO-2025-10-30-10-47-13,Simone,39,Feminino,É mais rápida e. Evita. Muito constrangimento no trânsito. Sim.,Muito tempo.,Mais na sinalização do semáforo.,Você tem medo de sofrer acidente andando de bicicleta? Sim.,"Você já sofreu um acidente? De bicicleta, não. Graças a Deus, né?",Você gostaria de trocar a bicicleta por algum outro meio de transporte? Não.,"Sim, principalmente na faixa de onde passam os colégios e tem muita movimentação na hora de pegar a criança e de deixar.",Rapidez \ Tempo; Segurança no trânsito,Mais de 5 anos,Sinalização inadequada,"Sim, tenho medo de acidentes",Não,Não
"Qual é o teu nome e idade? Francisca Janieri, idade 13 anos. Por que tu escolheu andar de bicicleta e a quanto tempo tu utiliza? Desde novinho que eu ando de bicicleta. Eu gosto de andar de bicicleta, eu acho muito bom andar de bicicleta. E qual o principal problema que tu enfrenta ao andar de bicicleta em Porto Alegre? Trânsito. Trânsito. E com relação a criança? Tem algum problema também? Tem. É, porque às vezes ele anda aqui ó, é muito complicado andar com ele aqui na frente. E tu tem medo de sofrer acidente? Sim, com certeza. Já sofreu algum acidente no último ano? Não, graças a Deus não. E tu gostaria de trocar de bicicleta para outro meio de transporte? Não. Não. E existe alguma rua aqui em Fortaleza que você gostaria que tivesse que ouvir? Não, eu não conheço muito aqui, que eu moro há pouco tempo. Tá. Perfeito. Obrigado, viu?","Pessoa A: Qual é o teu nome e idade?
Pessoa B: Francisca Janieri, idade 13 anos.
Pessoa A: Por que tu escolheu andar de bicicleta e a quanto tempo tu utiliza?
Pessoa B: Desde novinho que eu ando de bicicleta. Eu gosto de andar de bicicleta, eu acho muito bom andar de bicicleta.
Pessoa A: E qual o principal problema que tu enfrenta ao andar de bicicleta em Porto Alegre?
Pessoa B: Trânsito.
Pessoa A: Trânsito. E com relação a criança? Tem algum problema também?
Pessoa B: Tem. É, porque às vezes ele anda aqui ó, é muito complicado andar com ele aqui na frente.
Pessoa A: E tu tem medo de sofrer acidente?
Pessoa B: Sim, com certeza.
Pessoa A: Já sofreu algum acidente no último ano?
Pessoa B: Não, graças a Deus não.
Pessoa A: E tu gostaria de trocar de bicicleta para outro meio de transporte?
Pessoa B: Não.
Pessoa A: Não. E existe alguma rua aqui em Fortaleza que você gostaria que tivesse que ouvir?
Pessoa B: Não, eu não conheço muito aqui, que eu moro há pouco tempo.
Pessoa A: Tá. Perfeito. Obrigado, viu?",00000007-AUDIO-2025-10-30-10-48-02,Francisca Janieri,13 anos,Feminino,"Desde novinho que eu ando de bicicleta. Eu gosto de andar de bicicleta, eu acho muito bom andar de bicicleta.",Desde novinho que eu ando de bicicleta.,E qual o principal problema que tu enfrenta ao andar de bicicleta em Porto Alegre? Trânsito. Trânsito.,"E tu tem medo de sofrer acidente? Sim, com certeza.","Já sofreu algum acidente no último ano? Não, graças a Deus não.",E tu gostaria de trocar de bicicleta para outro meio de transporte? Não. Não.,"E existe alguma rua aqui em Fortaleza que você gostaria que tivesse que ouvir? Não, eu não conheço muito aqui, que eu moro há pouco tempo.",Preferência pessoal,Mais de 5 anos,Desrespeito dos motoristas ou Trânsito,"Sim, tenho medo de acidentes",Não,Não
"É rapidinho. É só o seu nome e sua idade? Pedro Vieira Moura, 37 anos. Por que você escolheu andar de bicicleta? É esporte, né? E exercício também e tudo isso. Entendi. Qual o principal problema que você enfrenta andando de bicicleta? Eu não tenho. Tenho uma ciclovia, não tenho. Você tem medo de sofrer algum acidente andando de bicicleta? Demais. Você já sofreu algum acidente? Não. Futuramente, mas por enquanto eu vou ficando na bicicleta. Entendi. E existe alguma rua em Fortaleza que você gostaria de ter uma ciclovia em específico? Não sei, eu não ando muito, só aqui mesmo na escola. Só localmente, né? Tá, tá ótimo. É isso.","Pessoa A: É rapidinho. É só o seu nome e sua idade?
Pessoa B: Pedro Vieira Moura, 37 anos.
Pessoa A: Por que você escolheu andar de bicicleta?
Pessoa B: É esporte, né? E exercício também e tudo isso.
Pessoa A: Entendi. Qual o principal problema que você enfrenta andando de bicicleta?
Pessoa B: Eu não tenho. Tenho uma ciclovia, não tenho.
Pessoa A: Você tem medo de sofrer algum acidente andando de bicicleta?
Pessoa B: Demais.
Pessoa A: Você já sofreu algum acidente?
Pessoa B: Não.
Pessoa B: Futuramente, mas por enquanto eu vou ficando na bicicleta.
Pessoa A: Entendi. E existe alguma rua em Fortaleza que você gostaria de ter uma ciclovia em específico?
Pessoa B: Não sei, eu não ando muito, só aqui mesmo na escola.
Pessoa A: Só localmente, né? Tá, tá ótimo. É isso.",00000008-AUDIO-2025-10-30-10-50-03,Pedro Vieira Moura,37 anos,Masculino,"É esporte, né? E exercício também e tudo isso.",O texto não especifica há quanto tempo a pessoa anda de bicicleta.,"Qual o principal problema que você enfrenta andando de bicicleta? Eu não tenho. Tenho uma ciclovia, não tenho.",Você tem medo de sofrer algum acidente andando de bicicleta? Demais.,Você já sofreu algum acidente? Não.,"Futuramente, mas por enquanto eu vou ficando na bicicleta.","Não sei, eu não ando muito, só aqui mesmo na escola. Só localmente, né?",Exercício e saúde,,Falta de ciclovias,"Sim, tenho medo de acidentes",Não,Não
"Qual o teu nome e idade? Fernando Marques, 32 anos. Por que tu escolheu andar de bicicleta e há quanto tempo tu utiliza? Bicicleta porque tem alguns fatores, um saúde, o outro fator sustentável, econômico, é barato. E porque a cidade ofereceu também um pouco mais de infraestrutura para a gente conseguir se deslocar. Embora ainda existam vários desafios. Qual o principal problema que tem dentro da mudança de bicicleta na Vandaleza? Uma má conservação das ciclovias e ciclofaixas e a segunda é a falta de compreensão do do usuário de veículos automotores. Em relação ao que é a bicicleta. Já que tá até no código de. Trânsito brasileiro que faz parte do trânsito, mas a galera não compreende. E com relação a criança, tem dificuldade de transportar? Justamente por essa falta de compreensão, acaba. Que a gente tem receio de andar em dias comuns com criança, porque afinal. A gente sabe que se ocorre um acidente, alguma coisa, o adulto consegue, né? É mais resistente do que a criança. Que é mais frágil, né? Mas essa é a dificuldade. Não, teria como já aconteceu, né? Não com carros, mas na própria ciclofaixa com pessoas. Mas eu digo que a gente sabe. Que a criança é mais frágil, né? Então... Eu jamais, por exemplo, ando, acho que você perguntou a quanto tempo eu ando, não sei se respondi, né? Não sei se tá aí. Mas eu ando há um bom tempo de bicicleta, já usei um ano inteiro, dois anos como ir pro trabalho, pedalando aí vários quilômetros por ano, mas eu não faria esse percurso com ela no. Dia a dia, na semana. Tu já chegou a sofrer algum acidente no último ano? Nenhum com veículos, automotores, mas já eu com pedestres, galera que corre, faz corrida na ciclofaixa, também não entende como é que funciona, né? Tu gostaria de trocar bicicleta por algum outro meio de transporte? Às vezes tenho essa necessidade, né? Por ter família também, mas se eu tivesse. Tanto condições na via como no lugar de trabalho, nos lugares de trabalho, né? Pra você arrumar um banho, se trocar, guardar a bicicleta adequadamente, troco não. E assim, teria alguma via aqui em Fortaleza? Alguma rua que tu gostaria que tivesse uma ciclovia, ciclofaixa? Que tivesse ciclovia e ciclofaixa? Eu gostaria que, pensando aqui onde eu moro, que o restante da... da Ministerral, do 3º Terminal, do Antônio Bezerra, até pelo menos a ponte, a rodoviária, tivesse ciclovisse e ciclofaixa também. Eu entendo que existe aí uma questão de administração do governo federal, né, de dirigição, mas eu acho que quando quer fazer acontecer, acontece, né? É, faz o pessoal mesmo querer. Perfeito, obrigadão, viu?","Pessoa A: Qual o teu nome e idade?
Pessoa B: Fernando Marques, 32 anos.
Pessoa A: Por que tu escolheu andar de bicicleta e há quanto tempo tu utiliza?
Pessoa B: Bicicleta porque tem alguns fatores, um saúde, o outro fator sustentável, econômico, é barato.
Pessoa B: E porque a cidade ofereceu também um pouco mais de infraestrutura para a gente conseguir se deslocar. Embora ainda existam vários desafios.
Pessoa A: Qual o principal problema que tem dentro da mudança de bicicleta na Vandaleza?
Pessoa B: Uma má conservação das ciclovias e ciclofaixas e a segunda é a falta de compreensão do do usuário de veículos automotores.
Pessoa C: Em relação ao que é a bicicleta.
Pessoa B: Já que tá até no código de.
Pessoa C: Trânsito brasileiro que faz parte do trânsito, mas a galera não compreende.
Pessoa A: E com relação a criança, tem dificuldade de transportar?
Pessoa B: Justamente por essa falta de compreensão, acaba.
Pessoa C: Que a gente tem receio de andar em dias comuns com criança, porque afinal.
Pessoa B: A gente sabe que se ocorre um acidente, alguma coisa, o adulto consegue, né? É mais resistente do que a criança.
Pessoa C: Que é mais frágil, né?
Pessoa B: Mas essa é a dificuldade. Não, teria como já aconteceu, né? Não com carros, mas na própria ciclofaixa com pessoas.
Pessoa C: Mas eu digo que a gente sabe.
Pessoa B: Que a criança é mais frágil, né?
Pessoa C: Então...
Pessoa B: Eu jamais, por exemplo, ando, acho que você perguntou a quanto tempo eu ando, não sei se respondi, né?
Pessoa C: Não sei se tá aí.
Pessoa B: Mas eu ando há um bom tempo de bicicleta, já usei um ano inteiro, dois anos como ir pro trabalho, pedalando aí vários quilômetros por ano, mas eu não faria esse percurso com ela no.
Pessoa C: Dia a dia, na semana.
Pessoa A: Tu já chegou a sofrer algum acidente no último ano?
Pessoa B: Nenhum com veículos, automotores, mas já eu com pedestres, galera que corre, faz corrida na ciclofaixa, também não entende como é que funciona, né?
Pessoa A: Tu gostaria de trocar bicicleta por algum outro meio de transporte?
Pessoa B: Às vezes tenho essa necessidade, né? Por ter família também, mas se eu tivesse.
Pessoa B: Tanto condições na via como no lugar de trabalho, nos lugares de trabalho, né? Pra você arrumar um banho, se trocar, guardar a bicicleta adequadamente, troco não.
Pessoa A: E assim, teria alguma via aqui em Fortaleza? Alguma rua que tu gostaria que tivesse uma ciclovia, ciclofaixa?
Pessoa B: Que tivesse ciclovia e ciclofaixa? Eu gostaria que, pensando aqui onde eu moro, que o restante da... da Ministerral, do 3º Terminal, do Antônio Bezerra, até pelo menos a ponte, a rodoviária, tivesse ciclovisse e ciclofaixa também. Eu entendo que existe aí uma questão de administração do governo federal, né, de dirigição, mas eu acho que quando quer fazer acontecer, acontece, né?
Pessoa C: É, faz o pessoal mesmo querer.
Pessoa A: Perfeito, obrigadão, viu?",00000009-AUDIO-2025-10-30-10-51-39,Fernando Marques,32 anos,Masculino,"Bicicleta porque tem alguns fatores, um saúde, o outro fator sustentável, econômico, é barato. E porque a cidade ofereceu também um pouco mais de infraestrutura para a gente conseguir se deslocar. Embora ainda existam vários desafios.","Eu ando há um bom tempo de bicicleta, já usei um ano inteiro, dois anos como ir pro trabalho, pedalando aí vários quilômetros por ano.",Uma má conservação das ciclovias e ciclofaixas e a segunda é a falta de compreensão do do usuário de veículos automotores.,"Justamente por essa falta de compreensão, acaba. Que a gente tem receio de andar em dias comuns com criança, porque afinal. A gente sabe que se ocorre um acidente, alguma coisa, o adulto consegue, né? É mais resistente do que a criança. Que é mais frágil, né? Mas essa é a dificuldade.","Nenhum com veículos, automotores, mas já eu com pedestres, galera que corre, faz corrida na ciclofaixa, também não entende como é que funciona, né?","Às vezes tenho essa necessidade, né? Por ter família também, mas se eu tivesse. Tanto condições na via como no lugar de trabalho, nos lugares de trabalho, né? Pra você arrumar um banho, se trocar, guardar a bicicleta adequadamente, troco não.","Eu gostaria que, pensando aqui onde eu moro, que o restante da... da Ministerral, do 3º Terminal, do Antônio Bezerra, até pelo menos a ponte, a rodoviária, tivesse ciclovisse e ciclofaixa também.",Exercício e saúde;Custo \ É mais barato;Praticidade e conveniência,Entre 2 e 3 anos,Má qualidade das ciclovias; Desrespeito dos motoristas ou Trânsito,"Sim, tenho medo de acidentes",Sim,Não
"Qual o seu nome e sua idade? Francisco, tenho uns 55 anos. Por que você escolheu. Andar de bicicleta e há quanto tempo mais ou menos utiliza? Ah, faz uns 40 anos. Você escolheu por quê? É porque é um meio. De transporte muito ágil, né? Entendi. Qual é o principal problema que você enfrenta ao andar de bicicleta em Fortaleza? É as buraqueiras aí da pista, as buraqueiras. Você sente alguma dificuldade a mais andando com a criança na bicicleta? É um pouco, né? Exatamente por causa dessas buraqueiras aí que existem. Você tem medo de sofrer algum acidente andando de bicicleta? Sim, com certeza. Já sofreu algum? Não, graças a Deus, não. Você gostaria de trocar bicicleta por algum outro meio de transporte? Não, eu gostaria de trocar por outra bicicleta mais melhor, né? Que é a minha. Entendi. Existe algum ângulo que você gostaria de ter uma ciclovia? Eu vou morar hoje.","Pessoa B: Qual o seu nome e sua idade?
Pessoa A: Francisco, tenho uns 55 anos.
Pessoa B: Por que você escolheu.
Pessoa C: Andar de bicicleta e há quanto tempo mais ou menos utiliza?
Pessoa A: Ah, faz uns 40 anos.
Pessoa B: Você escolheu por quê? É porque é um meio.
Pessoa A: De transporte muito ágil, né?
Pessoa B: Entendi.
Pessoa C: Qual é o principal problema que você enfrenta ao andar de bicicleta em Fortaleza?
Pessoa A: É as buraqueiras aí da pista, as buraqueiras.
Pessoa C: Você sente alguma dificuldade a mais andando com a criança na bicicleta?
Pessoa A: É um pouco, né? Exatamente por causa dessas buraqueiras aí que existem.
Pessoa C: Você tem medo de sofrer algum acidente andando de bicicleta?
Pessoa A: Sim, com certeza.
Pessoa C: Já sofreu algum?
Pessoa A: Não, graças a Deus, não.
Pessoa B: Você gostaria de trocar bicicleta por algum outro meio de transporte?
Pessoa A: Não, eu gostaria de trocar por outra bicicleta mais melhor, né? Que é a minha.
Pessoa B: Entendi. Existe algum ângulo que você gostaria de ter uma ciclovia?
Pessoa A: Eu vou morar hoje.",00000010-AUDIO-2025-10-30-10-51-56,Francisco,55 anos,Masculino,"É porque é um meio. De transporte muito ágil, né?","há quanto tempo mais ou menos utiliza? Ah, faz uns 40 anos.","É as buraqueiras aí da pista, as buraqueiras.","Você tem medo de sofrer algum acidente andando de bicicleta? Sim, com certeza.","Não, graças a Deus, não.","Você gostaria de trocar bicicleta por algum outro meio de transporte? Não, eu gostaria de trocar por outra bicicleta mais melhor, né? Que é a minha.",Existe algum ângulo que você gostaria de ter uma ciclovia? Eu vou morar hoje.,Rapidez \ Tempo,Mais de 5 anos,Buracos na ciclovia,"Sim, tenho medo de acidentes",Não,"Sim, por uma bicicleta melhor"
"Qual o seu nome e sua idade? Jusceline Rodrigues Oliveira, eu tenho 28 anos. Por que você escolheu andar de bicicleta e há quanto tempo mais ou menos utiliza? É bastante tempo, em torno de uns 10 anos andando de bicicleta. Por que você escolheu a bicicleta? Porque é um trajeto melhor de andar. Mais rápido. Qual o principal problema que você enfrenta andando de bicicleta? Que os carros e as... que querem passar por cima da gente. Não dá pra ficar respondo ao bicicleta. Por respeito, né? É. Você tem medo de sofrer acidentes andando no bicicleta? Sim. Já sofreu algum? Não. Você gostaria de trocar bicicleta por algum outro meio de transporte? Por a rapidez, às vezes sim, mas não trocaria, eu acho. Existe alguma rua que você gostaria de ver uma ciclovia? Sim. Podia até ser essa daqui, essa daqui era o detalhe do. Socoleta, da Popsicle. Entendi. Pronto, é só isso.","Pessoa A: Qual o seu nome e sua idade?
Pessoa B: Jusceline Rodrigues Oliveira, eu tenho 28 anos.
Pessoa A: Por que você escolheu andar de bicicleta e há quanto tempo mais ou menos utiliza?
Pessoa B: É bastante tempo, em torno de uns 10 anos andando de bicicleta.
Pessoa A: Por que você escolheu a bicicleta?
Pessoa B: Porque é um trajeto melhor de andar.
Pessoa A: Mais rápido. Qual o principal problema que você enfrenta andando de bicicleta?
Pessoa B: Que os carros e as... que querem passar por cima da gente. Não dá pra ficar respondo ao bicicleta.
Pessoa A: Por respeito, né?
Pessoa B: É.
Pessoa A: Você tem medo de sofrer acidentes andando no bicicleta?
Pessoa B: Sim.
Pessoa A: Já sofreu algum?
Pessoa B: Não.
Pessoa A: Você gostaria de trocar bicicleta por algum outro meio de transporte?
Pessoa B: Por a rapidez, às vezes sim, mas não trocaria, eu acho.
Pessoa A: Existe alguma rua que você gostaria de ver uma ciclovia?
Pessoa B: Sim.
Pessoa A: Podia até ser essa daqui, essa daqui era o detalhe do.
Pessoa B: Socoleta, da Popsicle. Entendi.
Pessoa A: Pronto, é só isso.",00000011-AUDIO-2025-10-30-10-54-34,Jusceline Rodrigues Oliveira,28 anos,Feminino,Porque é um trajeto melhor de andar. Mais rápido.,"É bastante tempo, em torno de uns 10 anos andando de bicicleta.","Que os carros e as... que querem passar por cima da gente. Não dá pra ficar respondo ao bicicleta. Por respeito, né?",Você tem medo de sofrer acidentes andando no bicicleta? Sim. Já sofreu algum? Não.,Já sofreu algum? Não.,"Você gostaria de trocar bicicleta por algum outro meio de transporte? Por a rapidez, às vezes sim, mas não trocaria, eu acho.","Existe alguma rua que você gostaria de ver uma ciclovia? Sim. Podia até ser essa daqui, essa daqui era o detalhe do. Socoleta, da Popsicle.",Rapidez \ Tempo; Preferência pessoal,Mais de 5 anos,Desrespeito dos motoristas ou Trânsito; Risco de acidentes,"Sim, tenho medo de acidentes",Não,Não
