text,conversation,file,nome,idade,gênero,por_que_escolheu_andar_de_bicicleta?,ha_quanto_tempo_utiliza?,qual_e_o_principal_problema_que_voce_enfrenta_ao_andar_de_bicicleta_em_fortaleza,tem_medo_de_sofrer_acidentes_andando_de_bicicleta_em_Fortaleza?,sofreu_algum_acidente_no_último_ano?,gostaria_de_trocar_a_bicicleta_por_outro_meio_de_transporte,existe_alguma_rua_em_fortaleza_em_que_gostaria_de_ver_uma_ciclovia,por_que_escolheu_ou_escolhe_andar_de_bicicleta_agrupado,ha_quanto_tempo_utiliza_agrupado,qual_e_o_principal_problema_que_voce_enfrenta_ao_andar_de_bicicleta_em_fortaleza_agrupado,tem_medo_de_sofrer_acidentes_andando_de_bicicleta_em_Fortaleza_agrupado,sofreu_algum_acidente_no_último_ano_agrupado,gostaria_de_trocar_a_bicicleta_por_outro_meio_de_transporte_agrupado
"Qual é o seu nome e sua idade? Marcos, 51 anos. Por que você escolheu andar de bicicleta e quanto tempo utiliza? Eu utilizo desde novo, né? Porque a saudade, hoje em dia, a gente vai ficando velho, a saúde vai indo-se embora. E o que a gente puder fazer de exercício pra melhorar a saúde, é bem-vindo, né? É, com certeza. Qual é o principal problema que você enfrenta ao andar de bicicleta? Tô nas pernas. A idade quando chega, aí o que tá melhorando as dores é tá pedalando. Entendi. E nas ruas, sinalização, alguma coisa assim? Não, até que tá bem, graças a Deus hoje tá muita faixa de bicicleta aí que tá ajudando muita gente que é ciclista. Você. Tem medo de sofrer acidente? Sim, sim, com certeza. Já sofreu algum? Já, mas graças a Deus não foi caso sério não, né? Foi só a mesma coisa. Foi onde eu sofri o acidente não tinha faixa de bicicleta, por isso que ocasionou o acidente, né? Sinto muito. Você gostaria de tracar a bicicleta por algum outro transporte? Se você dissesse que não, eu estaria mentindo. Um carro seria melhor, né? Mas já que não pode, vamos exercer a saúde na bicicleta mesmo. Justo. E existe alguma rua que você gostaria de ter ciclovia? Hoje. Em dia, as principais aqui no bairro aqui estão todas com ciclovia, está ótimo. Muito obrigada, viu?","Pessoa B: Qual é o seu nome e sua idade?
Pessoa A: Marcos, 51 anos.
Pessoa B: Por que você escolheu andar de bicicleta e quanto tempo utiliza?
Pessoa A: Eu utilizo desde novo, né? Porque a saudade, hoje em dia, a gente vai ficando velho, a saúde vai indo-se embora. E o que a gente puder fazer de exercício pra melhorar a saúde, é bem-vindo, né?
Pessoa B: É, com certeza. Qual é o principal problema que você enfrenta ao andar de bicicleta?
Pessoa A: Tô nas pernas. A idade quando chega, aí o que tá melhorando as dores é tá pedalando.
Pessoa B: Entendi. E nas ruas, sinalização, alguma coisa assim?
Pessoa A: Não, até que tá bem, graças a Deus hoje tá muita faixa de bicicleta aí que tá ajudando muita gente que é ciclista. Você.
Pessoa B: Tem medo de sofrer acidente?
Pessoa A: Sim, sim, com certeza.
Pessoa B: Já sofreu algum?
Pessoa A: Já, mas graças a Deus não foi caso sério não, né? Foi só a mesma coisa. Foi onde eu sofri o acidente não tinha faixa de bicicleta, por isso que ocasionou o acidente, né?
Pessoa B: Sinto muito. Você gostaria de tracar a bicicleta por algum outro transporte?
Pessoa A: Se você dissesse que não, eu estaria mentindo. Um carro seria melhor, né? Mas já que não pode, vamos exercer a saúde na bicicleta mesmo.
Pessoa B: Justo. E existe alguma rua que você gostaria de ter ciclovia? Hoje.
Pessoa A: Em dia, as principais aqui no bairro aqui estão todas com ciclovia, está ótimo.
Pessoa B: Muito obrigada, viu?",00000018-AUDIO-2025-10-30-11-19-23,Marcos,51 anos,Masculino,"Eu utilizo desde novo, né? Porque a saudade, hoje em dia, a gente vai ficando velho, a saúde vai indo-se embora. E o que a gente puder fazer de exercício pra melhorar a saúde, é bem-vindo, né?",Eu utilizo desde novo,"Qual é o principal problema que você enfrenta ao andar de bicicleta? Tô nas pernas. A idade quando chega, aí o que tá melhorando as dores é tá pedalando.","Você. Tem medo de sofrer acidente? Sim, sim, com certeza.","Já sofreu algum? Já, mas graças a Deus não foi caso sério não, né? Foi só a mesma coisa. Foi onde eu sofri o acidente não tinha faixa de bicicleta, por isso que ocasionou o acidente, né?","Você gostaria de tracar a bicicleta por algum outro transporte? Se você dissesse que não, eu estaria mentindo. Um carro seria melhor, né? Mas já que não pode, vamos exercer a saúde na bicicleta mesmo.","E existe alguma rua que você gostaria de ter ciclovia? Hoje. Em dia, as principais aqui no bairro aqui estão todas com ciclovia, está ótimo.",Exercício e saúde,Mais de 5 anos,Outros obstáculos na ciclovia,"Sim, tenho medo de acidentes",Sim,"Sim, por um carro"
"Qual o seu nome e sua idade, por favor? Cícero Salles, 65 anos. Por que você escolheu andar de bicicleta e faz quanto tempo? Eu já está com mais de 20 anos que eu pedalo. O motivo é a saúde. A idade estava chegando e agora chegou de vez, né? Então a gente tem que cuidar dela, sei lá, né? E pedalar é um exercício ótimo. Eu aconselho a todos. Não é bom. Enfrenta sol. Enfrenta uma subida doida. Entendeu? Cansativo, suor. Entendeu? Mas é ótimo. Certo. O cardio agradece. Qual o principal problema que você enfrenta ao andar de bicicleta em Fortaleza? É... Invasão da ciclovia. Carro, moto... Motoqueiros. Certo. Invadem muito, mas é muito. Eu digo que eu pedalo muito. Eu acredito. Você tem medo de sofrer acidente? Tenho. Já sofreu algum? Já, já sofri um já. Uma travessia de uma parada obrigatória. A parada era obrigatória pro veículo ir passar, entendeu? E ele avançou. Ainda bem que não aconteceu nada. Você gostaria de trocar a bicicleta por outro meio de transporte? Na minha idade, não. Se fosse maior, vai aparecer, mas na minha idade, não. Prefiro a bike, é melhor. Existe alguma rua em Fortaleza que você gostaria que tivesse uma ciclovia, que ainda não tem? Ou alguma que está ruim, que iria melhorar? João Pessoa, Avenida. Não tem. É horrível pra chegar lá. Horrível, entendeu? Geralmente a gente escolhe mais a Zé Baixo, né? Que agora é outro nome. No meu tempo era Zé Baixo, agora é outro nome. Muito obrigada. Na disponha. Tamo junto. Valeu.","Pessoa A: Qual o seu nome e sua idade, por favor?
Pessoa B: Cícero Salles, 65 anos.
Pessoa A: Por que você escolheu andar de bicicleta e faz quanto tempo?
Pessoa B: Eu já está com mais de 20 anos que eu pedalo. O motivo é a saúde. A idade estava chegando e agora chegou de vez, né? Então a gente tem que cuidar dela, sei lá, né? E pedalar é um exercício ótimo. Eu aconselho a todos. Não é bom. Enfrenta sol. Enfrenta uma subida doida. Entendeu? Cansativo, suor. Entendeu? Mas é ótimo.
Pessoa A: Certo.
Pessoa B: O cardio agradece.
Pessoa A: Qual o principal problema que você enfrenta ao andar de bicicleta em Fortaleza?
Pessoa B: É... Invasão da ciclovia. Carro, moto... Motoqueiros.
Pessoa A: Certo.
Pessoa B: Invadem muito, mas é muito. Eu digo que eu pedalo muito.
Pessoa A: Eu acredito. Você tem medo de sofrer acidente?
Pessoa B: Tenho.
Pessoa A: Já sofreu algum?
Pessoa B: Já, já sofri um já. Uma travessia de uma parada obrigatória. A parada era obrigatória pro veículo ir passar, entendeu? E ele avançou. Ainda bem que não aconteceu nada.
Pessoa A: Você gostaria de trocar a bicicleta por outro meio de transporte?
Pessoa B: Na minha idade, não. Se fosse maior, vai aparecer, mas na minha idade, não. Prefiro a bike, é melhor.
Pessoa A: Existe alguma rua em Fortaleza que você gostaria que tivesse uma ciclovia, que ainda não tem? Ou alguma que está ruim, que iria melhorar?
Pessoa B: João Pessoa, Avenida. Não tem. É horrível pra chegar lá. Horrível, entendeu? Geralmente a gente escolhe mais a Zé Baixo, né? Que agora é outro nome. No meu tempo era Zé Baixo, agora é outro nome.
Pessoa A: Muito obrigada.
Pessoa B: Na disponha. Tamo junto. Valeu.",00000019-AUDIO-2025-10-30-11-20-33,Cícero Salles,65 anos,Masculino,"O motivo é a saúde. A idade estava chegando e agora chegou de vez, né? Então a gente tem que cuidar dela, sei lá, né? E pedalar é um exercício ótimo. Eu aconselho a todos.",Eu já está com mais de 20 anos que eu pedalo.,"Qual o principal problema que você enfrenta ao andar de bicicleta em Fortaleza? É... Invasão da ciclovia. Carro, moto... Motoqueiros. Certo. Invadem muito, mas é muito.",Você tem medo de sofrer acidente? Tenho.,"Já, já sofri um já. Uma travessia de uma parada obrigatória. A parada era obrigatória pro veículo ir passar, entendeu? E ele avançou. Ainda bem que não aconteceu nada. (O texto confirma que ele sofreu um acidente, mas não especifica se foi no último ano.)","Você gostaria de trocar a bicicleta por outro meio de transporte? Na minha idade, não. Se fosse maior, vai aparecer, mas na minha idade, não. Prefiro a bike, é melhor.","Existe alguma rua em Fortaleza que você gostaria que tivesse uma ciclovia, que ainda não tem? Ou alguma que está ruim, que iria melhorar? João Pessoa, Avenida. Não tem. É horrível pra chegar lá. Horrível, entendeu? Geralmente a gente escolhe mais a Zé Baixo, né? Que agora é outro nome. No meu tempo era Zé Baixo, agora é outro nome.",Exercício e saúde,Mais de 5 anos,Invasão de carros ou motos na ciclovia; Desrespeito dos motoristas ou Trânsito,"Sim, tenho medo de acidentes",Sim,Não
"Qual o teu nome, tua idade? Frank, 46 anos. E por que tu escolheu andar de bicicleta e quanto tempo tu utiliza? Rapaz, é o transporte que eu tô podendo comprar no momento. Quanto tempo tu anda de bicicleta? Já tá com 5 anos já. Qual o principal problema que tu enfrenta em andar de bicicleta? Rapaz, às vezes o trânsito. Os carros não respeitam a retidão. Com criança tu aumenta essa dificuldade? Oi? Com criança tu aumenta essa dificuldade? Não, não, não. Tranquilidade. Tem medo de sofrer algum acidente na linha de bicicleta? Rapaz, eu evito muito, né? A gente tem que... E já sofreu algum acidente nesse último ano? Não, graças a Deus, não. Nem pra tempo. Você gostaria de trocar a bicicleta pro outro meio? Eu vou comprar uma motinha, se Deus quiser. E tem alguma rua aqui em Fortaleza que você gostaria que tivesse na ciclovia, ciclofaixa? Oi? Aqui já tá quase tudo pavimentadozinho, né? Divertido, né? Tá. Perfeito. Valeu, obrigado.","Pessoa A: Qual o teu nome, tua idade?
Pessoa B: Frank, 46 anos.
Pessoa A: E por que tu escolheu andar de bicicleta e quanto tempo tu utiliza?
Pessoa B: Rapaz, é o transporte que eu tô podendo comprar no momento.
Pessoa A: Quanto tempo tu anda de bicicleta?
Pessoa B: Já tá com 5 anos já.
Pessoa A: Qual o principal problema que tu enfrenta em andar de bicicleta?
Pessoa B: Rapaz, às vezes o trânsito. Os carros não respeitam a retidão.
Pessoa A: Com criança tu aumenta essa dificuldade?
Pessoa B: Oi?
Pessoa A: Com criança tu aumenta essa dificuldade?
Pessoa B: Não, não, não. Tranquilidade.
Pessoa A: Tem medo de sofrer algum acidente na linha de bicicleta?
Pessoa B: Rapaz, eu evito muito, né? A gente tem que...
Pessoa A: E já sofreu algum acidente nesse último ano?
Pessoa B: Não, graças a Deus, não. Nem pra tempo.
Pessoa A: Você gostaria de trocar a bicicleta pro outro meio?
Pessoa B: Eu vou comprar uma motinha, se Deus quiser.
Pessoa A: E tem alguma rua aqui em Fortaleza que você gostaria que tivesse na ciclovia, ciclofaixa?
Pessoa B: Oi? Aqui já tá quase tudo pavimentadozinho, né? Divertido, né?
Pessoa A: Tá. Perfeito.
Pessoa B: Valeu, obrigado.",00000020-AUDIO-2025-10-30-11-21-56,Frank,46 anos,Masculino,"Rapaz, é o transporte que eu tô podendo comprar no momento.",Já tá com 5 anos já.,"Rapaz, às vezes o trânsito. Os carros não respeitam a retidão.","Tem medo de sofrer algum acidente na linha de bicicleta? Rapaz, eu evito muito, né? A gente tem que...","E já sofreu algum acidente nesse último ano? Não, graças a Deus, não. Nem pra tempo.","Você gostaria de trocar a bicicleta pro outro meio? Eu vou comprar uma motinha, se Deus quiser.","E tem alguma rua aqui em Fortaleza que você gostaria que tivesse na ciclovia, ciclofaixa? Oi? Aqui já tá quase tudo pavimentadozinho, né? Divertido, né? Tá. Perfeito.",Custo \ É mais barato,Mais de 5 anos,Desrespeito dos motoristas ou Trânsito,"Sim, tenho medo de acidentes",Não,"Sim, por uma moto"
"Qual o seu nome e sua idade? Meu nome é Luana e eu tenho 36 anos. Por que você escolheu andar de bicicleta e quanto tempo utiliza, mais ou menos? Desde meus 12 anos. É bom porque dá pra ir mais longe, com mais segurança, né? A gente também tem a questão da saúde, né, que é importante. Qual o principal problema que você enfrenta ao andar de bicicleta? É a falta de consciência do povo que anda de carro, né? Que a gente não respeita, né? Não respeita a gente. Você. Anda com as crianças também na bicicleta? Você leva eles? Ando com o meu filho. Você acha que tem mais problemas andando com a criança? Mais obstáculos? Sim, mais obstáculos. Você tem medo de sofrer acidente andando de bicicleta? Tenho. Já sofreu algum? Só. Queda mesmo. Uma. Barroada, não entendo nada, graças a Deus. Você gostaria de trocar a bicicleta por algum outro transporte? Não, eu tenho medo. Tenho medo de andar de moto e carro, eu tenho. Existe alguma rua que você gostaria de ter uma ciclovia aqui pra onde você anda? Essa rua aí é a Major Assis, que é a rua que eu vejo. Que sempre tem acidente. A Major Assis é uma, inclusive de carro-moto, bicicleta também, muito. Tráfico de crianças vindo da escola. A Major Assis está a pré-exame. Nossa, é isso?","Pessoa A: Qual o seu nome e sua idade? Meu nome é Luana e eu tenho 36 anos. Por que você escolheu andar de bicicleta e quanto tempo utiliza, mais ou menos?
Pessoa B: Desde meus 12 anos. É bom porque dá pra ir mais longe, com mais segurança, né? A gente também tem a questão da saúde, né, que é importante.
Pessoa A: Qual o principal problema que você enfrenta ao andar de bicicleta?
Pessoa B: É a falta de consciência do povo que anda de carro, né? Que a gente não respeita, né? Não respeita a gente. Você.
Pessoa A: Anda com as crianças também na bicicleta? Você leva eles?
Pessoa B: Ando com o meu filho.
Pessoa A: Você acha que tem mais problemas andando com a criança? Mais obstáculos?
Pessoa B: Sim, mais obstáculos.
Pessoa A: Você tem medo de sofrer acidente andando de bicicleta? Tenho. Já sofreu algum? Só.
Pessoa B: Queda mesmo. Uma.
Pessoa A: Barroada, não entendo nada, graças a Deus. Você gostaria de trocar a bicicleta por algum outro transporte?
Pessoa B: Não, eu tenho medo. Tenho medo de andar de moto e carro, eu tenho.
Pessoa A: Existe alguma rua que você gostaria de ter uma ciclovia aqui pra onde você anda?
Pessoa B: Essa rua aí é a Major Assis, que é a rua que eu vejo.
Pessoa A: Que sempre tem acidente.
Pessoa B: A Major Assis é uma, inclusive de carro-moto, bicicleta também, muito.
Pessoa A: Tráfico de crianças vindo da escola.
Pessoa B: A Major Assis está a pré-exame.
Pessoa A: Nossa, é isso?",00000021-AUDIO-2025-10-30-11-24-43,Luana,36 anos,Feminino,"É bom porque dá pra ir mais longe, com mais segurança, né? A gente também tem a questão da saúde, né, que é importante.",Desde meus 12 anos.,"É a falta de consciência do povo que anda de carro, né? Que a gente não respeita, né? Não respeita a gente.",Você tem medo de sofrer acidente andando de bicicleta? Tenho.,"Já sofreu algum? Só. Queda mesmo. Uma. Barroada, não entendo nada, graças a Deus.","Você gostaria de trocar a bicicleta por algum outro transporte? Não, eu tenho medo. Tenho medo de andar de moto e carro, eu tenho.","Existe alguma rua que você gostaria de ter uma ciclovia aqui pra onde você anda? Essa rua aí é a Major Assis, que é a rua que eu vejo.",Segurança no trânsito; Exercício e saúde,Mais de 5 anos,Desrespeito dos motoristas ou Trânsito,"Sim, tenho medo de acidentes",Sim,Não
"Qual seu nome e sua idade? Antônio Patrício. 60 anos, fechado. Por que você escolheu andar de bicicleta e quanto tempo utiliza? A escolha não é obrigação, porque a gente faz transporte de entrega. Qual o principal problema que você enfrenta andando de bicicleta? Não. Não tem problema não. Pra mim, não acho. Às vezes é o trânsito mesmo. Os carros, às vezes, querem avançar pra Feliciel. A gente, na mão da gente, eles querem avançar. E... Entendi. Aí não fica ruim pra nós, né? Só isso, mas... Você tem... Entendi. Desculpa. E demais, tudo bem. Só isso mesmo. Você tem medo de sofrer acidente andando de bicicleta? Eu tô na minha razão, não tenho medo não. Tenho medo é do carro me pegar, eu tenho na minha razão. Entendeu? Só isso. Você já sofreu alguma? Não, graças a Deus não. Foi uma batidinha pouca. Só uma vez. Você gostaria de trocar bicicleta por outro meio de transporte? Não, porque. Só tem esse mesmo. Eu não sou habilitado. Eu sei dirigir carro, moto e tudo, mas não tenho habilitação aí. Entendi. Existe alguma rua que você gostaria de ter ciclovia? Aqui? Aqui? Ou em algum outro lugar também, em Fortaleza? Não, a nossa tem. Só não tem nessas fechadas aqui assim, não boto, né? Mas... Mas você gostaria que tivesse? Ah, era bom demais. Com certeza melhoraria demais pra gente. Pronto, é isso.","Pessoa B: Qual seu nome e sua idade?
Pessoa A: Antônio Patrício. 60 anos, fechado.
Pessoa B: Por que você escolheu andar de bicicleta e quanto tempo utiliza?
Pessoa A: A escolha não é obrigação, porque a gente faz transporte de entrega.
Pessoa B: Qual o principal problema que você enfrenta andando de bicicleta? Não.
Pessoa A: Não tem problema não. Pra mim, não acho. Às vezes é o trânsito mesmo. Os carros, às vezes, querem avançar pra Feliciel. A gente, na mão da gente, eles querem avançar.
Pessoa B: E... Entendi.
Pessoa A: Aí não fica ruim pra nós, né? Só isso, mas...
Pessoa B: Você tem... Entendi. Desculpa.
Pessoa A: E demais, tudo bem. Só isso mesmo.
Pessoa B: Você tem medo de sofrer acidente andando de bicicleta?
Pessoa A: Eu tô na minha razão, não tenho medo não. Tenho medo é do carro me pegar, eu tenho na minha razão. Entendeu? Só isso.
Pessoa B: Você já sofreu alguma?
Pessoa A: Não, graças a Deus não. Foi uma batidinha pouca. Só uma vez.
Pessoa B: Você gostaria de trocar bicicleta por outro meio de transporte? Não, porque.
Pessoa A: Só tem esse mesmo. Eu não sou habilitado. Eu sei dirigir carro, moto e tudo, mas não tenho habilitação aí.
Pessoa B: Entendi. Existe alguma rua que você gostaria de ter ciclovia?
Pessoa A: Aqui?
Pessoa B: Aqui? Ou em algum outro lugar também, em Fortaleza?
Pessoa A: Não, a nossa tem. Só não tem nessas fechadas aqui assim, não boto, né? Mas...
Pessoa B: Mas você gostaria que tivesse?
Pessoa A: Ah, era bom demais. Com certeza melhoraria demais pra gente.
Pessoa B: Pronto, é isso.",00000022-AUDIO-2025-10-30-11-27-10,Antônio Patrício,60 anos,Masculino,"A escolha não é obrigação, porque a gente faz transporte de entrega.","A informação sobre há quanto tempo a pessoa utiliza a bicicleta não está explícita no texto. O entrevistado responde o motivo da escolha, mas não o tempo de uso.","Às vezes é o trânsito mesmo. Os carros, às vezes, querem avançar pra Feliciel. A gente, na mão da gente, eles querem avançar. E... Entendi. Aí não fica ruim pra nós, né?","Você tem medo de sofrer acidente andando de bicicleta? Eu tô na minha razão, não tenho medo não. Tenho medo é do carro me pegar, eu tenho na minha razão. Entendeu? Só isso.","Você já sofreu alguma? Não, graças a Deus não. Foi uma batidinha pouca. Só uma vez.","Você gostaria de trocar bicicleta por outro meio de transporte? Não, porque. Só tem esse mesmo. Eu não sou habilitado. Eu sei dirigir carro, moto e tudo, mas não tenho habilitação aí.","Existe alguma rua que você gostaria de ter ciclovia? Aqui? Aqui? Ou em algum outro lugar também, em Fortaleza? Não, a nossa tem. Só não tem nessas fechadas aqui assim, não boto, né? Mas... Mas você gostaria que tivesse? Ah, era bom demais. Com certeza melhoraria demais pra gente.",Praticidade e conveniência,Não aplicável,Desrespeito dos motoristas ou Trânsito,"Sim, tenho medo de acidentes",Sim,Não
"Qual o teu nome e idade? Meu nome é Werner Estudiante de Barbosa, tenho 40 anos. E por que você escolheu andar de bicicleta e há quanto tempo tu utiliza? Faz mais de um ano, viu? Cagado. Cinco, dez anos? Mais. Mais? Qual o principal problema que tu enfrenta em Fortaleza? O pneu desenrola. Qual o principal problema que tu enfrenta a andar de bicicleta em Fortaleza? O trânsito, mano. O trânsito, os condutores. As negadas que atacam as pessoas aí. Tu tem medo de sofrer algum acidente? Já sofri. Já sofreu? Como foi? Eu fui atravessar a avenida e o cara jogou eu pro lado. Mas foi nesse último ano? Foi no meio do ano. E tu gosta de trocar bicicleta pra outro meio de transporte? Acho que não. Mais leve. Mais leve, mais rápido, né? E existe alguma rua de Fortaleza que eu tô no bairro que ele gostaria que tivesse uma ciclovias com a faixa? Aqui na Majorce já melhorou muito, né, mano? A avenida que é a principal é melhor, né? Que é onde os homens trabalham mais rápido. Show de bola. Foi isso pronto. Foi isso mesmo. Valeu. Valeu. Obrigadão, viu?","Pessoa A: Qual o teu nome e idade?
Pessoa B: Meu nome é Werner Estudiante de Barbosa, tenho 40 anos.
Pessoa A: E por que você escolheu andar de bicicleta e há quanto tempo tu utiliza?
Pessoa B: Faz mais de um ano, viu? Cagado.
Pessoa A: Cinco, dez anos?
Pessoa B: Mais.
Pessoa A: Mais? Qual o principal problema que tu enfrenta em Fortaleza?
Pessoa B: O pneu desenrola.
Pessoa A: Qual o principal problema que tu enfrenta a andar de bicicleta em Fortaleza?
Pessoa B: O trânsito, mano.
Pessoa A: O trânsito, os condutores.
Pessoa B: As negadas que atacam as pessoas aí.
Pessoa A: Tu tem medo de sofrer algum acidente?
Pessoa B: Já sofri.
Pessoa A: Já sofreu? Como foi?
Pessoa B: Eu fui atravessar a avenida e o cara jogou eu pro lado.
Pessoa A: Mas foi nesse último ano?
Pessoa B: Foi no meio do ano.
Pessoa A: E tu gosta de trocar bicicleta pra outro meio de transporte?
Pessoa B: Acho que não. Mais leve.
Pessoa A: Mais leve, mais rápido, né? E existe alguma rua de Fortaleza que eu tô no bairro que ele gostaria que tivesse uma ciclovias com a faixa?
Pessoa B: Aqui na Majorce já melhorou muito, né, mano? A avenida que é a principal é melhor, né? Que é onde os homens trabalham mais rápido.
Pessoa A: Show de bola. Foi isso pronto. Foi isso mesmo.
Pessoa B: Valeu.
Pessoa A: Valeu. Obrigadão, viu?",00000023-AUDIO-2025-10-30-11-28-05,Werner Estudiante de Barbosa,40 anos,Masculino,"Acho que não. Mais leve. Mais leve, mais rápido, né?","Faz mais de um ano, viu? Cagado. Cinco, dez anos? Mais. Mais?","O trânsito, mano. O trânsito, os condutores. As negadas que atacam as pessoas aí.",Tu tem medo de sofrer algum acidente? Já sofri.,"""Tu tem medo de sofrer algum acidente? Já sofri. Já sofreu? Como foi? Eu fui atravessar a avenida e o cara jogou eu pro lado. Mas foi nesse último ano? Foi no meio do ano.""","E tu gosta de trocar bicicleta pra outro meio de transporte? Acho que não. Mais leve. Mais leve, mais rápido, né?","Aqui na Majorce já melhorou muito, né, mano? A avenida que é a principal é melhor, né? Que é onde os homens trabalham mais rápido.",Rapidez \ Tempo,Mais de 5 anos,Desrespeito dos motoristas ou Trânsito; Medo de assaltos,"Sim, tenho medo de acidentes",Sim,Não
"Qual o seu nome e a sua idade? Meu nome é Manuel e eu tenho 11 anos. Tu anda de bicicleta há quanto tempo? Desde 2020. Por que que tu escolheu andar de bicicleta? Por causa que eu gosto muito de andar de bike. Ah, que legal. Tu tem medo de sofrer acidente? Não. Tu já sofreu algum acidente? Não. Tu gostaria de trocar a bicicleta por outro meio de transporte quando tu for adulto? Sim. Qual? É uma moto ou um carro. Legal. Aí tu gostaria que tivesse uma ciclofaixa na rua da tua casa? Uma ciclovia? Sim. Ou aqui na rua da escola? Queria muito. Certo. Tu lembra o nome dessas ruas? Lembro. Qual é o nome da rua da tua casa? Ceci Salgado. Certo. Muito obrigada. De nada.","Pessoa A: Qual o seu nome e a sua idade?
Pessoa B: Meu nome é Manuel e eu tenho 11 anos.
Pessoa A: Tu anda de bicicleta há quanto tempo?
Pessoa B: Desde 2020.
Pessoa A: Por que que tu escolheu andar de bicicleta?
Pessoa B: Por causa que eu gosto muito de andar de bike. Ah, que legal.
Pessoa A: Tu tem medo de sofrer acidente? Não. Tu já sofreu algum acidente?
Pessoa B: Não.
Pessoa A: Tu gostaria de trocar a bicicleta por outro meio de transporte quando tu for adulto?
Pessoa B: Sim.
Pessoa A: Qual?
Pessoa B: É uma moto ou um carro.
Pessoa A: Legal. Aí tu gostaria que tivesse uma ciclofaixa na rua da tua casa? Uma ciclovia?
Pessoa B: Sim.
Pessoa A: Ou aqui na rua da escola?
Pessoa B: Queria muito.
Pessoa A: Certo. Tu lembra o nome dessas ruas?
Pessoa B: Lembro.
Pessoa A: Qual é o nome da rua da tua casa?
Pessoa B: Ceci Salgado.
Pessoa A: Certo. Muito obrigada.
Pessoa B: De nada.",00000024-AUDIO-2025-10-30-11-28-13,Manuel,11 anos,Masculino,Por causa que eu gosto muito de andar de bike.,Desde 2020.,O texto não menciona explicitamente qual o principal problema enfrentado ao andar de bicicleta em Fortaleza.,Tu tem medo de sofrer acidente? Não.,Tu já sofreu algum acidente? Não.,Tu gostaria de trocar a bicicleta por outro meio de transporte quando tu for adulto? Sim. Qual? É uma moto ou um carro. Legal.,Aí tu gostaria que tivesse uma ciclofaixa na rua da tua casa? Uma ciclovia? Sim. Ou aqui na rua da escola? Queria muito.,Preferência pessoal,Entre 3 e 5 anos,,Não,Não,"Sim, por uma moto ou por um carro"
