text,conversation,file,nome,idade,gênero,por_que_escolheu_andar_de_bicicleta?,ha_quanto_tempo_utiliza?,qual_e_o_principal_problema_que_voce_enfrenta_ao_andar_de_bicicleta_em_fortaleza,tem_medo_de_sofrer_acidentes_andando_de_bicicleta_em_Fortaleza?,sofreu_algum_acidente_no_último_ano?,gostaria_de_trocar_a_bicicleta_por_outro_meio_de_transporte,existe_alguma_rua_em_fortaleza_em_que_gostaria_de_ver_uma_ciclovia,por_que_escolheu_ou_escolhe_andar_de_bicicleta_agrupado,ha_quanto_tempo_utiliza_agrupado,qual_e_o_principal_problema_que_voce_enfrenta_ao_andar_de_bicicleta_em_fortaleza_agrupado,tem_medo_de_sofrer_acidentes_andando_de_bicicleta_em_Fortaleza_agrupado,sofreu_algum_acidente_no_último_ano_agrupado,gostaria_de_trocar_a_bicicleta_por_outro_meio_de_transporte_agrupado
"Qual teu nome e idade? José Honorato. Tenho 35 anos. E por que tu escolheu andar de bicicleta e há quanto tempo tu utiliza? Eu usei desde o começo da minha vida. É bom andar de bicicleta, é um transporte mais sustentável. Qual o jogo principal, o problema que. Tu enfrenta andar de bicicleta em Fortaleza? O poder de respeito dos motores. E com. Relação ao transporte com criança, você tem dificuldades também? Não. Pra ele andar? Não. Ou transportando. Ela, com quem está aqui? Não. É um pouquinho incômodo, né? Mas é porque ele também tem, ele gosta de andar na bicicleta. E tu tem. Medo de sofrer algum acidente na bicicleta? Sempre tem, né? É perigoso. Já sofreu algum acidente? Acidente? Não. Nunca não. Graças a Deus, não. E tu gostaria de trocar a bicicleta pro outro meio de transporte? Se for pra trocar, eu procuraria por um carro, porque é mais seguro do que a rua. E existe aqui alguma rua em Fortaleza. Que você gostaria que tivesse uma ciclovia? Alguma específica aqui no bairro? Aqui tá muito bom de ciclovia, né? Mas. Essas ruas paralelas também, às vezes, não dá nem ter corrição, porque é muito estreita, né? Mas essa localização aqui era bom ter uma ciclovia, pelo menos. Tem colégio. Show de bola. Obrigadão.","Pessoa A: Qual teu nome e idade? José Honorato.
Pessoa B: Tenho 35 anos. E por que tu escolheu andar de bicicleta e há quanto tempo tu utiliza?
Pessoa A: Eu usei desde o começo da minha vida. É bom andar de bicicleta, é um transporte mais sustentável. Qual o jogo principal, o problema que.
Pessoa B: Tu enfrenta andar de bicicleta em Fortaleza?
Pessoa A: O poder de respeito dos motores.
Pessoa A: E com.
Pessoa B: Relação ao transporte com criança, você tem dificuldades também?
Pessoa A: Não. Pra ele andar? Não. Ou transportando.
Pessoa B: Ela, com quem está aqui?
Pessoa A: Não. É um pouquinho incômodo, né? Mas é porque ele também tem, ele gosta de andar na bicicleta. E tu tem.
Pessoa B: Medo de sofrer algum acidente na bicicleta?
Pessoa A: Sempre tem, né? É perigoso.
Pessoa B: Já sofreu algum acidente? Acidente?
Pessoa A: Não. Nunca não. Graças a Deus, não.
Pessoa B: E tu gostaria de trocar a bicicleta pro outro meio de transporte?
Pessoa A: Se for pra trocar, eu procuraria por um carro, porque é mais seguro do que a rua. E existe aqui alguma rua em Fortaleza.
Pessoa B: Que você gostaria que tivesse uma ciclovia? Alguma específica aqui no bairro?
Pessoa A: Aqui tá muito bom de ciclovia, né?
Pessoa B: Mas.
Pessoa A: Essas ruas paralelas também, às vezes, não dá nem ter corrição, porque é muito estreita, né? Mas essa localização aqui era bom ter uma ciclovia, pelo menos. Tem colégio.
Pessoa B: Show de bola.
Pessoa A: Obrigadão.",00000012-AUDIO-2025-10-30-10-57-15,José Honorato,35 anos,Masculino,"Eu usei desde o começo da minha vida. É bom andar de bicicleta, é um transporte mais sustentável.",Eu usei desde o começo da minha vida.,O poder de respeito dos motores.,"E tu tem. Medo de sofrer algum acidente na bicicleta? Sempre tem, né? É perigoso. Já sofreu algum acidente? Acidente? Não. Nunca não. Graças a Deus, não.","Já sofreu algum acidente? Acidente? Não. Nunca não. Graças a Deus, não.","E tu gostaria de trocar a bicicleta pro outro meio de transporte? Se for pra trocar, eu procuraria por um carro, porque é mais seguro do que a rua.","E existe aqui alguma rua em Fortaleza. Que você gostaria que tivesse uma ciclovia? Alguma específica aqui no bairro? Aqui tá muito bom de ciclovia, né? Mas. Essas ruas paralelas também, às vezes, não dá nem ter corrição, porque é muito estreita, né? Mas essa localização aqui era bom ter uma ciclovia, pelo menos. Tem colégio.",Preferência pessoal,Mais de 5 anos,Desrespeito dos motoristas ou Trânsito,"Sim, tenho medo de acidentes",Não,"Sim, por um carro"
"Qual o seu nome e a sua idade? Meu nome é Carlos Alberto Guerra Silva. Fortaleza aqui, a cidade. Não, a sua idade. A idade? 56. Por que você escolheu andar de bicicleta e quanto tempo você utiliza? Eu preciso, né? Da bicicleta, né? Tem transporte ainda normal, moto, né? E já anda há muito tempo? Ando? Faz tempo. Qual o principal problema que você enfrenta andando de bicicleta aqui em Fortaleza? É o trânsito, né? Você anda muito aqui, é muito carro, vão pegar a menina aqui, é uma traceira da nada, entendeu? Entendi. Vão me pegar ela aqui. Quem vem de lá pra cá, tem que esperar os carros virem. A gente tá com o menino aqui em cima da bicicleta, né? Essa semana eu enfrentei também um cidadão, eu ia passando assim, vindo na minha direção certa. Aí o cara ficou debochando de mim, dizendo que eu tava... Era pra mim ter parado pra ele passar de bicicleta. Não, meu amigo, a estrada é pública, é larga. Não vem carro nem do lado. Aí ele queria discutir comigo, certo? Aí eu disse, não, eu não quero conversa com o senhor, não. O senhor vai na sua mão direta e eu tô aqui, eu tô de bicicleta, não tô de carro. O senhor ficar reclamando. Aí você entendeu, né? Aí eu fui sim, embora também fui. Mas aí acontece tipo assim, que... Deus o livre. Você não vê um carro, você tem que passar na... Parar pra... Passar, né? Bicicleta. Entendeu? Não, que quase bota em cima. Da no seu veículo, entendeu? Respeito, né? Dá também. Respeito. Você acha que é mais difícil ainda com criança? Na bicicleta? É, porque você vem trazendo ela pro colégio, né? É, carro desse lado... É um... É todo jeito, entendeu? Entendi. É bicicleta e escada. Aqui tem um quebra-moto na escada também, ó. Cheio de buraco, ó. Bem assim o carro aí, ó. Ia caindo aqui dentro, ó. Entendi. Esse bicho aí, ó. Bem assim, ó. O carro voltou pra trás. Você tem medo de sofrer algum acidente andando de bicicleta? Não, eu desde 11 anos que eu ando de bicicleta, entendeu? Mas tô com 56 anos. Você já sofreu algum acidente? Eu acho bom, mas eu quero trocar pra me pegar, eu quero comprar um transporte, uma moto. Entendi. Você já sofreu algum acidente andando de bicicleta? Oi? Já sofreu algum acidente andando de bicicleta? Não, graças a Deus, não. Você gostaria de trocar por outro meio de transporte? Melhor, né? Porque eu já estou ficando na idade, né? Entendi. E melhor porque, assim, no meu trabalho, suponho, sou pedreiro. Entendi. Quando o pessoal chama um trabalho num canto longe, eu não posso ir de bicicleta. Porque essa minha perna aqui, essa minha perna aqui, eu já levei uma queda. Se eu andar demais na bicicleta, Eu sinto muito dor e eu tomo muito medicamento pra ela pra mim começar a trabalhar, a viver, né? Porque ninguém ajuda ninguém, né? Vocês sabem como é hoje em dia, né? Hoje em dia o negócio tá difícil, o dinheiro tá difícil. Eu tenho que... Entendeu? E por último, é só se existe alguma rua em Fortaleza que você gostaria de ver uma ciclovia, ciclofaixa? A ciclovia é boa, a que botaram ali. Mas eu queria mais ainda que pelo menos quando você vê na sua mão. Certa, Aqui na rua da escola, por exemplo? Não tem, hein? Não tem essa que eu via. A estrada aqui é ruim. Você vê como é que tá a estrada aí. Não é só aqui não, tem canto de outros cantos aí. Lá em casa, que eu moro na Rio e eu tava aqui, em Jardim Guanabara, a minha rua é só na pedra. O asfalto tá feio demais, entendeu?","Pessoa A: Qual o seu nome e a sua idade?
Pessoa B: Meu nome é Carlos Alberto Guerra Silva. Fortaleza aqui, a cidade.
Pessoa A: Não, a sua idade.
Pessoa B: A idade? 56.
Pessoa A: Por que você escolheu andar de bicicleta e quanto tempo você utiliza?
Pessoa B: Eu preciso, né? Da bicicleta, né? Tem transporte ainda normal, moto, né?
Pessoa A: E já anda há muito tempo?
Pessoa B: Ando? Faz tempo.
Pessoa A: Qual o principal problema que você enfrenta andando de bicicleta aqui em Fortaleza?
Pessoa B: É o trânsito, né? Você anda muito aqui, é muito carro, vão pegar a menina aqui, é uma traceira da nada, entendeu?
Pessoa A: Entendi.
Pessoa B: Vão me pegar ela aqui. Quem vem de lá pra cá, tem que esperar os carros virem. A gente tá com o menino aqui em cima da bicicleta, né? Essa semana eu enfrentei também um cidadão, eu ia passando assim, vindo na minha direção certa. Aí o cara ficou debochando de mim, dizendo que eu tava... Era pra mim ter parado pra ele passar de bicicleta. Não, meu amigo, a estrada é pública, é larga. Não vem carro nem do lado. Aí ele queria discutir comigo, certo? Aí eu disse, não, eu não quero conversa com o senhor, não. O senhor vai na sua mão direta e eu tô aqui, eu tô de bicicleta, não tô de carro. O senhor ficar reclamando. Aí você entendeu, né? Aí eu fui sim, embora também fui. Mas aí acontece tipo assim, que... Deus o livre. Você não vê um carro, você tem que passar na... Parar pra... Passar, né? Bicicleta. Entendeu? Não, que quase bota em cima. Da no seu veículo, entendeu?
Pessoa A: Respeito, né?
Pessoa B: Dá também. Respeito.
Pessoa A: Você acha que é mais difícil ainda com criança? Na bicicleta?
Pessoa B: É, porque você vem trazendo ela pro colégio, né? É, carro desse lado... É um... É todo jeito, entendeu?
Pessoa A: Entendi.
Pessoa B: É bicicleta e escada. Aqui tem um quebra-moto na escada também, ó. Cheio de buraco, ó. Bem assim o carro aí, ó. Ia caindo aqui dentro, ó. Entendi. Esse bicho aí, ó. Bem assim, ó. O carro voltou pra trás.
Pessoa A: Você tem medo de sofrer algum acidente andando de bicicleta?
Pessoa B: Não, eu desde 11 anos que eu ando de bicicleta, entendeu? Mas tô com 56 anos.
Pessoa A: Você já sofreu algum acidente?
Pessoa B: Eu acho bom, mas eu quero trocar pra me pegar, eu quero comprar um transporte, uma moto.
Pessoa A: Entendi. Você já sofreu algum acidente andando de bicicleta?
Pessoa B: Oi?
Pessoa A: Já sofreu algum acidente andando de bicicleta?
Pessoa B: Não, graças a Deus, não.
Pessoa A: Você gostaria de trocar por outro meio de transporte?
Pessoa B: Melhor, né? Porque eu já estou ficando na idade, né?
Pessoa A: Entendi.
Pessoa B: E melhor porque, assim, no meu trabalho, suponho, sou pedreiro.
Pessoa A: Entendi.
Pessoa B: Quando o pessoal chama um trabalho num canto longe, eu não posso ir de bicicleta. Porque essa minha perna aqui, essa minha perna aqui, eu já levei uma queda. Se eu andar demais na bicicleta, Eu sinto muito dor e eu tomo muito medicamento pra ela pra mim começar a trabalhar, a viver, né? Porque ninguém ajuda ninguém, né? Vocês sabem como é hoje em dia, né? Hoje em dia o negócio tá difícil, o dinheiro tá difícil. Eu tenho que... Entendeu?
Pessoa A: E por último, é só se existe alguma rua em Fortaleza que você gostaria de ver uma ciclovia, ciclofaixa?
Pessoa B: A ciclovia é boa, a que botaram ali. Mas eu queria mais ainda que pelo menos quando você vê na sua mão.
Pessoa A: Certa, Aqui na rua da escola, por exemplo?
Pessoa B: Não tem, hein? Não tem essa que eu via. A estrada aqui é ruim. Você vê como é que tá a estrada aí. Não é só aqui não, tem canto de outros cantos aí. Lá em casa, que eu moro na Rio e eu tava aqui, em Jardim Guanabara, a minha rua é só na pedra. O asfalto tá feio demais, entendeu?",00000013-AUDIO-2025-10-30-10-58-43,Carlos Alberto Guerra Silva,56,Masculino,"Eu preciso, né? Da bicicleta, né? Tem transporte ainda normal, moto, né?","Eu desde 11 anos que eu ando de bicicleta, entendeu? Mas tô com 56 anos.","Qual o principal problema que você enfrenta andando de bicicleta aqui em Fortaleza? É o trânsito, né?","Você tem medo de sofrer algum acidente andando de bicicleta? Não, eu desde 11 anos que eu ando de bicicleta, entendeu? Mas tô com 56 anos.","Já sofreu algum acidente andando de bicicleta? Oi? Já sofreu algum acidente andando de bicicleta? Não, graças a Deus, não.","Você gostaria de trocar por outro meio de transporte? Melhor, né? Porque eu já estou ficando na idade, né? Entendi. E melhor porque, assim, no meu trabalho, suponho, sou pedreiro. Entendi. Quando o pessoal chama um trabalho num canto longe, eu não posso ir de bicicleta. Porque essa minha perna aqui, essa minha perna aqui, eu já levei uma queda. Se eu andar demais na bicicleta, Eu sinto muito dor e eu tomo muito medicamento pra ela pra mim começar a trabalhar, a viver, né? Porque ninguém ajuda ninguém, né? Vocês sabem como é hoje em dia, né? Hoje em dia o negócio tá difícil, o dinheiro tá difícil. Eu tenho que... Entendeu?","A ciclovia é boa, a que botaram ali. Mas eu queria mais ainda que pelo menos quando você vê na sua mão. Certa, Aqui na rua da escola, por exemplo? Não tem, hein? Não tem essa que eu via. A estrada aqui é ruim. Você vê como é que tá a estrada aí. Não é só aqui não, tem canto de outros cantos aí. Lá em casa, que eu moro na Rio e eu tava aqui, em Jardim Guanabara, a minha rua é só na pedra. O asfalto tá feio demais, entendeu?",Única opção,Mais de 5 anos,Desrespeito dos motoristas ou Trânsito,Não,Não,"Sim, mas não especifica qual meio"
"Qual o seu nome e a sua idade? Luiz Matias de. Sousa, 53 anos. Por que você escolheu andar de bicicleta e quanto tempo faz? Ah, sempre andei. Porque eu acho mais. Saudável e às vezes até mais rápido os trajetos. Qual o principal problema que você encontra ao andar de bicicleta? Ultimamente está melhor, mas antes era muito. Sobre o trânsito, né? Era muito complicado, mas ultimamente, depois. Dessa ciclovia. Melhorou bastante. Você tem medo de sofrer acidente? Sim, já sofri até. Quer contar como foi? Você gostaria de trocar a bicicleta por outro meio de transporte? Sim, talvez, né? Existe alguma rua em Fortaleza que você gostaria que tivesse uma ciclofaixa ou ciclovica e ainda não tem? Na. Verdade por onde eu ando tem, né? Não. Sei informar sempre onde eu ando tem, né? Tá bom, obrigada!","Pessoa B: Qual o seu nome e a sua idade?
Pessoa A: Luiz Matias de.
Pessoa C: Sousa, 53 anos.
Pessoa B: Por que você escolheu andar de bicicleta e quanto tempo faz?
Pessoa C: Ah, sempre andei.
Pessoa A: Porque eu acho mais.
Pessoa C: Saudável e às vezes até mais rápido os trajetos.
Pessoa B: Qual o principal problema que você encontra ao andar de bicicleta?
Pessoa A: Ultimamente está melhor, mas antes era muito.
Pessoa C: Sobre o trânsito, né?
Pessoa A: Era muito complicado, mas ultimamente, depois.
Pessoa C: Dessa ciclovia.
Pessoa A: Melhorou bastante.
Pessoa B: Você tem medo de sofrer acidente?
Pessoa A: Sim, já sofri até.
Pessoa B: Quer contar como foi? Você gostaria de trocar a bicicleta por outro meio de transporte? Sim, talvez, né? Existe alguma rua em Fortaleza que você gostaria que tivesse uma ciclofaixa ou ciclovica e ainda não tem? Na.
Pessoa C: Verdade por onde eu ando tem, né? Não.
Pessoa A: Sei informar sempre onde eu ando tem, né?
Pessoa B: Tá bom, obrigada!",00000014-AUDIO-2025-10-30-11-01-03,Luiz Matias de Sousa,53 anos,Masculino,"Ah, sempre andei. Porque eu acho mais. Saudável e às vezes até mais rápido os trajetos.","Ah, sempre andei.","Qual o principal problema que você encontra ao andar de bicicleta? Ultimamente está melhor, mas antes era muito. Sobre o trânsito, né? Era muito complicado, mas ultimamente, depois. Dessa ciclovia. Melhorou bastante.","Você tem medo de sofrer acidente? Sim, já sofri até.","Sim, já sofri até.","Você gostaria de trocar a bicicleta por outro meio de transporte? Sim, talvez, né?","Existe alguma rua em Fortaleza que você gostaria que tivesse uma ciclofaixa ou ciclovica e ainda não tem? Na. Verdade por onde eu ando tem, né? Não. Sei informar sempre onde eu ando tem, né?",Exercício e saúde;Rapidez \ Tempo,Mais de 5 anos,Desrespeito dos motoristas ou Trânsito,"Sim, tenho medo de acidentes",Sim,"Sim, mas não especifica qual meio"
"E pronto! Qual o seu nome e sua idade? Carolina Maria E sua idade? 47 Por que você escolheu andar de bicicleta e quanto tempo você a utiliza? Ah, porque é mais rápido, né? Eu vou no mercantil, eu vou ali pedalar ali na barra, volto, né? Faço a caminhada, aí vou de bicicleta, volto. Faço a caminhada, aí volto pra casa. Olha, eu faço muita coisa na minha bicicleta. Vou até no Vapitboot já. Você tem medo de sofrer acidente andando de bicicleta? Tenho. Tenho por quê? Porque os carros, como é que a gente fala? Não respeitam a gente. Mas é carro do que é moto. Qual é o principal problema que você enfrenta? O respeito com a gente e as. Ruas que não são tão boas para andar também. Essa aqui pelo menos é a Maria. Você já sofreu algum acidente no último ano? Não, não. Você gostaria de trocar a bicicleta por algum outro transporte? Com certeza. Qual? Moto. Existe alguma rua que você gostaria de ter ciclovia? aqui no entorno. Não, isso aqui seria uma boa, essa rua aqui, por causa do colégio, né? Tem muito aluno que tem bicicleta, né? Ando, vai pro colégio de bicicleta, é o transporte. Ah, você tem filho que vem de bicicleta? Não, não, meus meninos já terminaram os. Estudos, graças a Deus. Entendi, entendi. É só isso, moça.","Pessoa B: E pronto! Qual o seu nome e sua idade?
Pessoa A: Carolina Maria E sua idade?
Pessoa B: 47 Por que você escolheu andar de bicicleta e quanto tempo você a utiliza? Ah, porque é mais rápido, né?
Pessoa A: Eu vou no mercantil, eu vou ali pedalar ali na barra, volto, né? Faço a caminhada, aí vou de bicicleta, volto. Faço a caminhada, aí volto pra casa.
Pessoa B: Olha, eu faço muita coisa na minha bicicleta. Vou até no Vapitboot já. Você tem medo de sofrer acidente andando de bicicleta?
Pessoa A: Tenho. Tenho por quê? Porque os carros, como é que a gente fala? Não respeitam a gente. Mas é carro do que é moto.
Pessoa B: Qual é o principal problema que você enfrenta?
Pessoa B: O respeito com a gente e as.
Pessoa A: Ruas que não são tão boas para andar também. Essa aqui pelo menos é a Maria.
Pessoa B: Você já sofreu algum acidente no último ano?
Pessoa A: Não, não.
Pessoa B: Você gostaria de trocar a bicicleta por algum outro transporte?
Pessoa A: Com certeza.
Pessoa B: Qual?
Pessoa A: Moto.
Pessoa B: Existe alguma rua que você gostaria de ter ciclovia? aqui no entorno.
Pessoa A: Não, isso aqui seria uma boa, essa rua aqui, por causa do colégio, né? Tem muito aluno que tem bicicleta, né? Ando, vai pro colégio de bicicleta, é o transporte.
Pessoa B: Ah, você tem filho que vem de bicicleta?
Pessoa A: Não, não, meus meninos já terminaram os.
Pessoa B: Estudos, graças a Deus.
Pessoa A: Entendi, entendi.
Pessoa B: É só isso, moça.",00000015-AUDIO-2025-10-30-11-03-04,Carolina Maria,47,Feminino,"Ah, porque é mais rápido, né?",A duração de tempo em que a pessoa utiliza a bicicleta não é mencionada no texto.,O respeito com a gente e as. Ruas que não são tão boas para andar também.,"Você tem medo de sofrer acidente andando de bicicleta? Tenho. Tenho por quê? Porque os carros, como é que a gente fala? Não respeitam a gente. Mas é carro do que é moto. Qual é o principal problema que você enfrenta? O respeito com a gente e as. Ruas que não são tão boas para andar também. Essa aqui pelo menos é a Maria.","Você já sofreu algum acidente no último ano? Não, não.",Você gostaria de trocar a bicicleta por algum outro transporte? Com certeza. Qual? Moto.,"Existe alguma rua que você gostaria de ter ciclovia? aqui no entorno. Não, isso aqui seria uma boa, essa rua aqui, por causa do colégio, né? Tem muito aluno que tem bicicleta, né? Ando, vai pro colégio de bicicleta, é o transporte.",Rapidez \ Tempo,,Desrespeito dos motoristas ou Trânsito; Má qualidade das ciclovias,"Sim, tenho medo de acidentes",Não,"Sim, por uma moto"
"Qual tua nome e idade, Thiago? Eu tenho 14 anos. Ou eu tenho 14, não. Eu tenho 16. Você escolheu. Andar de bicicleta e quanto tempo tu anda? Eu ando desde os meus 7 anos de idade, é o mesmo. E porque é a única coisa que. Eu tenho pra andar. E qual. O principal problema que tu. Enfrenta pra andar de bicicleta? Os caras não tem respeito. Os carros, nem moto, nem caminhão, nem nada. Tu tem medo de sofrer algum acidente andando de bicicleta? Medo tem, mas tem que enfrentar, né? Ok, precisamos. Você já sofreu algum acidente no último ano? Só queda mesmo. Só queda. Como foi a sua queda? Dando grau. Dando grau? Você. Gostaria de trocar a bicicleta por outro meio de transporte? Existe alguma rua e fortaleza que você gostaria que tivesse? Ciclovia, Ciclopátia? Só Misterral. Misterral. Show de bola. Valeu. Obrigadão, viu?","Pessoa A: Qual tua nome e idade, Thiago? Eu tenho 14 anos. Ou eu tenho 14, não. Eu tenho 16. Você escolheu.
Pessoa B: Andar de bicicleta e quanto tempo tu anda?
Pessoa A: Eu ando desde os meus 7 anos de idade, é o mesmo. E porque é a única coisa que.
Pessoa B: Eu tenho pra andar.
Pessoa A: E qual.
Pessoa B: O principal problema que tu.
Pessoa A: Enfrenta pra andar de bicicleta? Os caras não tem respeito. Os carros, nem moto, nem caminhão, nem nada.
Pessoa B: Tu tem medo de sofrer algum acidente andando de bicicleta?
Pessoa A: Medo tem, mas tem que enfrentar, né? Ok, precisamos.
Pessoa B: Você já sofreu algum acidente no último ano?
Pessoa A: Só queda mesmo. Só queda.
Pessoa B: Como foi a sua queda?
Pessoa A: Dando grau.
Pessoa B: Dando grau?
Pessoa A: Você.
Pessoa B: Gostaria de trocar a bicicleta por outro meio de transporte?
Pessoa B: Existe alguma rua e fortaleza que você gostaria que tivesse? Ciclovia, Ciclopátia?
Pessoa A: Só Misterral.
Pessoa B: Misterral. Show de bola. Valeu. Obrigadão, viu?",00000016-AUDIO-2025-10-30-11-05-55,Thiago,16,Masculino,E porque é a única coisa que. Eu tenho pra andar.,Eu ando desde os meus 7 anos de idade.,"Os caras não tem respeito. Os carros, nem moto, nem caminhão, nem nada.","Tu tem medo de sofrer algum acidente andando de bicicleta? Medo tem, mas tem que enfrentar, né?",Você já sofreu algum acidente no último ano? Só queda mesmo. Só queda.,Você. Gostaria de trocar a bicicleta por outro meio de transporte?,"Existe alguma rua e fortaleza que você gostaria que tivesse? Ciclovia, Ciclopátia? Só Misterral. Misterral. Show de bola. Valeu. Obrigadão, viu?",Única opção,Mais de 5 anos,Desrespeito dos motoristas ou Trânsito,"Sim, tenho medo de acidentes",Sim,
"Qual o seu nome e sua idade, por favor? Rebeca. Minha idade é 16. Por que você. Escolheu andar de bicicleta. E há quanto tempo utiliza? Porque é melhor pra mim não andar a pé. E eu. Utilizo desde criança. Qual é o principal problema que você enfrenta ao andar de bicicleta aqui em Fortaleza? Principal problema? Como assim? Se são as ruas, se são os carros, os motoristas. Ah, os motoristas. É? Você tem medo de sofrer acidente? Tenho. Já sofreu algum? Já. Quer contar como foi ou deixa pra lá? Eu quebrei meu braço na lua de bicicleta. Nossa. Isso foi atropelamento ou tu caiu sozinha? Foi a moto, bateu. No pneu, aí eu caí por cima do braço. Ô amiga, sinto muito. Você gostaria de trocar a bicicleta por outro meio de transporte no futuro? Sim. Qual? Tem? Um moto. Tá. Existe algum rumo em Fortaleza que tu gostaria que tivesse uma cifra baixa? Obrigada! De nada! Obrigada!","Pessoa A: Qual o seu nome e sua idade, por favor? Rebeca.
Pessoa B: Minha idade é 16.
Pessoa A: Por que você.
Pessoa B: Escolheu andar de bicicleta.
Pessoa A: E há quanto tempo utiliza?
Pessoa B: Porque é melhor pra mim não andar a pé. E eu.
Pessoa A: Utilizo desde criança. Qual é o principal problema que você enfrenta ao andar de bicicleta aqui em Fortaleza?
Pessoa B: Principal problema? Como assim?
Pessoa A: Se são as ruas, se são os carros, os motoristas. Ah, os motoristas. É? Você tem medo de sofrer acidente? Tenho. Já sofreu algum?
Pessoa B: Já.
Pessoa A: Quer contar como foi ou deixa pra lá? Eu quebrei meu braço na lua de bicicleta. Nossa. Isso foi atropelamento ou tu caiu sozinha? Foi a moto, bateu.
Pessoa B: No pneu, aí eu caí por cima do braço.
Pessoa A: Ô amiga, sinto muito. Você gostaria de trocar a bicicleta por outro meio de transporte no futuro? Sim. Qual? Tem? Um moto. Tá. Existe algum rumo em Fortaleza que tu gostaria que tivesse uma cifra baixa?
Pessoa A: Obrigada! De nada! Obrigada!",00000017-AUDIO-2025-10-30-11-06-42,Rebeca,16,Feminino,Porque é melhor pra mim não andar a pé.,Utilizo desde criança.,"Qual é o principal problema que você enfrenta ao andar de bicicleta aqui em Fortaleza? Principal problema? Como assim? Se são as ruas, se são os carros, os motoristas. Ah, os motoristas.",É? Você tem medo de sofrer acidente? Tenho.,"Já sofreu algum? Já. Quer contar como foi ou deixa pra lá? Eu quebrei meu braço na lua de bicicleta. Nossa. Isso foi atropelamento ou tu caiu sozinha? Foi a moto, bateu. No pneu, aí eu caí por cima do braço.",Você gostaria de trocar a bicicleta por outro meio de transporte no futuro? Sim. Qual? Tem? Um moto.,Existe algum rumo em Fortaleza que tu gostaria que tivesse uma cifra baixa?,Praticidade e conveniência;Mais fácil,Mais de 5 anos,Desrespeito dos motoristas ou Trânsito,"Sim, tenho medo de acidentes",Sim,"Sim, por uma moto"
