text,conversation,file,nome,idade,gênero,por_que_escolheu_andar_de_bicicleta?,ha_quanto_tempo_utiliza?,qual_e_o_principal_problema_que_voce_enfrenta_ao_andar_de_bicicleta_em_fortaleza,tem_medo_de_sofrer_acidentes_andando_de_bicicleta_em_Fortaleza?,sofreu_algum_acidente_no_último_ano?,gostaria_de_trocar_a_bicicleta_por_outro_meio_de_transporte,existe_alguma_rua_em_fortaleza_em_que_gostaria_de_ver_uma_ciclovia,por_que_escolheu_ou_escolhe_andar_de_bicicleta_agrupado,ha_quanto_tempo_utiliza_agrupado,qual_e_o_principal_problema_que_voce_enfrenta_ao_andar_de_bicicleta_em_fortaleza_agrupado,tem_medo_de_sofrer_acidentes_andando_de_bicicleta_em_Fortaleza_agrupado,sofreu_algum_acidente_no_último_ano_agrupado,gostaria_de_trocar_a_bicicleta_por_outro_meio_de_transporte_agrupado
"Qual o seu nome e a sua idade? José de Anchieta da Silva, 68. Por que você escolheu a escolha andar de bicicleta? Pra melhorar a situação física, né? A saúde, né? A saúde. Qual. O principal problema que você enfrenta ao andar de bicicleta em Fortaleza? É a ciclovia, que não tá recuperada. Muito buraco. Eu tenho problema de coluna, perda de disco em três tipos, aí complica muito. Você tem alguma sugestão para melhorar a qualidade e o conforto? É, melhorar a ciclovia, né? E abrir mais, né? Quanto mais, melhor. Entendi. Você gostaria de trocar a bicicleta por algum outro meio de transporte? Ou você gosta dela? Eu gosto dela. Desde rapazinho que eu pedalo e agora que eu tô com aquele gás todinho pra pedalar. Ah, legal. Eu acho que pedalado é de 65 quilômetros. Ah, que bom. Muito legal. E existe alguma rua em Fortaleza que você gostaria de ver uma ciclovia? Que não tem? São várias, né? No momento eu não tô lembrado não, mas são várias, são várias. Ali na José Bastos, pontuação daqui da Augusto dos Anjos, volta a ciclovia ali, né? Sim. Tá bom? Tá bom. Legal, viu? Obrigada.","Pessoa A: Qual o seu nome e a sua idade?
Pessoa B: José de Anchieta da Silva, 68.
Pessoa A: Por que você escolheu a escolha andar de bicicleta?
Pessoa B: Pra melhorar a situação física, né? A saúde, né? A saúde. Qual.
Pessoa A: O principal problema que você enfrenta ao andar de bicicleta em Fortaleza?
Pessoa B: É a ciclovia, que não tá recuperada. Muito buraco. Eu tenho problema de coluna, perda de disco em três tipos, aí complica muito.
Pessoa A: Você tem alguma sugestão para melhorar a qualidade e o conforto?
Pessoa B: É, melhorar a ciclovia, né? E abrir mais, né? Quanto mais, melhor.
Pessoa A: Entendi. Você gostaria de trocar a bicicleta por algum outro meio de transporte? Ou você gosta dela?
Pessoa B: Eu gosto dela. Desde rapazinho que eu pedalo e agora que eu tô com aquele gás todinho pra pedalar.
Pessoa A: Ah, legal.
Pessoa B: Eu acho que pedalado é de 65 quilômetros.
Pessoa A: Ah, que bom.
Pessoa B: Muito legal.
Pessoa A: E existe alguma rua em Fortaleza que você gostaria de ver uma ciclovia?
Pessoa B: Que não tem? São várias, né? No momento eu não tô lembrado não, mas são várias, são várias. Ali na José Bastos, pontuação daqui da Augusto dos Anjos, volta a ciclovia ali, né? Sim. Tá bom?
Pessoa A: Tá bom. Legal, viu? Obrigada.",PTT-20240829-WA0105,José de Anchieta da Silva,68,"Pra melhorar a situação física, né? A saúde, né? A saúde.","Pra melhorar a situação física, né? A saúde, né? A saúde.",Eu gosto dela. Desde rapazinho que eu pedalo e agora que eu tô com aquele gás todinho pra pedalar.,"É a ciclovia, que não tá recuperada. Muito buraco. Eu tenho problema de coluna, perda de disco em três tipos, aí complica muito.","A informação sobre se a pessoa tem medo de sofrer acidentes não está explicitamente mencionada no texto. O texto foca nos problemas da ciclovia e em uma condição física: ""O principal problema que você enfrenta ao andar de bicicleta em Fortaleza? É a ciclovia, que não tá recuperada. Muito buraco. Eu tenho problema de coluna, perda de disco em três tipos, aí complica muito.""",Não há menção no texto sobre a pessoa ter sofrido algum acidente no último ano.,Você gostaria de trocar a bicicleta por algum outro meio de transporte? Ou você gosta dela? Eu gosto dela. Desde rapazinho que eu pedalo e agora que eu tô com aquele gás todinho pra pedalar.,"E existe alguma rua em Fortaleza que você gostaria de ver uma ciclovia? Que não tem? São várias, né? No momento eu não tô lembrado não, mas são várias, são várias. Ali na José Bastos, pontuação daqui da Augusto dos Anjos, volta a ciclovia ali, né? Sim.",Exercício e saúde,Mais de 5 anos,Buracos na ciclovia; Má qualidade das ciclovias,,Não,Não
"Qual o seu nome e a sua idade? Meu nome é Francisco Silva de Araújo, tenho 39 anos. É, por que você escolheu ou escolhe andar de bicicleta? Bom, aqui é porque é um esporte, né? Lazer. E pela ciclovia aqui é totalmente seguro, né? Entendi. Qual o principal problema que você enfrenta ao andar de bicicleta em Fortaleza? Bom, aqui em Fortaleza, no centro de Fortaleza, como tem ciclovia direto, não enfrento dificuldade nenhuma, não. Dificuldade nenhuma, não. Você tem alguma sugestão para melhorar a qualidade e o conforto ao andar de bicicleta? Não, mas aqui, aqui tá show de bola, aqui tá ótimo o padrão daqui. E você gostaria de trocar a bicicleta por algum outro meio de transporte? Não, não, não. Trocar minha bicicleta por outro meio de transporte, não. E existe alguma rua de Fortaleza que você gostaria de ver em ciclovia? Olha, porque Fortaleza eu conheço pouco, né, mas... Bom, pelos locais que eu já andei aqui em Fortaleza, vários locais já me atenderam.","Pessoa B: Qual o seu nome e a sua idade?
Pessoa A: Meu nome é Francisco Silva de Araújo, tenho 39 anos.
Pessoa B: É, por que você escolheu ou escolhe andar de bicicleta?
Pessoa A: Bom, aqui é porque é um esporte, né? Lazer. E pela ciclovia aqui é totalmente seguro, né? Entendi.
Pessoa B: Qual o principal problema que você enfrenta ao andar de bicicleta em Fortaleza?
Pessoa A: Bom, aqui em Fortaleza, no centro de Fortaleza, como tem ciclovia direto, não enfrento dificuldade nenhuma, não. Dificuldade nenhuma, não.
Pessoa B: Você tem alguma sugestão para melhorar a qualidade e o conforto ao andar de bicicleta?
Pessoa A: Não, mas aqui, aqui tá show de bola, aqui tá ótimo o padrão daqui.
Pessoa B: E você gostaria de trocar a bicicleta por algum outro meio de transporte?
Pessoa A: Não, não, não. Trocar minha bicicleta por outro meio de transporte, não.
Pessoa B: E existe alguma rua de Fortaleza que você gostaria de ver em ciclovia?
Pessoa A: Olha, porque Fortaleza eu conheço pouco, né, mas... Bom, pelos locais que eu já andei aqui em Fortaleza, vários locais já me atenderam.",PTT-20240829-WA0106,Francisco Silva de Araújo,39 anos,"Bom, aqui é porque é um esporte, né? Lazer. E pela ciclovia aqui é totalmente seguro, né?","Bom, aqui é porque é um esporte, né? Lazer. E pela ciclovia aqui é totalmente seguro, né?",A informação sobre há quanto tempo a pessoa utiliza bicicleta não está presente no texto.,"Qual o principal problema que você enfrenta ao andar de bicicleta em Fortaleza? Bom, aqui em Fortaleza, no centro de Fortaleza, como tem ciclovia direto, não enfrento dificuldade nenhuma, não. Dificuldade nenhuma, não.","""E pela ciclovia aqui é totalmente seguro, né? Entendi. Qual o principal problema que você enfrenta ao andar de bicicleta em Fortaleza? Bom, aqui em Fortaleza, no centro de Fortaleza, como tem ciclovia direto, não enfrento dificuldade nenhuma, não. Dificuldade nenhuma, não.""",Essa informação não está presente no texto.,"E você gostaria de trocar a bicicleta por algum outro meio de transporte? Não, não, não. Trocar minha bicicleta por outro meio de transporte, não.","E existe alguma rua de Fortaleza que você gostaria de ver em ciclovia? Olha, porque Fortaleza eu conheço pouco, né, mas... Bom, pelos locais que eu já andei aqui em Fortaleza, vários locais já me atenderam.",Exercício e saúde;Segurança no trânsito;Preferência pessoal,,Nenhum dos problemas/Não enfrenta dificuldade,Não,Não,Não
"Seu nome e sua idade, por favor. Alisson Rodrigues Souza, 32 anos. Por que você escolheu andar de bicicleta? É o meio de transporte mais rápido e chega no trabalho mais cedo. Quais os principais problemas que você encontra. Quando anda de bicicleta? Principalmente na ciclofaxa, muito carro. Hoje mesmo eu sofri um acidente no trabalho. Eu ia na ciclofaixa, o cara entrou na contramão errada, não pode ali na parangaba, entrou e me jogou pra fora da pista. E eu falei pra ele, você tá errado, você entrou no canto errado, eu não posso fazer nada. Então eu tô querendo andar de bicicleta. Essas coisas que a gente encontra diariamente. Esse problema. E tem alguma sugestão de melhoria? Na ciclofaixa... Mais respeito né, tanto motorista, motoqueiro, todo mundo, até os pedestres também tem que ter um pouco de respeito E a gente anda com um apito para justamente evitar acidente, tanto pra mim como para o pedestre. Tem alguma rua que tu gostaria que tivesse ciclovia ou ciclofaixa que ainda não tem? Ou que tá muito ruim, que tu gostaria de melhorar? A ciclofaixa tem que melhorar, né? Principalmente essa aqui, da Budapest, tá cheio de buraco Principalmente lá na frente, lá no final da Budapest A ciclofaixa daqui pra lá não tem problema, porque eu pego ela praticamente quase toda ela fora. Na ciclofaixa Tu trocaria tua bicicleta por algum outro meio de transporte? Não Até porque é menos... não é tão perigoso Se você andar corretamente, não é tão perigoso. Dá pra você ir e voltar, ir e vir tranquilo. Eu não trocaria não, mesmo que fosse próxima. Tá bem, obrigada. De nada.","Pessoa A: Seu nome e sua idade, por favor.
Pessoa B: Alisson Rodrigues Souza, 32 anos.
Pessoa A: Por que você escolheu andar de bicicleta?
Pessoa B: É o meio de transporte mais rápido e chega no trabalho mais cedo.
Pessoa A: Quais os principais problemas que você encontra.
Pessoa B: Quando anda de bicicleta? Principalmente na ciclofaxa, muito carro. Hoje mesmo eu sofri um acidente no trabalho. Eu ia na ciclofaixa, o cara entrou na contramão errada, não pode ali na parangaba, entrou e me jogou pra fora da pista. E eu falei pra ele, você tá errado, você entrou no canto errado, eu não posso fazer nada. Então eu tô querendo andar de bicicleta. Essas coisas que a gente encontra diariamente. Esse problema.
Pessoa A: E tem alguma sugestão de melhoria?
Pessoa B: Na ciclofaixa... Mais respeito né, tanto motorista, motoqueiro, todo mundo, até os pedestres também tem que ter um pouco de respeito E a gente anda com um apito para justamente evitar acidente, tanto pra mim como para o pedestre.
Pessoa A: Tem alguma rua que tu gostaria que tivesse ciclovia ou ciclofaixa que ainda não tem? Ou que tá muito ruim, que tu gostaria de melhorar?
Pessoa B: A ciclofaixa tem que melhorar, né? Principalmente essa aqui, da Budapest, tá cheio de buraco Principalmente lá na frente, lá no final da Budapest A ciclofaixa daqui pra lá não tem problema, porque eu pego ela praticamente quase toda ela fora.
Pessoa A: Na ciclofaixa Tu trocaria tua bicicleta por algum outro meio de transporte?
Pessoa B: Não Até porque é menos... não é tão perigoso Se você andar corretamente, não é tão perigoso. Dá pra você ir e voltar, ir e vir tranquilo. Eu não trocaria não, mesmo que fosse próxima. Tá bem, obrigada. De nada.",PTT-20240829-WA0107,Alisson Rodrigues Souza,32 anos,É o meio de transporte mais rápido e chega no trabalho mais cedo.,É o meio de transporte mais rápido e chega no trabalho mais cedo.,O trecho que indica há quanto tempo a pessoa utiliza bicicleta não está presente no texto.,"Principalmente na ciclofaxa, muito carro. Hoje mesmo eu sofri um acidente no trabalho. Eu ia na ciclofaixa, o cara entrou na contramão errada, não pode ali na parangaba, entrou e me jogou pra fora da pista. E eu falei pra ele, você tá errado, você entrou no canto errado, eu não posso fazer nada. Então eu tô querendo andar de bicicleta. Essas coisas que a gente encontra diariamente. Esse problema.","Até porque é menos... não é tão perigoso Se você andar corretamente, não é tão perigoso. Dá pra você ir e voltar, ir e vir tranquilo.",Hoje mesmo eu sofri um acidente no trabalho.,"Tu trocaria tua bicicleta por algum outro meio de transporte? Não Até porque é menos... não é tão perigoso Se você andar corretamente, não é tão perigoso. Dá pra você ir e voltar, ir e vir tranquilo. Eu não trocaria não, mesmo que fosse próxima.","Tem alguma rua que tu gostaria que tivesse ciclovia ou ciclofaixa que ainda não tem? Ou que tá muito ruim, que tu gostaria de melhorar? A ciclofaixa tem que melhorar, né? Principalmente essa aqui, da Budapest, tá cheio de buraco Principalmente lá na frente, lá no final da Budapest",Rapidez \ Tempo,,Desrespeito dos motoristas ou Trânsito; Invasão de carros ou motos na ciclovia; Risco de acidentes,Não,Sim,Não
"Qual seu primeiro nome? Júnior. E a sua idade? Trinta e dois. Por que você escolheu andar de bicicleta? Porque é melhor, mais prático e mais rápido, né? E quando você tá andando de bicicleta, qual o principal problema que você enfrenta aí nas ruas? O buraqueiro e o transitoral, né? Que não tem segunda faixa muito pra gente, né? Mas o problema maior é esse. Você tem alguma sugestão para melhorar as ciclovias, as ciclofaixos? Acho que não. Você atrapalharia a bicicleta por algum meio de transporte? Não. E só pra finalizar, tem alguma ciclovia ou ciclofaixa, alguma via que você passa, alguma rua ou avenida que você passa que não tem, nem ciclovia, nem ciclofaixa que você acha que existe? Augusto dos Anjos tem, precisa, precisa sim, precisa muito. E tem alguma outra? Mas, por enquanto é porque o meu. Caminho é esse, aí eu... Ah, é aqui já tem, né? Ah, é. Ah, bom. Pois valeu, viu? Obrigada.","Pessoa A: Qual seu primeiro nome?
Pessoa B: Júnior.
Pessoa A: E a sua idade?
Pessoa B: Trinta e dois.
Pessoa A: Por que você escolheu andar de bicicleta?
Pessoa B: Porque é melhor, mais prático e mais rápido, né?
Pessoa A: E quando você tá andando de bicicleta, qual o principal problema que você enfrenta aí nas ruas?
Pessoa B: O buraqueiro e o transitoral, né? Que não tem segunda faixa muito pra gente, né? Mas o problema maior é esse.
Pessoa A: Você tem alguma sugestão para melhorar as ciclovias, as ciclofaixos? Acho que não. Você atrapalharia a bicicleta por algum meio de transporte?
Pessoa B: Não.
Pessoa A: E só pra finalizar, tem alguma ciclovia ou ciclofaixa, alguma via que você passa, alguma rua ou avenida que você passa que não tem, nem ciclovia, nem ciclofaixa que você acha que existe?
Pessoa B: Augusto dos Anjos tem, precisa, precisa sim, precisa muito.
Pessoa A: E tem alguma outra?
Pessoa B: Mas, por enquanto é porque o meu.
Pessoa A: Caminho é esse, aí eu... Ah, é aqui já tem, né? Ah, é. Ah, bom. Pois valeu, viu? Obrigada.",PTT-20240829-WA0108,Júnior,Trinta e dois,"Porque é melhor, mais prático e mais rápido, né?","Porque é melhor, mais prático e mais rápido, né?",Essa informação não está presente no texto.,"O buraqueiro e o transitoral, né? Que não tem segunda faixa muito pra gente, né? Mas o problema maior é esse.",O texto não contém um trecho que pergunte ou diga se a pessoa tem medo de sofrer acidentes andando de bicicleta.,Não há menção no texto sobre se a pessoa sofreu algum acidente no último ano.,Você atrapalharia a bicicleta por algum meio de transporte? Não.,"E só pra finalizar, tem alguma ciclovia ou ciclofaixa, alguma via que você passa, alguma rua ou avenida que você passa que não tem, nem ciclovia, nem ciclofaixa que você acha que existe? Augusto dos Anjos tem, precisa, precisa sim, precisa muito.",Rapidez \ Tempo; Praticidade e conveniência; Preferência pessoal,,Buracos na ciclovia; Desrespeito dos motoristas ou Trânsito; Falta de ciclovias,,,Não
"Vou fazer essas perguntas para o senhor. Qual o nome e idade do senhor? Nome? Nome e idade? Eduardo Wildo. Ele tem quantos anos, senhor? 34. Faz muito tempo que o senhor andou de bicicleta? Faz seis meses. É recente. É recente, né? E por que o senhor escolheu andar de bicicleta? Poxa, era quase o mesmo tempo de carro. 40 minutos. Aí resolveu parar ali na marapanga, aí demorava para ele pegar a cara. Carajás ali, os trânsitos doidos ali, né? É melhor de bicicleta mesmo. Mais barato, né? E o tempo é o mesmo. Qual é o principal problema que você encontra andando de bicicleta aqui em Fortaleza? Ou você diria que é a principal coisa que atrapalha? Sabe por que eu vim aqui na pista? Porque ele é muito ruim, cheio de raiz, em frente de trânsito. Tu entra ali e vê as raízes das plantas quebraram tudo. Então não tem como andar na ciclovia aqui da Godofer. Rapaz, a gente caminhando demais, eu decidi, não tem como andar. Entendi. Se fosse uma saltozinha lá dentro, aí a gente... Então assim, qual seria a principal sugestão que você daria para melhorar a qualidade do ciclista? Seria tipo manutenção da ciclovia? Da ciclovia. Principalmente dessa aqui, né? Entendi, da Godofer. Esse problema da saltozinha. É por isso que muita gente vai aqui na pista mesmo. E o senhor tem interesse, assim, faz pouco tempo, né? O senhor tá andando de bicicleta. O senhor tem interesse de trocar a bicicleta por outro modo de transporte? Não. Entendeu, né? Faz pouco tempo que o senhor trocou, né? Pronto, tem alguma via que o senhor passe de bicicleta que o pessoal acha que deveria ter ciclofaixa e não tem? Merecia ter ciclofaixa e não tem hoje? Tem bastante já, né? Agora, se eu me lembrar assim, mas já tem muitos. É, né? Não tem de cabeça nenhuma, não? Cabeça não, mas já tem muitos. Eu sei dizer que tem muitos, que já... Aí, aí... Tem muitos. Entendi. Então era só isso mesmo.","Pessoa A: Vou fazer essas perguntas para o senhor. Qual o nome e idade do senhor? Nome? Nome e idade? Eduardo Wildo. Ele tem quantos anos, senhor? 34. Faz muito tempo que o senhor andou de bicicleta? Faz seis meses. É recente. É recente, né? E por que o senhor escolheu andar de bicicleta? Poxa, era quase o mesmo tempo de carro. 40 minutos. Aí resolveu parar ali na marapanga, aí demorava para ele pegar a cara. Carajás ali, os trânsitos doidos ali, né? É melhor de bicicleta mesmo. Mais barato, né? E o tempo é o mesmo. Qual é o principal problema que você encontra andando de bicicleta aqui em Fortaleza? Ou você diria que é a principal coisa que atrapalha? Sabe por que eu vim aqui na pista? Porque ele é muito ruim, cheio de raiz, em frente de trânsito. Tu entra ali e vê as raízes das plantas quebraram tudo. Então não tem como andar na ciclovia aqui da Godofer. Rapaz, a gente caminhando demais, eu decidi, não tem como andar. Entendi. Se fosse uma saltozinha lá dentro, aí a gente... Então assim, qual seria a principal sugestão que você daria para melhorar a qualidade do ciclista? Seria tipo manutenção da ciclovia? Da ciclovia. Principalmente dessa aqui, né? Entendi, da Godofer. Esse problema da saltozinha. É por isso que muita gente vai aqui na pista mesmo. E o senhor tem interesse, assim, faz pouco tempo, né? O senhor tá andando de bicicleta. O senhor tem interesse de trocar a bicicleta por outro modo de transporte? Não. Entendeu, né? Faz pouco tempo que o senhor trocou, né? Pronto, tem alguma via que o senhor passe de bicicleta que o pessoal acha que deveria ter ciclofaixa e não tem? Merecia ter ciclofaixa e não tem hoje? Tem bastante já, né? Agora, se eu me lembrar assim, mas já tem muitos. É, né? Não tem de cabeça nenhuma, não? Cabeça não, mas já tem muitos. Eu sei dizer que tem muitos, que já... Aí, aí... Tem muitos. Entendi. Então era só isso mesmo.",PTT-20240829-WA0109,Eduardo Wildo,34,"Poxa, era quase o mesmo tempo de carro. 40 minutos. Aí resolveu parar ali na marapanga, aí demorava para ele pegar a cara. Carajás ali, os trânsitos doidos ali, né? É melhor de bicicleta mesmo. Mais barato, né? E o tempo é o mesmo.","Poxa, era quase o mesmo tempo de carro. 40 minutos. Aí resolveu parar ali na marapanga, aí demorava para ele pegar a cara. Carajás ali, os trânsitos doidos ali, né? É melhor de bicicleta mesmo. Mais barato, né? E o tempo é o mesmo.","Faz seis meses. É recente. É recente, né?","Sabe por que eu vim aqui na pista? Porque ele é muito ruim, cheio de raiz, em frente de trânsito. Tu entra ali e vê as raízes das plantas quebraram tudo. Então não tem como andar na ciclovia aqui da Godofer.",O texto não menciona se a pessoa tem medo de sofrer acidentes.,O texto não menciona se a pessoa sofreu algum acidente no último ano.,O senhor tem interesse de trocar a bicicleta por outro modo de transporte? Não.,"Pronto, tem alguma via que o senhor passe de bicicleta que o pessoal acha que deveria ter ciclofaixa e não tem? Merecia ter ciclofaixa e não tem hoje? Tem bastante já, né? Agora, se eu me lembrar assim, mas já tem muitos. É, né? Não tem de cabeça nenhuma, não? Cabeça não, mas já tem muitos. Eu sei dizer que tem muitos, que já... Aí, aí... Tem muitos. Entendi.",Rapidez \ Tempo; Custo \ É mais barato; Praticidade e conveniência,Menos de um ano,"Má qualidade das ciclovias, Buracos na ciclovia, Desrespeito dos motoristas ou Trânsito",,Não,Não
"Pronto, qual o seu primeiro nome? Jeves. E a sua idade? 38. Por que você escolheu andar de bicicleta? Porque pedalar é vida. E quando você está pedalando, quais são os principais problemas que você enfrenta nas ruas? É a questão da falta de respeito. Eu acho que os motoristas esquecem que quem está em cima da bicicleta é um ser humano. Trabalhador, enfim, etc. Também vai e vem. E deve ter respeito. Sempre. Se não houver respeito, não tem como o trânsito fluir. Como é pra fluir? Você tem alguma sugestão de melhoria da ciclofaixa, da ciclovia. Em Fortaleza? Sim. Você tá vendo ali, né? Aí, era pra ter uma espécie de... Uma espécie de bloco. Pra separar. A ciclovia e. A ciclofaixa, né? O que o motorista faz? Mas não tem pra ele passar, tá vendo? Não tem. Mesmo se ele tá passando. Eu acredito que isso seja uma inflação. E você trocaria a bicicleta pra algum outro meio de transporte? Não. Só pra finalizar, tem alguma via em Fortaleza que você ande ou que você conheça que não tem a sua faixa de ciclovia que você acha que mereça se a gente tá precisando de uma empresa. Cicloviária? A Conelho de Castro. Muito obrigada, viu?","Pessoa A: Pronto, qual o seu primeiro nome?
Pessoa B: Jeves.
Pessoa A: E a sua idade? 38. Por que você escolheu andar de bicicleta?
Pessoa B: Porque pedalar é vida.
Pessoa A: E quando você está pedalando, quais são os principais problemas que você enfrenta nas ruas?
Pessoa B: É a questão da falta de respeito. Eu acho que os motoristas esquecem que quem está em cima da bicicleta é um ser humano. Trabalhador, enfim, etc. Também vai e vem. E deve ter respeito. Sempre. Se não houver respeito, não tem como o trânsito fluir. Como é pra fluir?
Pessoa A: Você tem alguma sugestão de melhoria da ciclofaixa, da ciclovia.
Pessoa B: Em Fortaleza?
Pessoa A: Sim.
Pessoa B: Você tá vendo ali, né? Aí, era pra ter uma espécie de... Uma espécie de bloco.
Pessoa A: Pra separar.
Pessoa B: A ciclovia e.
Pessoa A: A ciclofaixa, né?
Pessoa B: O que o motorista faz? Mas não tem pra ele passar, tá vendo? Não tem. Mesmo se ele tá passando. Eu acredito que isso seja uma inflação.
Pessoa A: E você trocaria a bicicleta pra algum outro meio de transporte?
Pessoa B: Não.
Pessoa A: Só pra finalizar, tem alguma via em Fortaleza que você ande ou que você conheça que não tem a sua faixa de ciclovia que você acha que mereça se a gente tá precisando de uma empresa.
Pessoa B: Cicloviária? A Conelho de Castro.
Pessoa A: Muito obrigada, viu?",PTT-20240829-WA0110,Jeves,38,Porque pedalar é vida.,Porque pedalar é vida.,A informação de há quanto tempo a pessoa utiliza bicicleta não está presente no texto.,É a questão da falta de respeito. Eu acho que os motoristas esquecem que quem está em cima da bicicleta é um ser humano.,Essa informação não está presente no texto.,Essa informação não está presente no texto.,E você trocaria a bicicleta pra algum outro meio de transporte? Não.,"Só pra finalizar, tem alguma via em Fortaleza que você ande ou que você conheça que não tem a sua faixa de ciclovia que você acha que mereça se a gente tá precisando de uma empresa. Cicloviária? A Conelho de Castro.",Preferência pessoal,,Desrespeito dos motoristas ou Trânsito,,,Não
