text,conversation,file,nome,idade,gênero,por_que_escolheu_andar_de_bicicleta?,ha_quanto_tempo_utiliza?,qual_e_o_principal_problema_que_voce_enfrenta_ao_andar_de_bicicleta_em_fortaleza,tem_medo_de_sofrer_acidentes_andando_de_bicicleta_em_Fortaleza?,sofreu_algum_acidente_no_último_ano?,gostaria_de_trocar_a_bicicleta_por_outro_meio_de_transporte,existe_alguma_rua_em_fortaleza_em_que_gostaria_de_ver_uma_ciclovia,por_que_escolheu_ou_escolhe_andar_de_bicicleta_agrupado,ha_quanto_tempo_utiliza_agrupado,qual_e_o_principal_problema_que_voce_enfrenta_ao_andar_de_bicicleta_em_fortaleza_agrupado,tem_medo_de_sofrer_acidentes_andando_de_bicicleta_em_Fortaleza_agrupado,sofreu_algum_acidente_no_último_ano_agrupado,gostaria_de_trocar_a_bicicleta_por_outro_meio_de_transporte_agrupado
"O nome e a idade, por favor? Eu, José Walter. Idade, 60 anos. José Walter, por que você escolheu andar de bicicleta? Porque eu sempre gostei, desde adolescente eu gosto, né? Sempre. É mais econômico, né? E a saúde, né? Sim. Qual é o principal problema que você enfrenta andando de bicicleta? Porque eu uso essa via todos os dias. O problema que eu vejo é que deveria consertar a buraqueira aí da ciclovia, né? A manutenção dela, né? A manutenção da ciclovia. Da Godofredo aqui. Da Godofredo Marcel, que todo dia eu uso ela aqui. Você gostaria de... Ah, não, desculpa. Você tem alguma sugestão para melhorar a qualidade, o conforto ao andar de bicicleta na cidade? Eu só acho que essa ciclovia aqui é a melhor ciclovia da cidade. Eu conheço a cidade todinha e sei que aqui a segurança é fatal, né? É o único local que realmente você mantém uma distância de 1,5 metro dos carros. Já a parte da ciclofaixa eu já não acho muito segura. Tem que ter muito cuidado. Certo. Você gostaria de trocar a bicicleta por outro meio de transporte? O problema é a queda financeira, né? Mas só se fosse carro, moto não, porque a moto eu acho muito perigosa. E tem alguma rua de Fortaleza que você gostaria de ver um ciclovia ou ciclofaixa aqui na região que você circula mais, que você sente falta? Porque eu uso mais a Godolferdo Maciel e a Zé Baixo, em todas as duas tem uma boa ciclovia. Mas e as conexões? Tem alguma conexão que falte? Não, tá ótimo. A parte de cruzamento, de sinalização tá ótimo. Esse aqui foi um dos cruzamentos que foi melhorado. que foi ajustado por essa equipe, aí estão fazendo vários outros e conexões também. Então, a ideia aqui é ouvir. A gente está nessa região, mas a gente já fez na Bezerra, já fez na própria José Bastos, a gente escuta para poder saber o que pode melhorar na região. Pois, foi uma ótima ideia. Inclusive, a sinalização aqui está ótima. A respeito de sinalização, está ótima. Obrigada, tá?","Pessoa A: O nome e a idade, por favor?
Pessoa B: Eu, José Walter. Idade, 60 anos.
Pessoa A: José Walter, por que você escolheu andar de bicicleta?
Pessoa B: Porque eu sempre gostei, desde adolescente eu gosto, né? Sempre. É mais econômico, né? E a saúde, né?
Pessoa A: Sim. Qual é o principal problema que você enfrenta andando de bicicleta?
Pessoa B: Porque eu uso essa via todos os dias. O problema que eu vejo é que deveria consertar a buraqueira aí da ciclovia, né?
Pessoa A: A manutenção dela, né?
Pessoa B: A manutenção da ciclovia.
Pessoa A: Da Godofredo aqui.
Pessoa B: Da Godofredo Marcel, que todo dia eu uso ela aqui.
Pessoa A: Você gostaria de... Ah, não, desculpa. Você tem alguma sugestão para melhorar a qualidade, o conforto ao andar de bicicleta na cidade?
Pessoa B: Eu só acho que essa ciclovia aqui é a melhor ciclovia da cidade. Eu conheço a cidade todinha e sei que aqui a segurança é fatal, né? É o único local que realmente você mantém uma distância de 1,5 metro dos carros. Já a parte da ciclofaixa eu já não acho muito segura. Tem que ter muito cuidado.
Pessoa A: Certo. Você gostaria de trocar a bicicleta por outro meio de transporte?
Pessoa B: O problema é a queda financeira, né? Mas só se fosse carro, moto não, porque a moto eu acho muito perigosa.
Pessoa A: E tem alguma rua de Fortaleza que você gostaria de ver um ciclovia ou ciclofaixa aqui na região que você circula mais, que você sente falta?
Pessoa B: Porque eu uso mais a Godolferdo Maciel e a Zé Baixo, em todas as duas tem uma boa ciclovia.
Pessoa A: Mas e as conexões? Tem alguma conexão que falte?
Pessoa B: Não, tá ótimo. A parte de cruzamento, de sinalização tá ótimo.
Pessoa A: Esse aqui foi um dos cruzamentos que foi melhorado. que foi ajustado por essa equipe, aí estão fazendo vários outros e conexões também. Então, a ideia aqui é ouvir. A gente está nessa região, mas a gente já fez na Bezerra, já fez na própria José Bastos, a gente escuta para poder saber o que pode melhorar na região.
Pessoa B: Pois, foi uma ótima ideia. Inclusive, a sinalização aqui está ótima. A respeito de sinalização, está ótima.
Pessoa A: Obrigada, tá?",PTT-20240829-WA0049,José Walter,60 anos,"Porque eu sempre gostei, desde adolescente eu gosto, né? Sempre. É mais econômico, né? E a saúde, né?","Porque eu sempre gostei, desde adolescente eu gosto, né? Sempre. É mais econômico, né? E a saúde, né?","Porque eu sempre gostei, desde adolescente eu gosto, né? Sempre.","O problema que eu vejo é que deveria consertar a buraqueira aí da ciclovia, né? A manutenção dela, né? A manutenção da ciclovia. Da Godofredo aqui. Da Godofredo Marcel, que todo dia eu uso ela aqui.","Já a parte da ciclofaixa eu já não acho muito segura. Tem que ter muito cuidado. Certo. Você gostaria de trocar a bicicleta por outro meio de transporte? O problema é a queda financeira, né? Mas só se fosse carro, moto não, porque a moto eu acho muito perigosa.",O texto fornecido não menciona se a pessoa sofreu algum acidente no último ano.,"Você gostaria de trocar a bicicleta por outro meio de transporte? O problema é a queda financeira, né? Mas só se fosse carro, moto não, porque a moto eu acho muito perigosa.","E tem alguma rua de Fortaleza que você gostaria de ver um ciclovia ou ciclofaixa aqui na região que você circula mais, que você sente falta? Porque eu uso mais a Godolferdo Maciel e a Zé Baixo, em todas as duas tem uma boa ciclovia. Mas e as conexões? Tem alguma conexão que falte? Não, tá ótimo. A parte de cruzamento, de sinalização tá ótimo. Esse aqui foi um dos cruzamentos que foi melhorado.",Exercício e saúde; Custo \ É mais barato; Preferência pessoal,Mais de 5 anos,Buracos na ciclovia,"Sim, tenho medo de acidentes",,"Sim, por um carro"
"A gente é da equipe de engenheiros e arquitetos da prefeitura e está aqui para ouvir sobre a região que você anda de bicicleta. Seu nome e sua idade? Meu nome é Alan Lucas, tenho 24 anos. Alan Lucas, por que você escolheu andar de bicicleta? Porque é exercício bom para a saúde, faz bem. Qual é o principal problema que você enfrenta andando de. Bicicleta? É o trânsito mesmo, a correria. Você tem alguma sugestão para melhorar a qualidade e o conforto ao andar de bicicleta aqui na cidade? Melhorar se couver, né? Se couver as passagens que o ciclista anda. Melhorar, né? Melhorar a atenção, você diz? Isso. Você gostaria de trocar bicicleta por outro transporte? Não, não, não. Eu gosto de correr, andar lá. E tem alguma rua de Fortaleza que você queria ver uma ciclovia, ciclofaixa, aqui na sua região, nos locais que você circula, que você disse que tinha que ter uma ciclofaixa e não tem? Tem, tem sim. Diga aí alguns. Nomes de rua que você acha importantes. Zé Walter ali, entendeu? Zé Walter. Algo canto mais, assim, que tu... Não, só isso mesmo, que é a minha passagem. Tá bom. Obrigada, viu?","Pessoa A: A gente é da equipe de engenheiros e arquitetos da prefeitura e está aqui para ouvir sobre a região que você anda de bicicleta. Seu nome e sua idade?
Pessoa B: Meu nome é Alan Lucas, tenho 24 anos.
Pessoa A: Alan Lucas, por que você escolheu andar de bicicleta?
Pessoa B: Porque é exercício bom para a saúde, faz bem.
Pessoa A: Qual é o principal problema que você enfrenta andando de.
Pessoa B: Bicicleta? É o trânsito mesmo, a correria.
Pessoa A: Você tem alguma sugestão para melhorar a qualidade e o conforto ao andar de bicicleta aqui na cidade?
Pessoa B: Melhorar se couver, né? Se couver as passagens que o ciclista anda.
Pessoa A: Melhorar, né?
Pessoa B: Melhorar a atenção, você diz? Isso.
Pessoa A: Você gostaria de trocar bicicleta por outro transporte?
Pessoa B: Não, não, não. Eu gosto de correr, andar lá.
Pessoa A: E tem alguma rua de Fortaleza que você queria ver uma ciclovia, ciclofaixa, aqui na sua região, nos locais que você circula, que você disse que tinha que ter uma ciclofaixa e não tem?
Pessoa B: Tem, tem sim. Diga aí alguns.
Pessoa A: Nomes de rua que você acha importantes.
Pessoa B: Zé Walter ali, entendeu?
Pessoa A: Zé Walter. Algo canto mais, assim, que tu...
Pessoa B: Não, só isso mesmo, que é a minha passagem.
Pessoa A: Tá bom. Obrigada, viu?",PTT-20240829-WA0051,"=AI(""EXTRAIA DO TEXTO O NOME DA PESSOA ENTREVISTADA"";A27)",24 anos,"Porque é exercício bom para a saúde, faz bem.","Porque é exercício bom para a saúde, faz bem.",A informação sobre há quanto tempo a pessoa utiliza bicicleta não está presente no texto.,"É o trânsito mesmo, a correria.","Qual é o principal problema que você enfrenta andando de. Bicicleta? É o trânsito mesmo, a correria.",The text does not mention whether the person suffered an accident in the last year.,"Você gostaria de trocar bicicleta por outro transporte? Não, não, não. Eu gosto de correr, andar lá.","E tem alguma rua de Fortaleza que você queria ver uma ciclovia, ciclofaixa, aqui na sua região, nos locais que você circula, que você disse que tinha que ter uma ciclofaixa e não tem? Tem, tem sim.",Exercício e saúde,,Desrespeito dos motoristas ou Trânsito,"Sim, tenho medo de acidentes",,Não
"A gente registrar. Qual é o teu primeiro nome? Daniel. E a tua idade? 25. Por que você escolheu andar. De bicicleta? Porque, por conta que eu andava de ônibus, achava muito ruim, porque a questão de chegar em casa, né? Chega muito tarde. De bicicleta não, gasta menos minutos e chega mais cedo. Tem alguma... Não, pra ti, qual é o principal. Problema da bicicleta em Fortaleza? É a questão da ciclofaixa, que às vezes tá quebrado, tem vidro, lixo, aí tem que andar na pista. Aqui, na Golda Freda, você acha? É. Tem alguma sugestão para melhorar a qualidade, o conforto, andar de espada com fortaleza? Tem, só melhorar mesmo a ciclofaixa, a sinalização também, que às vezes é tudo coisado, misturado. Só isso. Você trocaria a bicicleta por algum outro meio de transporte? Não, eu prefiro a bicicleta. E tem alguma via em Fortaleza que não tenha a faixa ciclovía que você acha que está precisando, que mereça? Eu vou ser real, até agora eu não fui para aquela banda onde não tem. Porque os cantos que eu vou tem, sabe? Eu não cheguei a ir para outros cantos não. Entendi. Obrigada. De nada, boa tarde.","Pessoa B: A gente registrar. Qual é o teu primeiro nome?
Pessoa A: Daniel.
Pessoa B: E a tua idade?
Pessoa A: 25. Por que você escolheu andar.
Pessoa B: De bicicleta?
Pessoa A: Porque, por conta que eu andava de ônibus, achava muito ruim, porque a questão de chegar em casa, né? Chega muito tarde. De bicicleta não, gasta menos minutos e chega mais cedo. Tem alguma...
Pessoa B: Não, pra ti, qual é o principal.
Pessoa A: Problema da bicicleta em Fortaleza? É a questão da ciclofaixa, que às vezes tá quebrado, tem vidro, lixo, aí tem que andar na pista. Aqui, na Golda Freda, você acha?
Pessoa B: É. Tem alguma sugestão para melhorar a qualidade, o conforto, andar de espada com fortaleza?
Pessoa A: Tem, só melhorar mesmo a ciclofaixa, a sinalização também, que às vezes é tudo coisado, misturado. Só isso.
Pessoa B: Você trocaria a bicicleta por algum outro meio de transporte?
Pessoa A: Não, eu prefiro a bicicleta.
Pessoa B: E tem alguma via em Fortaleza que não tenha a faixa ciclovía que você acha que está precisando, que mereça?
Pessoa A: Eu vou ser real, até agora eu não fui para aquela banda onde não tem. Porque os cantos que eu vou tem, sabe? Eu não cheguei a ir para outros cantos não.
Pessoa B: Entendi. Obrigada.
Pessoa A: De nada, boa tarde.",PTT-20240829-WA0052,Daniel,25,"Porque, por conta que eu andava de ônibus, achava muito ruim, porque a questão de chegar em casa, né? Chega muito tarde. De bicicleta não, gasta menos minutos e chega mais cedo.","Porque, por conta que eu andava de ônibus, achava muito ruim, porque a questão de chegar em casa, né? Chega muito tarde. De bicicleta não, gasta menos minutos e chega mais cedo.",A informação sobre há quanto tempo a pessoa utiliza a bicicleta não está presente no texto.,"É a questão da ciclofaixa, que às vezes tá quebrado, tem vidro, lixo, aí tem que andar na pista.",O texto não menciona se a pessoa tem medo de sofrer acidentes andando de bicicleta.,A informação solicitada não está presente no texto.,"Você trocaria a bicicleta por algum outro meio de transporte? Não, eu prefiro a bicicleta.","E tem alguma via em Fortaleza que não tenha a faixa ciclovía que você acha que está precisando, que mereça? Eu vou ser real, até agora eu não fui para aquela banda onde não tem. Porque os cantos que eu vou tem, sabe? Eu não cheguei a ir para outros cantos não.",Rapidez \ Tempo,,Má qualidade das ciclovias; Lixo na ciclovia; Buracos na ciclovia; Outros obstáculos na ciclovia,Não,Não,Não
"Qual o seu nome e a sua idade? Eu sou Augustinho, 73. Por que você escolheu ou escolhe andar de bicicleta? Porque eu tô sem carro, né? Eu vendi o carro e agora tô precisando andar. Qual é o principal problema que você enfrenta ao andar de bicicleta em Fortaleza? Não, pra mim tá bom. Porque. Tem ciclovias, né? Sim. Você tem alguma sugestão pra melhorar a qualidade e o conforto pra bicicleta? Tá tudo bem pra mim até agora. E ótimo. Você gostaria de trocar a bicicleta por outro meio de transporte? Não. Não? Satisfeito? Existe alguma rua em Fortaleza que você gostaria de ver na ciclovia? Pra mim tá bom, né? Eu moro aqui na Maraponda. Ah, você faz. O deslocamento por aqui. Mesmo. Né? Não, não, não. Vou me juntar aqui todo dia pra você. Tá. Obrigada, hein moço.","Pessoa A: Qual o seu nome e a sua idade?
Pessoa B: Eu sou Augustinho, 73.
Pessoa A: Por que você escolheu ou escolhe andar de bicicleta?
Pessoa B: Porque eu tô sem carro, né? Eu vendi o carro e agora tô precisando andar.
Pessoa A: Qual é o principal problema que você enfrenta ao andar de bicicleta em Fortaleza? Não, pra mim tá bom. Porque.
Pessoa B: Tem ciclovias, né?
Pessoa A: Sim. Você tem alguma sugestão pra melhorar a qualidade e o conforto pra bicicleta?
Pessoa B: Tá tudo bem pra mim até agora.
Pessoa A: E ótimo. Você gostaria de trocar a bicicleta por outro meio de transporte?
Pessoa B: Não. Não? Satisfeito?
Pessoa A: Existe alguma rua em Fortaleza que você gostaria de ver na ciclovia? Pra mim tá bom, né? Eu moro aqui na Maraponda. Ah, você faz.
Pessoa B: O deslocamento por aqui.
Pessoa A: Mesmo.
Pessoa B: Né? Não, não, não. Vou me juntar aqui todo dia pra você. Tá.
Pessoa A: Obrigada, hein moço.",PTT-20240829-WA0053,Augustinho,73,"Porque eu tô sem carro, né? Eu vendi o carro e agora tô precisando andar.","Porque eu tô sem carro, né? Eu vendi o carro e agora tô precisando andar.","Porque eu tô sem carro, né? Eu vendi o carro e agora tô precisando andar.","Qual é o principal problema que você enfrenta ao andar de bicicleta em Fortaleza? Não, pra mim tá bom. Porque. Tem ciclovias, né? Sim.",A informação sobre ter medo de sofrer acidentes não está explicitamente no texto.,A informação sobre acidentes não está presente no texto.,Você gostaria de trocar a bicicleta por outro meio de transporte? Não. Não? Satisfeito?,"Existe alguma rua em Fortaleza que você gostaria de ver na ciclovia? Pra mim tá bom, né? Eu moro aqui na Maraponda. Ah, você faz. O deslocamento por aqui. Mesmo. Né? Não, não, não. Vou me juntar aqui todo dia pra você. Tá. Obrigada, hein moço.",Única opção,,,,,Não
"Esse evento que a gente tá fazendo é um papo de pedal, né? A gente faz ele todo mês e o objetivo dele é a gente escutar. As afirmações dos ciclistas, certo? Eu sei. Qual o teu nome e a tua idade? Meu nome é Francisco Luca, né? Minha idade é 27. 27? Faz tempo que tu anda de bicicleta? Há três anos que eu ando de pedal. Três anos? Essa rotina. Certo, é sempre na mesma rota. É, mas eu tô na UPA Barra. Eita. Qual o principal problema que tu encontra andando de bicicleta em Fortaleza? É porque tem muito escorredor, tem muito lixo. muito mesmo, não tem nem dia de ir dormindo, no meio do relâmpago, não tem como a gente passar, tem 7 daquilo pra pista. Aí é só isso mesmo. Entendi. Qual a principal sugestão que você daria pra gente melhorar, o que a gente tem que fazer pra melhorar a qualidade? Só a limpeza mesmo, a limpeza já melhorava bastante. Porque aonde nós passamos tem muito frio, essas coisas, entendeu? Sim, por fora você já tampa o pneu, né? Aí você rebola o lixo, né? Aí deixa frio, quebrado, aí... Prejudicar não, né? Mas prefere pela pista, às vezes, por causa disso. Melhorando isso, já resolvi 100%. Tu tem vontade de trocar a bicicleta. Por outro moto de transporte? Tenho uma moto. Mas tu só não trocou ainda porque não... Entendi. E tem alguma via que tu passa. No teu trajeto diário que tu acha. Que merecia ter ciclofaxo e que não tem? Deixa eu ver aqui... Não, no momento não. De onde eu venho já tem... Tudo tem ciclo fácil. Exato. Que bom. Só uma vez que eu passei foi na Perimetral. Que não tem. Ah, sim, na Perimetral. Vai voltar lá. Pronto. Vai voltar. O que vem, vai ter lá. Pronto. Acho que o Perimetral tem tudo pra ti também.","Pessoa B: Esse evento que a gente tá fazendo é um papo de pedal, né?
Pessoa A: A gente faz ele todo mês e o objetivo dele é a gente escutar.
Pessoa B: As afirmações dos ciclistas, certo?
Pessoa A: Eu sei.
Pessoa B: Qual o teu nome e a tua idade?
Pessoa A: Meu nome é Francisco Luca, né? Minha idade é 27.
Pessoa B: 27? Faz tempo que tu anda de bicicleta?
Pessoa A: Há três anos que eu ando de pedal.
Pessoa B: Três anos?
Pessoa A: Essa rotina.
Pessoa B: Certo, é sempre na mesma rota.
Pessoa A: É, mas eu tô na UPA Barra. Eita.
Pessoa B: Qual o principal problema que tu encontra andando de bicicleta em Fortaleza?
Pessoa A: É porque tem muito escorredor, tem muito lixo. muito mesmo, não tem nem dia de ir dormindo, no meio do relâmpago, não tem como a gente passar, tem 7 daquilo pra pista. Aí é só isso mesmo. Entendi.
Pessoa B: Qual a principal sugestão que você daria pra gente melhorar, o que a gente tem que fazer pra melhorar a qualidade?
Pessoa A: Só a limpeza mesmo, a limpeza já melhorava bastante. Porque aonde nós passamos tem muito frio, essas coisas, entendeu? Sim, por fora você já tampa o pneu, né? Aí você rebola o lixo, né? Aí deixa frio, quebrado, aí... Prejudicar não, né? Mas prefere pela pista, às vezes, por causa disso. Melhorando isso, já resolvi 100%.
Pessoa B: Tu tem vontade de trocar a bicicleta.
Pessoa A: Por outro moto de transporte? Tenho uma moto. Mas tu só não trocou ainda porque não... Entendi.
Pessoa B: E tem alguma via que tu passa.
Pessoa A: No teu trajeto diário que tu acha.
Pessoa B: Que merecia ter ciclofaxo e que não tem?
Pessoa A: Deixa eu ver aqui... Não, no momento não. De onde eu venho já tem... Tudo tem ciclo fácil. Exato. Que bom. Só uma vez que eu passei foi na Perimetral. Que não tem.
Pessoa B: Ah, sim, na Perimetral.
Pessoa A: Vai voltar lá. Pronto. Vai voltar. O que vem, vai ter lá. Pronto. Acho que o Perimetral tem tudo pra ti também.",PTT-20240829-WA0054,Francisco Luca,27,O texto não especifica o motivo pelo qual a pessoa escolheu andar de bicicleta.,"O texto não menciona a razão pela qual a pessoa escolheu andar de bicicleta, apenas que ela pedala há três anos.",Há três anos que eu ando de pedal.,"É porque tem muito escorredor, tem muito lixo. muito mesmo, não tem nem dia de ir dormindo, no meio do relâmpago, não tem como a gente passar, tem 7 daquilo pra pista. Aí é só isso mesmo.","""Qual o principal problema que tu encontra andando de bicicleta em Fortaleza? É porque tem muito escorredor, tem muito lixo. muito mesmo, não tem nem dia de ir dormindo, no meio do relâmpago, não tem como a gente passar, tem 7 daquilo pra pista. Aí é só isso mesmo. Entendi. Qual a principal sugestão que você daria pra gente melhorar, o que a gente tem que fazer pra melhorar a qualidade? Só a limpeza mesmo, a limpeza já melhorava bastante. Porque aonde nós passamos tem muito frio, essas coisas, entendeu? Sim, por fora você já tampa o pneu, né? Aí você rebola o lixo, né? Aí deixa frio, quebrado, aí... Prejudicar não, né? Mas prefere pela pista, às vezes, por causa disso. Melhorando isso, já resolvi 100%.""",A informação sobre a pessoa ter sofrido algum acidente no último ano não está presente no texto fornecido.,Tu tem vontade de trocar a bicicleta. Por outro moto de transporte? Tenho uma moto.,"""Tu tem vontade de trocar a bicicleta. Por outro moto de transporte? Tenho uma moto. Mas tu só não trocou ainda porque não... Entendi. E tem alguma via que tu passa. No teu trajeto diário que tu acha. Que merecia ter ciclofaxo e que não tem? Deixa eu ver aqui... Não, no momento não. De onde eu venho já tem... Tudo tem ciclo fácil. Exato. Que bom. Só uma vez que eu passei foi na Perimetral. Que não tem. Ah, sim, na Perimetral. Vai voltar lá. Pronto. Vai voltar. O que vem, vai ter lá. Pronto. Acho que o Perimetral tem tudo pra ti também.""",Exercício e saúde,Entre 3 e 5 anos,"Lixo na ciclovia, Outros obstáculos na ciclovia","Sim, tenho medo de acidentes",Não,"Sim, por uma moto"
