text,conversation,file,nome,idade,gênero,por_que_escolheu_andar_de_bicicleta?,ha_quanto_tempo_utiliza?,qual_e_o_principal_problema_que_voce_enfrenta_ao_andar_de_bicicleta_em_fortaleza,tem_medo_de_sofrer_acidentes_andando_de_bicicleta_em_Fortaleza?,sofreu_algum_acidente_no_último_ano?,gostaria_de_trocar_a_bicicleta_por_outro_meio_de_transporte,existe_alguma_rua_em_fortaleza_em_que_gostaria_de_ver_uma_ciclovia,por_que_escolheu_ou_escolhe_andar_de_bicicleta_agrupado,ha_quanto_tempo_utiliza_agrupado,qual_e_o_principal_problema_que_voce_enfrenta_ao_andar_de_bicicleta_em_fortaleza_agrupado,tem_medo_de_sofrer_acidentes_andando_de_bicicleta_em_Fortaleza_agrupado,sofreu_algum_acidente_no_último_ano_agrupado,gostaria_de_trocar_a_bicicleta_por_outro_meio_de_transporte_agrupado
"Só tem o primeiro nome? Edinaldo. E a tua idade? 40 anos. Por que você escolheu andar de bicicleta? Porque é o meio de transporte mais rápido, é melhor do que pegar ônibus. E pratica, é o principal problema que você enfrenta na rodada de bicicleta. Pratica exercício também para a população e eu acho bem melhor do que pegar ônibus. Entendi. Porque para pegar ônibus você tem que sair de casa umas quatro e meia da madrugada, de bicicleta o salzinho é seis e vinte, seis e meia de casa. E rápido eu estou em casa. E ainda não paga passagem. Não paga passagem, economiza na passagem. E isso, né? E o meu trabalho isso aqui também não fez. E problemas assim, quando tu tá andando de bicicleta? Qual é assim, o principal problema que você enfrenta nas ruas? Até agora não tive ainda não, mas o maior é o medo, que já me tomaram uma bicicleta dessa já, foi. Já me tomaram uma já. O medo é só esse mesmo. Você tem alguma sugestão, assim, pra melhorar a ciclofaixa, a ciclovia de fatalismo? É o que tá cada dia ficando melhor, né? Tem mais ciclofaixa pra gente andar, mais tranquilo. Sem medo de acidente. Acidente não faz tanto medo não, porque tem muita ciclovia. O medo mesmo é só assalto. Assalto, né? É. E você trocaria a bicicleta por algum outro meio de transporte? Não, porque outro meio de transporte sai mais caro e mais complicado. Tem que ter habilitação, tem que ter muitas coisas, tem que pagar isso, pagar aquilo. Bicicleta não, é mais prática, só não tem o motor, né? Tem que pedalar, mas tá bom. Eu moro ali na Ganja Lisboa, daqui a 20 minutos eu tô em casa. Você trabalha por aqui? Condomínio aí, lá na Maraponga. E só pra finalizar, tem alguma via em Fortaleza que não tem ciclovia, nem ciclopacho que você acha que precisa, que tá merecendo uma? Pode ser lá pela Granja de Lisboa, por aqui na região? Lá, lá tem. Lá tem. Pô, eu não sei, porque eu não ando muito em outros... No seu caminho todo sempre tem. Meu caminho todo tem, é. Daqui até em casa tem, Ciclofaixa. Daqui, pegando aos olhos, José Basti, João Pessoa, todas tem via Ciclofaixa. Pois era isso, viu? Obrigada. Obrigado.","Pessoa A: Só tem o primeiro nome?
Pessoa B: Edinaldo. E a tua idade? 40 anos.
Pessoa A: Por que você escolheu andar de bicicleta?
Pessoa B: Porque é o meio de transporte mais rápido, é melhor do que pegar ônibus.
Pessoa A: E pratica, é o principal problema que você enfrenta na rodada de bicicleta.
Pessoa B: Pratica exercício também para a população e eu acho bem melhor do que pegar ônibus.
Pessoa A: Entendi.
Pessoa B: Porque para pegar ônibus você tem que sair de casa umas quatro e meia da madrugada, de bicicleta o salzinho é seis e vinte, seis e meia de casa. E rápido eu estou em casa.
Pessoa A: E ainda não paga passagem.
Pessoa B: Não paga passagem, economiza na passagem. E isso, né?
Pessoa A: E o meu trabalho isso aqui também não fez. E problemas assim, quando tu tá andando de bicicleta? Qual é assim, o principal problema que você enfrenta nas ruas?
Pessoa B: Até agora não tive ainda não, mas o maior é o medo, que já me tomaram uma bicicleta dessa já, foi. Já me tomaram uma já.
Pessoa A: O medo é só esse mesmo. Você tem alguma sugestão, assim, pra melhorar a ciclofaixa, a ciclovia de fatalismo?
Pessoa B: É o que tá cada dia ficando melhor, né? Tem mais ciclofaixa pra gente andar, mais tranquilo. Sem medo de acidente. Acidente não faz tanto medo não, porque tem muita ciclovia. O medo mesmo é só assalto.
Pessoa A: Assalto, né?
Pessoa B: É.
Pessoa A: E você trocaria a bicicleta por algum outro meio de transporte?
Pessoa B: Não, porque outro meio de transporte sai mais caro e mais complicado. Tem que ter habilitação, tem que ter muitas coisas, tem que pagar isso, pagar aquilo. Bicicleta não, é mais prática, só não tem o motor, né? Tem que pedalar, mas tá bom. Eu moro ali na Ganja Lisboa, daqui a 20 minutos eu tô em casa.
Pessoa A: Você trabalha por aqui?
Pessoa B: Condomínio aí, lá na Maraponga.
Pessoa A: E só pra finalizar, tem alguma via em Fortaleza que não tem ciclovia, nem ciclopacho que você acha que precisa, que tá merecendo uma? Pode ser lá pela Granja de Lisboa, por aqui na região?
Pessoa B: Lá, lá tem. Lá tem. Pô, eu não sei, porque eu não ando muito em outros...
Pessoa A: No seu caminho todo sempre tem.
Pessoa B: Meu caminho todo tem, é. Daqui até em casa tem, Ciclofaixa. Daqui, pegando aos olhos, José Basti, João Pessoa, todas tem via Ciclofaixa.
Pessoa A: Pois era isso, viu? Obrigada.
Pessoa B: Obrigado.",PTT-20240829-WA0082,Edinaldo.,40 anos,"Porque é o meio de transporte mais rápido, é melhor do que pegar ônibus. E pratica, é o principal problema que você enfrenta na rodada de bicicleta. Pratica exercício também para a população e eu acho bem melhor do que pegar ônibus. Entendi. Porque para pegar ônibus você tem que sair de casa umas quatro e meia da madrugada, de bicicleta o salzinho é seis e vinte, seis e meia de casa. E rápido eu estou em casa. E ainda não paga passagem. Não paga passagem, economiza na passagem.","Porque é o meio de transporte mais rápido, é melhor do que pegar ônibus. E pratica, é o principal problema que você enfrenta na rodada de bicicleta. Pratica exercício também para a população e eu acho bem melhor do que pegar ônibus. Entendi. Porque para pegar ônibus você tem que sair de casa umas quatro e meia da madrugada, de bicicleta o salzinho é seis e vinte, seis e meia de casa. E rápido eu estou em casa. E ainda não paga passagem. Não paga passagem, economiza na passagem. E isso, né? E o meu trabalho isso aqui também não fez.",O texto não menciona há quanto tempo a pessoa utiliza a bicicleta.,"o maior é o medo, que já me tomaram uma bicicleta dessa já, foi. Já me tomaram uma já. O medo é só esse mesmo. ... O medo mesmo é só assalto. Assalto, né?","Acidente não faz tanto medo não, porque tem muita ciclovia. O medo mesmo é só assalto.","Acidente não faz tanto medo não, porque tem muita ciclovia.","E você trocaria a bicicleta por algum outro meio de transporte? Não, porque outro meio de transporte sai mais caro e mais complicado. Tem que ter habilitação, tem que ter muitas coisas, tem que pagar isso, pagar aquilo. Bicicleta não, é mais prática, só não tem o motor, né? Tem que pedalar, mas tá bom. Eu moro ali na Ganja Lisboa, daqui a 20 minutos eu tô em casa.","E só pra finalizar, tem alguma via em Fortaleza que não tem ciclovia, nem ciclopacho que você acha que precisa, que tá merecendo uma? Pode ser lá pela Granja de Lisboa, por aqui na região? Lá, lá tem. Lá tem. Pô, eu não sei, porque eu não ando muito em outros... No seu caminho todo sempre tem. Meu caminho todo tem, é. Daqui até em casa tem, Ciclofaixa. Daqui, pegando aos olhos, José Basti, João Pessoa, todas tem via Ciclofaixa.",Exercício e saúde;Rapidez \ Tempo;Praticidade e conveniência;Custo \ É mais barato,,Medo de assaltos,Medo de assalto e de acidente,Não,Não
"Aí eu queria só fazer essas perguntinhas aqui pro senhor. Qual é o nome e idade do senhor? 40 anos. Faz muito tempo que o senhor anda de bicicleta? Faz muito tempo. E por que o senhor escolheu andar de bicicleta? E qual é o principal problema que você enfrenta dentro de uma espécie de fortaleza? Respeito. E se, por exemplo, você fosse fazer uma coisa, uma sugestão para melhorar a qualidade de vida do ciclista, qual você acha que é a principal coisa que a gente tem que fazer? E o senhor tem interesse de trocar biscoito por outro modo de transporte? Não, não. Não? Não, não. Não, não. Não, não. Não, não. Não? Não, não. Não, não. Não, não. Não, não. Não, não. Não, não. Não, não. Não, não. Não, não. Não, não. Não, não. Não, não. Não, não. Não, não. Não, não. Não, não. Não, não. Não, não. Não, não. Não, não. Não, não. Não, não. Não, não. Não, não. Não, não. Não, não. Não, não. Não, não. Não, não. Não, não. Não, não. Não, não. Não, não. Não, não. Não, não. Não, não. Não, não. Não, não. Não, não. Não, não. Não, não. Não, não. Não, não. Não, não. Não, não. Não.","Pessoa A: Aí eu queria só fazer essas perguntinhas aqui pro senhor. Qual é o nome e idade do senhor? 40 anos. Faz muito tempo que o senhor anda de bicicleta? Faz muito tempo. E por que o senhor escolheu andar de bicicleta? E qual é o principal problema que você enfrenta dentro de uma espécie de fortaleza? Respeito. E se, por exemplo, você fosse fazer uma coisa, uma sugestão para melhorar a qualidade de vida do ciclista, qual você acha que é a principal coisa que a gente tem que fazer? E o senhor tem interesse de trocar biscoito por outro modo de transporte? Não, não. Não? Não, não. Não, não. Não, não. Não, não. Não? Não, não. Não, não. Não, não. Não, não. Não, não. Não, não. Não, não. Não, não. Não, não. Não, não. Não, não. Não, não. Não, não. Não, não. Não, não. Não, não. Não, não. Não, não. Não, não. Não, não. Não, não. Não, não. Não, não. Não, não. Não, não. Não, não. Não, não. Não, não. Não, não. Não, não. Não, não. Não, não. Não, não. Não, não. Não, não. Não, não. Não, não. Não, não. Não, não. Não, não. Não, não. Não, não. Não, não. Não, não. Não, não. Não.",PTT-20240829-WA0083,O nome da pessoa entrevistada não está presente no texto.,40 anos.,"O texto não contém a resposta para ""por que o senhor escolheu andar de bicicleta?"".",O motivo não é fornecido no texto.,Faz muito tempo.,Respeito.,A informação específica sobre ter medo de sofrer acidentes não está presente no texto.,Essa informação não está presente no texto fornecido.,"E o senhor tem interesse de trocar biscoito por outro modo de transporte? Não, não. Não? Não, não.",Essa informação não está disponível no texto.,Exercício e saúde,Mais de 5 anos,Desrespeito dos motoristas ou Trânsito; Machismo e desrespeito,,,Não
"Qual o teu primeiro nome e atividade? Eric, tenho 28 anos. Por que você escolheu andar de bicicleta? No momento está sendo mais viável, né? Financeiramente, né? Entendi. E pra. Ti, qual o principal problema andar de bicicleta em Fortaleza? Muita gente não respeita o ciclista. E você tem alguma sugestão de melhorias da ciclofaxe, da ciclovia pra melhorar conforto, qualidade? Não. Não? Não. Trocaria a bicicleta pra algum outro meio de transporte? Não. E só pra finalizar aqui, tem alguma via em Fortaleza que você ande, ou que você conheça que não tem a ciclovia ou ciclofaxe que você acha que esteja precisando? O trajeto do Terminal do Siqueira Até que na Vila Peri. Não tenho a ciclofaixa ainda. Você costuma vir por onde? Sempre venho por aqui. Entendi. Pela frente da Malasinheira. Quer pegar o Auzório? Isso. Aí, pega Conego de Castro, né? Não, vou pelo Auzório mesmo. Ah, toda a vida pelo Auzório. É. Entendi, tá bom. Obrigada. De nada.","Pessoa B: Qual o teu primeiro nome e atividade?
Pessoa A: Eric, tenho 28 anos.
Pessoa B: Por que você escolheu andar de bicicleta?
Pessoa A: No momento está sendo mais viável, né?
Pessoa B: Financeiramente, né?
Pessoa A: Entendi. E pra.
Pessoa B: Ti, qual o principal problema andar de bicicleta em Fortaleza?
Pessoa A: Muita gente não respeita o ciclista.
Pessoa B: E você tem alguma sugestão de melhorias da ciclofaxe, da ciclovia pra melhorar conforto, qualidade?
Pessoa A: Não. Não? Não.
Pessoa B: Trocaria a bicicleta pra algum outro meio de transporte?
Pessoa A: Não.
Pessoa B: E só pra finalizar aqui, tem alguma via em Fortaleza que você ande, ou que você conheça que não tem a ciclovia ou ciclofaxe que você acha que esteja precisando?
Pessoa A: O trajeto do Terminal do Siqueira Até que na Vila Peri. Não tenho a ciclofaixa ainda.
Pessoa B: Você costuma vir por onde?
Pessoa A: Sempre venho por aqui.
Pessoa B: Entendi.
Pessoa A: Pela frente da Malasinheira.
Pessoa B: Quer pegar o Auzório?
Pessoa A: Isso.
Pessoa B: Aí, pega Conego de Castro, né?
Pessoa A: Não, vou pelo Auzório mesmo.
Pessoa B: Ah, toda a vida pelo Auzório. É. Entendi, tá bom. Obrigada.
Pessoa A: De nada.",PTT-20240829-WA0084,Eric,28 anos,"No momento está sendo mais viável, né? Financeiramente, né?","No momento está sendo mais viável, né? Financeiramente, né?","A informação de há quanto tempo a pessoa utiliza bicicleta não está presente no texto, apenas a razão pela qual está sendo mais viável ""no momento"".",Muita gente não respeita o ciclista.,A informação sobre a pessoa ter medo de sofrer acidentes andando de bicicleta não está explicitamente presente no texto.,O texto não contém informações sobre se a pessoa sofreu algum acidente no último ano.,Trocaria a bicicleta pra algum outro meio de transporte? Não.,O trajeto do Terminal do Siqueira Até que na Vila Peri. Não tenho a ciclofaixa ainda.,Custo \ É mais barato,,Desrespeito dos motoristas ou Trânsito,,Não,Não
"Qual o seu nome e a sua idade? José Ribamar Lima Gomes, 55 anos. Por que você escolheu ou escolhe andar de bicicleta? Porque é mais saudável e hoje em dia com a ciclovia é melhor de ir. Qual é o principal problema que você enfrenta ao andar de bicicleta em Fortaleza? Às vezes é o pessoal que invade, né? A ciclovia não respeita muito o ciclista não. Mas melhorou bem, melhorou muito. Você tem alguma sugestão para melhorar a qualidade e o conforto ao andar de bicicleta? Não sei nem dizer, eu só quero que o pessoal respeite mais o ciclista, né? Respeitando já. Melhorava muito. Você gostaria de trocar a bicicleta por algum outro meio de transporte? Não, porque eu nunca gostei de nem pilotar, nem dirigir, pra mim a bicicleta é o melhor transporte. Ah, que legal! E existe alguma rua em Fortaleza que você gostaria de ter uma ciclobia? Não, não sei nem dizer, porque eu acho que o meu percurso já tem e pra mim é ótimo, né? Ah, então tá ótimo. Obrigada.","Pessoa A: Qual o seu nome e a sua idade?
Pessoa B: José Ribamar Lima Gomes, 55 anos.
Pessoa A: Por que você escolheu ou escolhe andar de bicicleta?
Pessoa B: Porque é mais saudável e hoje em dia com a ciclovia é melhor de ir.
Pessoa A: Qual é o principal problema que você enfrenta ao andar de bicicleta em Fortaleza?
Pessoa B: Às vezes é o pessoal que invade, né? A ciclovia não respeita muito o ciclista não. Mas melhorou bem, melhorou muito.
Pessoa A: Você tem alguma sugestão para melhorar a qualidade e o conforto ao andar de bicicleta?
Pessoa B: Não sei nem dizer, eu só quero que o pessoal respeite mais o ciclista, né? Respeitando já.
Pessoa A: Melhorava muito. Você gostaria de trocar a bicicleta por algum outro meio de transporte?
Pessoa B: Não, porque eu nunca gostei de nem pilotar, nem dirigir, pra mim a bicicleta é o melhor transporte.
Pessoa A: Ah, que legal! E existe alguma rua em Fortaleza que você gostaria de ter uma ciclobia?
Pessoa B: Não, não sei nem dizer, porque eu acho que o meu percurso já tem e pra mim é ótimo, né? Ah, então tá ótimo.
Pessoa A: Obrigada.",PTT-20240829-WA0086,José Ribamar Lima Gomes,55 anos,Porque é mais saudável e hoje em dia com a ciclovia é melhor de ir.,Porque é mais saudável e hoje em dia com a ciclovia é melhor de ir.,A informação sobre há quanto tempo a pessoa utiliza bicicleta não está presente no texto.,"Às vezes é o pessoal que invade, né? A ciclovia não respeita muito o ciclista não.",O texto não contém uma menção explícita sobre se a pessoa tem medo de sofrer acidentes andando de bicicleta.,Não há um trecho no texto que pergunte ou diga especificamente se a pessoa sofreu um acidente no último ano.,"Você gostaria de trocar a bicicleta por algum outro meio de transporte? Não, porque eu nunca gostei de nem pilotar, nem dirigir, pra mim a bicicleta é o melhor transporte.","E existe alguma rua em Fortaleza que você gostaria de ter uma ciclobia? Não, não sei nem dizer, porque eu acho que o meu percurso já tem e pra mim é ótimo, né?",Exercício e saúde;Segurança no trânsito,,Invasão de carros ou motos na ciclovia; Desrespeito dos motoristas ou Trânsito,,Não,Não
"Qual é o seu nome e a sua idade? Raimundo. A idade, eu tenho 64 anos. Por que você escolheu andar de bicicleta? Sempre desde novo. Já nasci praticamente pedalando. Qual é o principal problema que você enfrenta? Às vezes os transmetem pessoas que, às vezes, dentro da avenida, tem motos que às vezes tomam a nossa frente, aquelas coisas todas, né? E não é pra ninguém, só falta superar a gente também. Entendi. Você tem alguma sugestão pra melhorar a enciclovia? Ah, aquilo eu queria que era bom. Aliás, até a enciclovia também já é pra ter uma melhora pra nós, porque é muito buracada, às vezes é excesso de buraco demais. Buraco, né? É demais, demais. Você tinha vontade de trocar a bicicleta. Por outro meio de transporte? Mas eu, de momento, só se for filho de mãe, não. Aqui é que praticamente... É tipo a saúde que a gente tem na vida, que a gente consegue, né? Nosso exercício, diariamente, todos os dias, né? Tem alguma rua de Fortaleza que você gostaria de ver um ciclo face ou ciclo via? Rapaz, de momento, se pudesse, todas elas era pra ter, viu? Todas elas? Mas tem alguma, assim, que você lembra, olha, que não tem. Tinha que ter? Não, não, de momento não, porque eu não ando muito assim pra longe. Mas quando eu vou, todas elas têm algum equipamento. Obrigada.","Pessoa B: Qual é o seu nome e a sua idade?
Pessoa A: Raimundo. A idade, eu tenho 64 anos.
Pessoa B: Por que você escolheu andar de bicicleta?
Pessoa A: Sempre desde novo. Já nasci praticamente pedalando.
Pessoa B: Qual é o principal problema que você enfrenta?
Pessoa A: Às vezes os transmetem pessoas que, às vezes, dentro da avenida, tem motos que às vezes tomam a nossa frente, aquelas coisas todas, né? E não é pra ninguém, só falta superar a gente também.
Pessoa B: Entendi. Você tem alguma sugestão pra melhorar a enciclovia?
Pessoa A: Ah, aquilo eu queria que era bom. Aliás, até a enciclovia também já é pra ter uma melhora pra nós, porque é muito buracada, às vezes é excesso de buraco demais. Buraco, né? É demais, demais.
Pessoa B: Você tinha vontade de trocar a bicicleta.
Pessoa A: Por outro meio de transporte? Mas eu, de momento, só se for filho de mãe, não. Aqui é que praticamente... É tipo a saúde que a gente tem na vida, que a gente consegue, né? Nosso exercício, diariamente, todos os dias, né?
Pessoa B: Tem alguma rua de Fortaleza que você gostaria de ver um ciclo face ou ciclo via?
Pessoa A: Rapaz, de momento, se pudesse, todas elas era pra ter, viu?
Pessoa B: Todas elas? Mas tem alguma, assim, que você lembra, olha, que não tem.
Pessoa A: Tinha que ter? Não, não, de momento não, porque eu não ando muito assim pra longe. Mas quando eu vou, todas elas têm algum equipamento.
Pessoa B: Obrigada.",PTT-20240829-WA0087,Raimundo.,64 anos,Sempre desde novo. Já nasci praticamente pedalando.,Sempre desde novo. Já nasci praticamente pedalando.,Sempre desde novo. Já nasci praticamente pedalando.,"Às vezes os transmetem pessoas que, às vezes, dentro da avenida, tem motos que às vezes tomam a nossa frente, aquelas coisas todas, né? E não é pra ninguém, só falta superar a gente também.","Qual é o principal problema que você enfrenta? Às vezes os transmetem pessoas que, às vezes, dentro da avenida, tem motos que às vezes tomam a nossa frente, aquelas coisas todas, né? E não é pra ninguém, só falta superar a gente também.",Não há um trecho no texto que mencione explicitamente se a pessoa sofreu algum acidente no último ano.,"Você tinha vontade de trocar a bicicleta. Por outro meio de transporte? Mas eu, de momento, só se for filho de mãe, não. Aqui é que praticamente... É tipo a saúde que a gente tem na vida, que a gente consegue, né? Nosso exercício, diariamente, todos os dias, né?","Tem alguma rua de Fortaleza que você gostaria de ver um ciclo face ou ciclo via? Rapaz, de momento, se pudesse, todas elas era pra ter, viu? Todas elas? Mas tem alguma, assim, que você lembra, olha, que não tem. Tinha que ter? Não, não, de momento não, porque eu não ando muito assim pra longe. Mas quando eu vou, todas elas têm algum equipamento.",Preferência pessoal,Mais de 5 anos,Desrespeito dos motoristas ou Trânsito; Invasão de carros ou motos na ciclovia; Risco de acidentes,"Sim, tenho medo de acidentes",Não,Não
"Como é teu nome e a tua idade? Natália, 38 anos. Natália, por que tu escolheu ou escolhe andar de bike hoje? Pelo acesso, né, que eu venho pelo meu trabalho, eu venho pela ciclovia, depois ciclofaixa. Eu acho melhor do que eu vim de ônibus, que o ônibus ele vai fazer um balão muito grande. Qual o principal problema que tu enfrenta hoje ao andar de bicicleta? O maior geralmente é o pedestre quando ele ocupa a ciclovia. E às vezes também os motociclistas que eles passam vão atravessar pela mão direita, que não é a mão que é... E aí acaba que às vezes relando na gente, batendo. E me diz uma coisa, Natália. Natália, tu tem alguma sugestão para melhorar o consumo ou a qualidade Sente a onda de bicicleta? Alguma coisa que possa te ajudar? Eu acredito que mais vias, né? Assim, pra facilitar acesso mais do ciclista, né? Mais ciclofaixas, ciclovias. E essa parte de educação mesmo, de educar os motoristas, motociclistas. Tu gostaria de trocar a bicicleta por algum meio de transporte hoje? Não, no momento não. Eu queria trocar minha bicicleta por uma outra mesmo. Legal. E existe alguma rua aqui em Fortaleza que tu gostaria que tivesse ciclovia ou ciclofaixa que não tem? A Conego de Castro. Massa. Bacana.","Pessoa A: Como é teu nome e a tua idade? Natália, 38 anos. Natália, por que tu escolheu ou escolhe andar de bike hoje? Pelo acesso, né, que eu venho pelo meu trabalho, eu venho pela ciclovia, depois ciclofaixa. Eu acho melhor do que eu vim de ônibus, que o ônibus ele vai fazer um balão muito grande. Qual o principal problema que tu enfrenta hoje ao andar de bicicleta? O maior geralmente é o pedestre quando ele ocupa a ciclovia. E às vezes também os motociclistas que eles passam vão atravessar pela mão direita, que não é a mão que é... E aí acaba que às vezes relando na gente, batendo. E me diz uma coisa, Natália. Natália, tu tem alguma sugestão para melhorar o consumo ou a qualidade Sente a onda de bicicleta? Alguma coisa que possa te ajudar? Eu acredito que mais vias, né? Assim, pra facilitar acesso mais do ciclista, né? Mais ciclofaixas, ciclovias. E essa parte de educação mesmo, de educar os motoristas, motociclistas. Tu gostaria de trocar a bicicleta por algum meio de transporte hoje? Não, no momento não. Eu queria trocar minha bicicleta por uma outra mesmo. Legal. E existe alguma rua aqui em Fortaleza que tu gostaria que tivesse ciclovia ou ciclofaixa que não tem? A Conego de Castro. Massa. Bacana.",PTT-20240829-WA0088,Natália,38 anos,"Pelo acesso, né, que eu venho pelo meu trabalho, eu venho pela ciclovia, depois ciclofaixa. Eu acho melhor do que eu vim de ônibus, que o ônibus ele vai fazer um balão muito grande.","Pelo acesso, né, que eu venho pelo meu trabalho, eu venho pela ciclovia, depois ciclofaixa. Eu acho melhor do que eu vim de ônibus, que o ônibus ele vai fazer um balão muito grande.",O texto não menciona há quanto tempo a pessoa utiliza a bicicleta.,"O maior geralmente é o pedestre quando ele ocupa a ciclovia. E às vezes também os motociclistas que eles passam vão atravessar pela mão direita, que não é a mão que é... E aí acaba que às vezes relando na gente, batendo.","A pessoa menciona problemas de segurança (""às vezes relando na gente, batendo"") mas não explicita se tem medo de sofrer acidentes.","Essa informação não está presente no texto. A entrevistada menciona problemas de segurança como motociclistas ""relano na gente, batendo"", mas não confirma se sofreu um acidente no último ano.","Não, no momento não. Eu queria trocar minha bicicleta por uma outra mesmo.",E existe alguma rua aqui em Fortaleza que tu gostaria que tivesse ciclovia ou ciclofaixa que não tem? A Conego de Castro.,Rapidez \ Tempo; Praticidade e conveniência; Mais fácil,,Invasão de carros ou motos na ciclovia; Outros obstáculos na ciclovia; Risco de acidentes,"Sim, tenho medo de acidentes",Não,"Sim, por uma bicicleta melhor"
