text,conversation,file,nome,idade,gênero,por_que_escolheu_andar_de_bicicleta?,ha_quanto_tempo_utiliza?,qual_e_o_principal_problema_que_voce_enfrenta_ao_andar_de_bicicleta_em_fortaleza,tem_medo_de_sofrer_acidentes_andando_de_bicicleta_em_Fortaleza?,sofreu_algum_acidente_no_último_ano?,gostaria_de_trocar_a_bicicleta_por_outro_meio_de_transporte,existe_alguma_rua_em_fortaleza_em_que_gostaria_de_ver_uma_ciclovia,por_que_escolheu_ou_escolhe_andar_de_bicicleta_agrupado,ha_quanto_tempo_utiliza_agrupado,qual_e_o_principal_problema_que_voce_enfrenta_ao_andar_de_bicicleta_em_fortaleza_agrupado,tem_medo_de_sofrer_acidentes_andando_de_bicicleta_em_Fortaleza_agrupado,sofreu_algum_acidente_no_último_ano_agrupado,gostaria_de_trocar_a_bicicleta_por_outro_meio_de_transporte_agrupado
"Primeiro, qual o seu nome e sua idade? Francisco Ayrton Alves Souza, 52 anos. Certo. Por que o senhor escolheu andar de bicicleta? Primeiro. Orientação médica, né? Eu sou diabético e luto contra a obesidade. Eu pesava 108 quilos. Estou com 93. Qual o principal problema que você encontra ao andar de bicicleta aqui na cidade? A falta de respeito aos condutores de veículos. O senhor tem alguma sugestão para melhorar a qualidade e o conforto de andar de bicicleta aqui em Fortaleza? É só a manutenção da ciclofaixa. Você gostaria de trocar a bicicleta por algum outro meio de transporte? No momento, não. Existe alguma rua de Fortaleza que você gostaria que tivesse ciclovia, ciclofaixa? Que ainda não tem? De momento, não Tá bem.","Pessoa A: Primeiro, qual o seu nome e sua idade?
Pessoa B: Francisco Ayrton Alves Souza, 52 anos.
Pessoa A: Certo. Por que o senhor escolheu andar de bicicleta? Primeiro.
Pessoa B: Orientação médica, né? Eu sou diabético e luto contra a obesidade. Eu pesava 108 quilos. Estou com 93.
Pessoa A: Qual o principal problema que você encontra ao andar de bicicleta aqui na cidade?
Pessoa B: A falta de respeito aos condutores de veículos.
Pessoa A: O senhor tem alguma sugestão para melhorar a qualidade e o conforto de andar de bicicleta aqui em Fortaleza?
Pessoa B: É só a manutenção da ciclofaixa.
Pessoa A: Você gostaria de trocar a bicicleta por algum outro meio de transporte?
Pessoa B: No momento, não.
Pessoa A: Existe alguma rua de Fortaleza que você gostaria que tivesse ciclovia, ciclofaixa?
Pessoa B: Que ainda não tem? De momento, não Tá bem.",AUD-20240829-WA0042,Francisco Ayrton Alves Souza,52 anos,Masculino,"Orientação médica, né? Eu sou diabético e luto contra a obesidade. Eu pesava 108 quilos. Estou com 93.",Essa informação não está presente no texto.,A falta de respeito aos condutores de veículos.,Essa informação não está presente no texto.,Não há um trecho no texto que mencione se a pessoa sofreu algum acidente no último ano.,"Você gostaria de trocar a bicicleta por algum outro meio de transporte? No momento, não.","Existe alguma rua de Fortaleza que você gostaria que tivesse ciclovia, ciclofaixa? Que ainda não tem? De momento, não",Exercício e saúde,,Desrespeito dos motoristas ou Trânsito,,,Não
"Qual o seu nome e a sua idade? Francisco Gomes de Beleza. Certo. Por que o senhor escolheu andar de bicicleta ou escolhe. Andar de bicicleta? Foi uma rotina. Antiga que os meus familiares amavam e eu amo. Ah, que bosta. Você tem alguma sugestão para melhorar a qualidade, o conforto de andar de bicicleta em Fortaleza? Não, é só a claridão mesmo, só a claridão, que é o que estão colocando aqui, né? Ah, sim. Aí visualiza a gente. Você gostaria de trocar essa bicicleta por algum outro meio de transporte? Sim, sim. Já tive, né? Quatro. Tive quatro motos. Vivo com a bicicletinha hoje, numa luta grande, tentando conquistar outra moto. Certo. Existe alguma rua de Fortaleza que você gostaria de colocar uma ciclofaixa ou ciclovia? Ou melhorar alguma estrutura dessas? Não, só ando nessa aqui. Só ando nela aqui. Até Maracanaú. Tá ótimo. Obrigada. De nada.","Pessoa A: Qual o seu nome e a sua idade?
Pessoa B: Francisco Gomes de Beleza. Certo.
Pessoa A: Por que o senhor escolheu andar de bicicleta ou escolhe.
Pessoa B: Andar de bicicleta?
Pessoa A: Foi uma rotina.
Pessoa B: Antiga que os meus familiares amavam e eu amo.
Pessoa A: Ah, que bosta. Você tem alguma sugestão para melhorar a qualidade, o conforto de andar de bicicleta em Fortaleza?
Pessoa B: Não, é só a claridão mesmo, só a claridão, que é o que estão colocando aqui, né?
Pessoa A: Ah, sim.
Pessoa B: Aí visualiza a gente.
Pessoa A: Você gostaria de trocar essa bicicleta por algum outro meio de transporte? Sim, sim.
Pessoa B: Já tive, né? Quatro.
Pessoa A: Tive quatro motos.
Pessoa B: Vivo com a bicicletinha hoje, numa luta grande, tentando conquistar outra moto. Certo.
Pessoa A: Existe alguma rua de Fortaleza que você gostaria de colocar uma ciclofaixa ou ciclovia? Ou melhorar alguma estrutura dessas? Não, só ando nessa aqui.
Pessoa B: Só ando nela aqui. Até Maracanaú.
Pessoa A: Tá ótimo. Obrigada.
Pessoa B: De nada.",AUD-20240829-WA0050,Francisco Gomes de Beleza,A idade da pessoa não está especificada no texto.,Masculino,Foi uma rotina. Antiga que os meus familiares amavam e eu amo.,"O texto não especifica há quanto tempo, mas menciona que é ""uma rotina. Antiga que os meus familiares amavam e eu amo.""","Não, é só a claridão mesmo, só a claridão, que é o que estão colocando aqui, né? Ah, sim. Aí visualiza a gente.",Essa informação não está presente no texto.,Essa informação não está presente no texto.,"Sim, sim. Já tive, né? Quatro. Tive quatro motos. Vivo com a bicicletinha hoje, numa luta grande, tentando conquistar outra moto.","Existe alguma rua de Fortaleza que você gostaria de colocar uma ciclofaixa ou ciclovia? Ou melhorar alguma estrutura dessas? Não, só ando nessa aqui. Só ando nela aqui. Até Maracanaú.",Preferência pessoal,Mais de 5 anos,Calor ou clima,,,"Sim, por uma moto"
"Qual o seu nome e idade? Era 45 anos. Por que você escolheu a bicicleta? Eu amo pedalar e é um meio de transporte mais rápido, né? Mas eu amo, amo pedalar. Você tem alguma sugestão para melhorar a qualidade e o conforto de andar de bicicleta em Fortaleza? Assim, eu tô vendo que melhorou muito, né? Eu vejo que melhorou muito, mas ainda tem muito que melhorar, né? Que tem buraco. Você já sabia que quando eu fui de Maciel, é cheio de buraco, né? Então, tem ciclista que anda exatamente pela via de ônibus, exatamente por causa do buraco. Que tá muito ruimzinho, mas melhorou muito. Você vê que antigamente não existia, né? E hoje... Você tem alguma sugestão pra melhorar o conforto? Não, eu só penso em melhorar as vias. Você gostaria de trocar a bicicleta por outro meio de transporte? Não. Existe alguma rua de Fortaleza que você gostaria de ter uma ciclopasta, uma ciclovia? Não lembro no momento, não. Tá bom. Ou melhorar alguma que já existe? A nossa é Guadalupe, né? Porque eu ando muito. Tá bom, obrigada.","Pessoa A: Qual o seu nome e idade? Era 45 anos. Por que você escolheu a bicicleta? Eu amo pedalar e é um meio de transporte mais rápido, né? Mas eu amo, amo pedalar. Você tem alguma sugestão para melhorar a qualidade e o conforto de andar de bicicleta em Fortaleza? Assim, eu tô vendo que melhorou muito, né? Eu vejo que melhorou muito, mas ainda tem muito que melhorar, né? Que tem buraco. Você já sabia que quando eu fui de Maciel, é cheio de buraco, né? Então, tem ciclista que anda exatamente pela via de ônibus, exatamente por causa do buraco. Que tá muito ruimzinho, mas melhorou muito. Você vê que antigamente não existia, né? E hoje... Você tem alguma sugestão pra melhorar o conforto? Não, eu só penso em melhorar as vias. Você gostaria de trocar a bicicleta por outro meio de transporte? Não. Existe alguma rua de Fortaleza que você gostaria de ter uma ciclopasta, uma ciclovia? Não lembro no momento, não. Tá bom. Ou melhorar alguma que já existe? A nossa é Guadalupe, né? Porque eu ando muito. Tá bom, obrigada.",AUD-20240829-WA0060,O nome da pessoa entrevistada não está no texto.,45 anos,"Eu amo pedalar e é um meio de transporte mais rápido, né? Mas eu amo, amo pedalar.","Eu amo pedalar e é um meio de transporte mais rápido, né? Mas eu amo, amo pedalar.",A informação sobre há quanto tempo a pessoa utiliza bicicleta não está presente no texto.,"que tem buraco. Você já sabia que quando eu fui de Maciel, é cheio de buraco, né? Então, tem ciclista que anda exatamente pela via de ônibus, exatamente por causa do buraco. Que tá muito ruimzinho, mas melhorou muito.",Essa informação não está presente no texto fornecido.,Não há menção no texto sobre a pessoa ter sofrido algum acidente no último ano.,Você gostaria de trocar a bicicleta por outro meio de transporte? Não.,"Existe alguma rua de Fortaleza que você gostaria de ter uma ciclopasta, uma ciclovia? Não lembro no momento, não. Tá bom. Ou melhorar alguma que já existe? A nossa é Guadalupe, né? Porque eu ando muito.",Rapidez \ Tempo;Preferência pessoal,,Buracos na ciclovia,,Não,Não
"Qual o teu nome e a tua idade? Junho, tenho 34 anos Por que você. Escolheu andar de bicicleta? Pra mim é um meio de transporte mais acessível, financeiramente falando E como eu sou da área de educação física, já funciona também como um cardio Qual o. Principal problema que tu encontra ao andar de bicicleta aqui em Fortaleza? Bom, a malha de ciclobias em Fortaleza aumentou bastante, o que é muito positivo mas ao mesmo tempo eu sinto uma dificuldade muito grande no questão de manutenção as pessoas jogam muito vidro nas ciclovias tem uma ciclovia ali a caminho do rio Mar Kennedy que é impossível você andar nela, é de tanto vidro e lixo que tem então você se vê obrigado a andar no meio da piscina porque senão o pneu vai furar com muita facilidade fora que os pedestres não respeitam a ciclovia, muitas das vezes eles ficam andando e eles andam dos dois lados da ciclovia, você não tem como desviar Quando você apita ou buzina, eles acham muito como se a ciclovia fosse feita pra eles desfilarem, sendo que tem calçados dos dois lados, né, pra eles andarem Ainda assim, eles se opitam por andar na ciclovia Então ainda é uma questão muito de educação da própria população mesmo, de manter a ciclovia limpa e entender que ela se copia pras bicicletas e não pros pedestres andarem Entendi. Você gostaria de trocar a bicicleta por algum outro meio de transporte? Futuramente sim, né, até porque É preciso, mas a longo prazo, atualmente não. Existe alguma rua que você gostaria de ver uma ciclofaixa ou ciclovia? Sim, eu acho que as ciclovias, por exemplo, que diz respeito ali perto do terminal da Parangaba, em direção Pra quem vai pra Lagoa da Parangaba não tem nenhuma ciclopia. Lá é meio caótico, então quando você passa por aquela rua em frente ao terminal, você passa lá e é muito perigoso, porque além de ser muito estreitinho, é difícil pra bicicleta passar. E pra quem vai em direção à Lagoa da Parangaba, Tem uma universidade ali, a Estácia, que eu estudo lá Às vezes eu tenho que ir por lá, é bem complicado o caminho Então eu acho que uma ciclovia... Não sei como faria já, que é tão estreito ali Mas eu acho que alguma coisa naquela direção seria legal Ah, ótimo! Obrigada! De nada!","Pessoa A: Qual o teu nome e a tua idade?
Pessoa B: Junho, tenho 34 anos Por que você.
Pessoa A: Escolheu andar de bicicleta?
Pessoa B: Pra mim é um meio de transporte mais acessível, financeiramente falando E como eu sou da área de educação física, já funciona também como um cardio Qual o.
Pessoa A: Principal problema que tu encontra ao andar de bicicleta aqui em Fortaleza?
Pessoa B: Bom, a malha de ciclobias em Fortaleza aumentou bastante, o que é muito positivo mas ao mesmo tempo eu sinto uma dificuldade muito grande no questão de manutenção as pessoas jogam muito vidro nas ciclovias tem uma ciclovia ali a caminho do rio Mar Kennedy que é impossível você andar nela, é de tanto vidro e lixo que tem então você se vê obrigado a andar no meio da piscina porque senão o pneu vai furar com muita facilidade fora que os pedestres não respeitam a ciclovia, muitas das vezes eles ficam andando e eles andam dos dois lados da ciclovia, você não tem como desviar Quando você apita ou buzina, eles acham muito como se a ciclovia fosse feita pra eles desfilarem, sendo que tem calçados dos dois lados, né, pra eles andarem Ainda assim, eles se opitam por andar na ciclovia Então ainda é uma questão muito de educação da própria população mesmo, de manter a ciclovia limpa e entender que ela se copia pras bicicletas e não pros pedestres andarem Entendi.
Pessoa A: Você gostaria de trocar a bicicleta por algum outro meio de transporte?
Pessoa B: Futuramente sim, né, até porque É preciso, mas a longo prazo, atualmente não.
Pessoa A: Existe alguma rua que você gostaria de ver uma ciclofaixa ou ciclovia?
Pessoa B: Sim, eu acho que as ciclovias, por exemplo, que diz respeito ali perto do terminal da Parangaba, em direção Pra quem vai pra Lagoa da Parangaba não tem nenhuma ciclopia. Lá é meio caótico, então quando você passa por aquela rua em frente ao terminal, você passa lá e é muito perigoso, porque além de ser muito estreitinho, é difícil pra bicicleta passar. E pra quem vai em direção à Lagoa da Parangaba, Tem uma universidade ali, a Estácia, que eu estudo lá Às vezes eu tenho que ir por lá, é bem complicado o caminho Então eu acho que uma ciclovia... Não sei como faria já, que é tão estreito ali Mas eu acho que alguma coisa naquela direção seria legal Ah, ótimo!
Pessoa C: Obrigada!
Pessoa B: De nada!",AUD-20240829-WA0061,Junho,34 anos,"Pra mim é um meio de transporte mais acessível, financeiramente falando E como eu sou da área de educação física, já funciona também como um cardio","Pra mim é um meio de transporte mais acessível, financeiramente falando E como eu sou da área de educação física, já funciona também como um cardio","Essa informação não está presente no texto. O entrevistado menciona ter escolhido a bicicleta como meio de transporte, mas não diz há quanto tempo a utiliza.","Bom, a malha de ciclobias em Fortaleza aumentou bastante, o que é muito positivo mas ao mesmo tempo eu sinto uma dificuldade muito grande no questão de manutenção as pessoas jogam muito vidro nas ciclovias tem uma ciclovia ali a caminho do rio Mar Kennedy que é impossível você andar nela, é de tanto vidro e lixo que tem então você se vê obrigado a andar no meio da piscina porque senão o pneu vai furar com muita facilidade fora que os pedestres não respeitam a ciclovia, muitas das vezes eles ficam andando e eles andam dos dois lados da ciclovia, você não tem como desviar Quando você apita ou buzina, eles acham muito como se a ciclovia fosse feita pra eles desfilarem, sendo que tem calçados dos dois lados, né, pra eles andarem Ainda assim, eles se opitam por andar na ciclovia Então ainda é uma questão muito de educação da própria população mesmo, de manter a ciclovia limpa e entender que ela se copia pras bicicletas e não pros pedestres andarem","O texto não diz explicitamente se a pessoa tem medo de sofrer acidentes. No entanto, ela menciona que andar na rua em frente ao terminal da Parangaba ""é muito perigoso"" e que é obrigada a andar no meio da pista em outra ciclovia porque tem muito vidro e lixo.",Essa informação não está contida no texto fornecido.,"Você gostaria de trocar a bicicleta por algum outro meio de transporte? Futuramente sim, né, até porque É preciso, mas a longo prazo, atualmente não.","Existe alguma rua que você gostaria de ver uma ciclofaixa ou ciclovia? Sim, eu acho que as ciclovias, por exemplo, que diz respeito ali perto do terminal da Parangaba, em direção Pra quem vai pra Lagoa da Parangaba não tem nenhuma ciclopia. Lá é meio caótico, então quando você passa por aquela rua em frente ao terminal, você passa lá e é muito perigoso, porque além de ser muito estreitinho, é difícil pra bicicleta passar. E pra quem vai em direção à Lagoa da Parangaba, Tem uma universidade ali, a Estácia, que eu estudo lá Às vezes eu tenho que ir por lá, é bem complicado o caminho Então eu acho que uma ciclovia... Não sei como faria já, que é tão estreito ali Mas eu acho que alguma coisa naquela direção seria legal",Custo \ É mais barato;Exercício e saúde,,Lixo na ciclovia; Outros obstáculos na ciclovia,"Sim, tenho medo de acidentes",,Não
"Eu queria saber do senhor qual a sua idade, seu. Nome, por favor? 58 anos, Erivado. Certo. Por que o senhor escolheu andar de bicicleta? O transporte eu tenho. Qual o principal problema que você acha que tem aqui em Fortaleza pra andar de bicicleta? É só o trânsito não é assim mesmo. Certo. Você tem alguma sugestão pra melhorar? Você gostaria de trocar a bicicleta por outro meio de transporte? Se eu pudesse, né? Existe alguma rua em Fortaleza que você gostaria de ter uma ciclofaixa ou ciclovia? Com proteção, melhor? Eu moro aqui perto, já trabalho mais de tempo. Quando eu for pra lá eu vou de óleo, vou de ouro. Tá bem, obrigada.","Pessoa A: Eu queria saber do senhor qual a sua idade, seu.
Pessoa B: Nome, por favor? 58 anos, Erivado.
Pessoa A: Certo. Por que o senhor escolheu andar de bicicleta?
Pessoa B: O transporte eu tenho.
Pessoa A: Qual o principal problema que você acha que tem aqui em Fortaleza pra andar de bicicleta?
Pessoa B: É só o trânsito não é assim mesmo. Certo.
Pessoa A: Você tem alguma sugestão pra melhorar? Você gostaria de trocar a bicicleta por outro meio de transporte?
Pessoa B: Se eu pudesse, né?
Pessoa A: Existe alguma rua em Fortaleza que você gostaria de ter uma ciclofaixa ou ciclovia? Com proteção, melhor?
Pessoa B: Eu moro aqui perto, já trabalho mais de tempo. Quando eu for pra lá eu vou de óleo, vou de ouro.
Pessoa A: Tá bem, obrigada.",AUD-20240829-WA0062,Erivado,58 anos,O transporte eu tenho.,O transporte eu tenho.,já trabalho mais de tempo.,É só o trânsito não é assim mesmo.,Qual o principal problema que você acha que tem aqui em Fortaleza pra andar de bicicleta? É só o trânsito não é assim mesmo.,Essa informação não está presente no texto.,"Você gostaria de trocar a bicicleta por outro meio de transporte? Se eu pudesse, né?","Existe alguma rua em Fortaleza que você gostaria de ter uma ciclofaixa ou ciclovia? Com proteção, melhor? Eu moro aqui perto, já trabalho mais de tempo. Quando eu for pra lá eu vou de óleo, vou de ouro.",Única opção,Mais de 5 anos,Desrespeito dos motoristas ou Trânsito,Não,,"Sim, mas não especifica qual meio"
"Vai, seu nome e idade, por favor. Meu nome é Ana Carolina e eu tenho 30 anos. Por que você escolheu andar de bicicleta? Eu ando de bicicleta desde sempre. Aí sempre foi meu meio de transporte. Eu não sou daqui, eu morei em Maricá, em Niterói, no Rio, e agora aqui, e sempre foi o meu meio de transporte. Qual o principal problema que tu enfrenta de bicicleta aqui em Fortaleza? O respeito de motoristas de carro, mas principalmente motociclistas, que é muito comum eles usarem a faixa de bicicleta pra ir mais rápido no trânsito Tu tem alguma sugestão de melhoria pra ter conforto? Eu acho que... Olha, conforto... Assim, tem muitas cicloflagens que precisam de manutenção, muitos buracos, aí é que a gente trabalha um pouco. Mas o principal é a fiscalização com relação a motoristas de carro e de moto, porque eles acabam entrando na nossa faixa, né? Você gostaria de trocar bicicleta com outro pessoal? Tem que pensar. Existe alguma rua de Fortaleza que ainda não tem ciclofaixa, ciclovia, que tu gostaria de ter ou melhorar alguma que já existe? Sim, é muito importante que a ciclovia... Eu não sei o nome daquela rua, mas saindo aqui... Tá, é uma rua que vai até o S. Eu posso ir pelo mapa? Peraí. Ó, meu trabalho é aqui. Então... Pronto, a Rua Holanda. A Guadupe do Maciel, aí a Rua Holanda, podia deixar até a Oeste, tem um hospital que estão fazendo um novo lá, então seria muito legal ter esse contato ali também. Ai, que massa. Obrigada, viu? De nada.","Pessoa A: Vai, seu nome e idade, por favor. Meu nome é Ana Carolina e eu tenho 30 anos. Por que você escolheu andar de bicicleta? Eu ando de bicicleta desde sempre. Aí sempre foi meu meio de transporte. Eu não sou daqui, eu morei em Maricá, em Niterói, no Rio, e agora aqui, e sempre foi o meu meio de transporte. Qual o principal problema que tu enfrenta de bicicleta aqui em Fortaleza? O respeito de motoristas de carro, mas principalmente motociclistas, que é muito comum eles usarem a faixa de bicicleta pra ir mais rápido no trânsito Tu tem alguma sugestão de melhoria pra ter conforto? Eu acho que... Olha, conforto... Assim, tem muitas cicloflagens que precisam de manutenção, muitos buracos, aí é que a gente trabalha um pouco. Mas o principal é a fiscalização com relação a motoristas de carro e de moto, porque eles acabam entrando na nossa faixa, né? Você gostaria de trocar bicicleta com outro pessoal? Tem que pensar. Existe alguma rua de Fortaleza que ainda não tem ciclofaixa, ciclovia, que tu gostaria de ter ou melhorar alguma que já existe? Sim, é muito importante que a ciclovia... Eu não sei o nome daquela rua, mas saindo aqui... Tá, é uma rua que vai até o S. Eu posso ir pelo mapa? Peraí. Ó, meu trabalho é aqui. Então... Pronto, a Rua Holanda. A Guadupe do Maciel, aí a Rua Holanda, podia deixar até a Oeste, tem um hospital que estão fazendo um novo lá, então seria muito legal ter esse contato ali também. Ai, que massa. Obrigada, viu? De nada.",AUD-20240829-WA0063,Ana Carolina,30 anos,"Eu ando de bicicleta desde sempre. Aí sempre foi meu meio de transporte. Eu não sou daqui, eu morei em Maricá, em Niterói, no Rio, e agora aqui, e sempre foi o meu meio de transporte.","Eu ando de bicicleta desde sempre. Aí sempre foi meu meio de transporte. Eu não sou daqui, eu morei em Maricá, em Niterói, no Rio, e agora aqui, e sempre foi o meu meio de transporte.",Eu ando de bicicleta desde sempre.,"O respeito de motoristas de carro, mas principalmente motociclistas, que é muito comum eles usarem a faixa de bicicleta pra ir mais rápido no trânsito","O texto não menciona explicitamente se a pessoa tem medo de sofrer acidentes, mas aborda problemas de segurança como ""O respeito de motoristas de carro, mas principalmente motociclistas, que é muito comum eles usarem a faixa de bicicleta pra ir mais rápido no trânsito"" e sugere ""fiscalização com relação a motoristas de carro e de moto, porque eles acabam entrando na nossa faixa, né?"".",A informação sobre se a pessoa sofreu algum acidente no último ano não está presente no texto fornecido.,Você gostaria de trocar bicicleta com outro pessoal? Tem que pensar.,"Existe alguma rua de Fortaleza que ainda não tem ciclofaixa, ciclovia, que tu gostaria de ter ou melhorar alguma que já existe? Sim, é muito importante que a ciclovia... Eu não sei o nome daquela rua, mas saindo aqui... Tá, é uma rua que vai até o S. Eu posso ir pelo mapa? Peraí. Ó, meu trabalho é aqui. Então... Pronto, a Rua Holanda. A Guadupe do Maciel, aí a Rua Holanda, podia deixar até a Oeste, tem um hospital que estão fazendo um novo lá, então seria muito legal ter esse contato ali também.",Praticidade e conveniência,Mais de 5 anos,Desrespeito dos motoristas ou Trânsito; Invasão de carros ou motos na ciclovia,"Sim, tenho medo de acidentes",,Não
"Qual o teu nome e tua idade, por favor? Samir, 18 anos. Por que que tu escolheu andar de bicicleta? Porque é melhor, é melhor o carro de trânsito. Qual o principal problema que tu encontra enquanto tu anda, tipo, em bicicleta aqui em Fortaleza? É a estrada de bicicleta. Tire buraco. Você tem alguma sugestão pra melhorar a qualidade do conforto desse andar de bicicleta em Fortaleza? De seus caminhos? Acho que não. Tu gostaria de trocar de bicicleta por outro meio de transporte? Não. Existe alguma rua aqui em Fortaleza que você gostaria que tivesse uma ciclovia, uma ciclofaixa, uma infraestrutura? A Chinasol de Pai. Tá bem.","Pessoa A: Qual o teu nome e tua idade, por favor?
Pessoa B: Samir, 18 anos.
Pessoa A: Por que que tu escolheu andar de bicicleta?
Pessoa B: Porque é melhor, é melhor o carro de trânsito.
Pessoa A: Qual o principal problema que tu encontra enquanto tu anda, tipo, em bicicleta aqui em Fortaleza?
Pessoa B: É a estrada de bicicleta. Tire buraco.
Pessoa A: Você tem alguma sugestão pra melhorar a qualidade do conforto desse andar de bicicleta em Fortaleza?
Pessoa B: De seus caminhos? Acho que não.
Pessoa A: Tu gostaria de trocar de bicicleta por outro meio de transporte?
Pessoa B: Não.
Pessoa A: Existe alguma rua aqui em Fortaleza que você gostaria que tivesse uma ciclovia, uma ciclofaixa, uma infraestrutura?
Pessoa B: A Chinasol de Pai.
Pessoa A: Tá bem.",AUD-20240829-WA0070,Samir,18 anos,"Porque é melhor, é melhor o carro de trânsito.","Porque é melhor, é melhor o carro de trânsito.",O texto não especifica há quanto tempo a pessoa utiliza a bicicleta.,É a estrada de bicicleta. Tire buraco.,Essa informação não está presente no texto.,Não há menção no texto sobre a pessoa ter sofrido algum acidente no último ano.,Tu gostaria de trocar de bicicleta por outro meio de transporte? Não.,"Existe alguma rua aqui em Fortaleza que você gostaria que tivesse uma ciclovia, uma ciclofaixa, uma infraestrutura? A Chinasol de Pai. Tá bem.",Rapidez \ Tempo;Praticidade e conveniência,,Buracos na ciclovia,,Não,Não
