text,conversation,file,Nome,idade,genero,por_que_escolheu_andar_de_bicicleta?,ha_quanto_tempo_utiliza?,qual_e_o_principal_problema_que_voce_enfrenta_ao_andar_de_bicicleta_em_fortaleza,tem_medo_de_sofrer_acidentes_andando_de_bicicleta_em_Fortaleza?,sofreu_algum_acidente_no_último_ano?,gostaria_de_trocar_a_bicicleta_por_outro_meio_de_transporte,existe_alguma_rua_em_fortaleza_em_que_gostaria_de_ver_uma_ciclovia,por_que_escolheu_ou_escolhe_andar_de_bicicleta_agrupado,ha_quanto_tempo_utiliza_agrupado,qual_e_o_principal_problema_que_voce_enfrenta_ao_andar_de_bicicleta_em_fortaleza_agrupado,tem_medo_de_sofrer_acidentes_andando_de_bicicleta_em_Fortaleza_agrupado,sofreu_algum_acidente_no_último_ano_agrupado,gostaria_de_trocar_a_bicicleta_por_outro_meio_de_transporte_agrupado
"Seu nome e a sua idade, por favor. Charles, 40 anos. Por que você escolheu andar de bicicleta e há quanto tempo utiliza? Eu utilizo há 20 anos. Eu escolhi devido à saúde, que é bom para a saúde, é bom para o coração. Qual o principal problema que você enfrenta ao andar de bicicleta em Fortaleza? Muitas vezes é o trânsito. Eles nos respeitam, querem passar muito colado na gente. A gente tem medo. Mas a vida é assim mesmo, é andar com atenção pra não se atropelar. Certo. Você tem medo de sofrer acidente andando de bicicleta aqui? Muito medo. Já sofreu algum acidente no último ano? Já, já sofri acidente, o carro me jogou pra cima, eu caí igual um pássaro embaleado no chão. Ai, meu Deus. Você gostaria de trocar a bicicleta por outro meio de transporte? Se eu tivesse condições, eu gostaria. Certo. Existe alguma rua em Fortaleza que você queria que tivesse uma ciclofaixa, que ainda não tem? Uma ciclovia? Na rua ali do... Esqueci o nome agora da rua. Tá. Tem algum ponto de referência aí que dá certo. Vai ao Paraíso. Muito obrigada.","Pessoa A: Seu nome e a sua idade, por favor.
Pessoa B: Charles, 40 anos.
Pessoa A: Por que você escolheu andar de bicicleta e há quanto tempo utiliza?
Pessoa B: Eu utilizo há 20 anos. Eu escolhi devido à saúde, que é bom para a saúde, é bom para o coração.
Pessoa A: Qual o principal problema que você enfrenta ao andar de bicicleta em Fortaleza?
Pessoa B: Muitas vezes é o trânsito. Eles nos respeitam, querem passar muito colado na gente. A gente tem medo. Mas a vida é assim mesmo, é andar com atenção pra não se atropelar.
Pessoa A: Certo. Você tem medo de sofrer acidente andando de bicicleta aqui?
Pessoa B: Muito medo.
Pessoa A: Já sofreu algum acidente no último ano?
Pessoa B: Já, já sofri acidente, o carro me jogou pra cima, eu caí igual um pássaro embaleado no chão.
Pessoa A: Ai, meu Deus. Você gostaria de trocar a bicicleta por outro meio de transporte?
Pessoa B: Se eu tivesse condições, eu gostaria.
Pessoa A: Certo. Existe alguma rua em Fortaleza que você queria que tivesse uma ciclofaixa, que ainda não tem?
Pessoa B: Uma ciclovia? Na rua ali do... Esqueci o nome agora da rua.
Pessoa A: Tá. Tem algum ponto de referência aí que dá certo.
Pessoa B: Vai ao Paraíso.
Pessoa A: Muito obrigada.",00000002-AUDIO-2025-08-19-16-09-16,Charles,40,Masculino,"Eu escolhi devido à saúde, que é bom para a saúde, é bom para o coração.",Eu utilizo há 20 anos.,"Muitas vezes é o trânsito. Eles nos respeitam, querem passar muito colado na gente. A gente tem medo.",Você tem medo de sofrer acidente andando de bicicleta aqui? Muito medo.,"Já, já sofri acidente, o carro me jogou pra cima, eu caí igual um pássaro embaleado no chão. Ai, meu Deus.","Você gostaria de trocar a bicicleta por outro meio de transporte? Se eu tivesse condições, eu gostaria. Certo.","Existe alguma rua em Fortaleza que você queria que tivesse uma ciclofaixa, que ainda não tem? Uma ciclovia? Na rua ali do... Esqueci o nome agora da rua. Tá. Tem algum ponto de referência aí que dá certo. Vai ao Paraíso.",Exercício e saúde,Mais de 5 anos,Desrespeito dos motoristas;Risco de acidentes,"Sim, tenho medo de acidentes",Sim,"Sim, mas não especifica qual meio"
"O seu nome e a sua idade? Valdemir, eu tenho 60 anos. Por que o senhor escolheu andar de bicicleta e há quanto tempo utiliza? Faz tempo, porque faz bem à saúde, né? Eu recebo o cartão, mas eu venho de bike. Eu vou lá por esse queroz. Qual. O principal problema que você enfrenta ao andar de bicicleta em Fortaleza? É porque ciclovia não tem ali na Serrinha, né? Aquela parte lá. Do Castelão pra lá não tem ciclovia. Aí fica ruim, né? Sim. Aí é perigoso aquele pedaço ali, né? O castelão pra serrinha. Você tem medo de sofrer acidente andando de bicicleta? Com certeza. Você já sofreu algum acidente no último ano? Não, não, não. Graças a Deus, não. Você gostaria de trocar a bicicleta por outro meio de transporte? Outro meio? Eu gostaria. Certo. Existe alguma rua em Fortaleza que você gostaria que tivesse uma ciclovia, que ainda não tem? Com a rua, na Fernanditavros. Tá certo. Muito obrigada.","Pessoa B: O seu nome e a sua idade?
Pessoa A: Valdemir, eu tenho 60 anos.
Pessoa B: Por que o senhor escolheu andar de bicicleta e há quanto tempo utiliza?
Pessoa A: Faz tempo, porque faz bem à saúde, né? Eu recebo o cartão, mas eu venho de bike. Eu vou lá por esse queroz. Qual.
Pessoa B: O principal problema que você enfrenta ao andar de bicicleta em Fortaleza?
Pessoa A: É porque ciclovia não tem ali na Serrinha, né? Aquela parte lá. Do Castelão pra lá não tem ciclovia. Aí fica ruim, né?
Pessoa B: Sim.
Pessoa A: Aí é perigoso aquele pedaço ali, né? O castelão pra serrinha.
Pessoa B: Você tem medo de sofrer acidente andando de bicicleta?
Pessoa A: Com certeza.
Pessoa B: Você já sofreu algum acidente no último ano?
Pessoa A: Não, não, não. Graças a Deus, não.
Pessoa B: Você gostaria de trocar a bicicleta por outro meio de transporte?
Pessoa A: Outro meio? Eu gostaria.
Pessoa B: Certo. Existe alguma rua em Fortaleza que você gostaria que tivesse uma ciclovia, que ainda não tem?
Pessoa A: Com a rua, na Fernanditavros.
Pessoa B: Tá certo. Muito obrigada.",00000004-AUDIO-2025-08-19-16-14-12,Valdemir,60,Masculino,"Faz tempo, porque faz bem à saúde, né? Eu recebo o cartão, mas eu venho de bike. Eu vou lá por esse queroz.","Faz tempo, porque faz bem à saúde, né?","É porque ciclovia não tem ali na Serrinha, né? Aquela parte lá. Do Castelão pra lá não tem ciclovia.",Você tem medo de sofrer acidente andando de bicicleta? Com certeza.,"Você já sofreu algum acidente no último ano? Não, não, não. Graças a Deus, não.",Você gostaria de trocar a bicicleta por outro meio de transporte? Outro meio? Eu gostaria. Certo.,"Existe alguma rua em Fortaleza que você gostaria que tivesse uma ciclovia, que ainda não tem? Com a rua, na Fernanditavros.",Exercício e saúde,Mais de 5 anos,Falta de ciclovias,"Sim, tenho medo de acidentes",Não,"Sim, mas não especifica qual meio"
"Olá, boa tarde. Posso fazer uma entrevista rapidinho com o senhor? É só em áudio. O seu nome e idade, por favor? Bonito, André Santana. Por que o senhor escolheu andar de bicicleta e há quanto tempo você utiliza? É porque eu acho bom, porque é perto do meu trabalho, né? Eu trabalho aqui no banco aqui, Banco do Nordeste. Eu acho melhor pra mim. Certo, é um transporte perigoso, mas o senhor tem que ter cuidado, né? Eu acho bom, né? A minha idade é... Eu tenho uns 57 anos. 57 anos. 13 de 5, 68. Qual é o principal problema que você enfrenta ao andar de bicicleta em Fortaleza? Bom, eu acho legal, eu acho bom, né? Não tem enfrentado nenhum problema, então? Não, até agora, graças a Deus, não, né? O senhor tem medo de sofrer acidente andando de bicicleta em Fortaleza? Com certeza. Com certeza eu tenho. Já sofreu algum acidente no último ano? Graças a Deus, não. O senhor gostaria de trocar a bicicleta por um outro meio de transporte? Gostaria. Gostaria, sim. Com certeza, gostaria. E existe alguma rua aqui em Fortaleza que o senhor gostaria de ver uma ciclovia? Ah, isso era ótimo, a Fortaleza era bom demais, né? Qual a rua? O senhor sabe? Bom, eu tô morando aqui, tá com 3 meses que eu moro ali, naquele conjunto novo, né? E agora que acabou de entregar, tá com 3 meses que eu tô morando lá. Lá não tem a ciclovia, o senhor quer que implante, né? Exatamente. A ciclovia são essas faixas ali, né? Eu sei, eu sei, tô entendendo. Tá bom, muito obrigada, viu? De nada.","Pessoa A: Olá, boa tarde. Posso fazer uma entrevista rapidinho com o senhor? É só em áudio. O seu nome e idade, por favor?
Pessoa B: Bonito, André Santana.
Pessoa A: Por que o senhor escolheu andar de bicicleta e há quanto tempo você utiliza?
Pessoa B: É porque eu acho bom, porque é perto do meu trabalho, né? Eu trabalho aqui no banco aqui, Banco do Nordeste. Eu acho melhor pra mim. Certo, é um transporte perigoso, mas o senhor tem que ter cuidado, né? Eu acho bom, né? A minha idade é... Eu tenho uns 57 anos. 57 anos. 13 de 5, 68.
Pessoa A: Qual é o principal problema que você enfrenta ao andar de bicicleta em Fortaleza?
Pessoa B: Bom, eu acho legal, eu acho bom, né?
Pessoa A: Não tem enfrentado nenhum problema, então?
Pessoa B: Não, até agora, graças a Deus, não, né?
Pessoa A: O senhor tem medo de sofrer acidente andando de bicicleta em Fortaleza?
Pessoa B: Com certeza. Com certeza eu tenho.
Pessoa A: Já sofreu algum acidente no último ano?
Pessoa B: Graças a Deus, não.
Pessoa A: O senhor gostaria de trocar a bicicleta por um outro meio de transporte?
Pessoa B: Gostaria. Gostaria, sim. Com certeza, gostaria.
Pessoa A: E existe alguma rua aqui em Fortaleza que o senhor gostaria de ver uma ciclovia?
Pessoa B: Ah, isso era ótimo, a Fortaleza era bom demais, né?
Pessoa A: Qual a rua? O senhor sabe?
Pessoa B: Bom, eu tô morando aqui, tá com 3 meses que eu moro ali, naquele conjunto novo, né? E agora que acabou de entregar, tá com 3 meses que eu tô morando lá.
Pessoa A: Lá não tem a ciclovia, o senhor quer que implante, né?
Pessoa B: Exatamente.
Pessoa A: A ciclovia são essas faixas ali, né?
Pessoa B: Eu sei, eu sei, tô entendendo.
Pessoa A: Tá bom, muito obrigada, viu?
Pessoa B: De nada.",00000005-AUDIO-2025-08-19-16-15-02,"Bonito, André Santana",57,Masculino,"É porque eu acho bom, porque é perto do meu trabalho, né? Eu trabalho aqui no banco aqui, Banco do Nordeste. Eu acho melhor pra mim.","Por que o senhor escolheu andar de bicicleta e há quanto tempo você utiliza? É porque eu acho bom, porque é perto do meu trabalho, né? Eu trabalho aqui no banco aqui, Banco do Nordeste. Eu acho melhor pra mim.","Qual é o principal problema que você enfrenta ao andar de bicicleta em Fortaleza? Bom, eu acho legal, eu acho bom, né? Não tem enfrentado nenhum problema, então? Não, até agora, graças a Deus, não, né?",O senhor tem medo de sofrer acidente andando de bicicleta em Fortaleza? Com certeza. Com certeza eu tenho.,"Já sofreu algum acidente no último ano? Graças a Deus, não.","O senhor gostaria de trocar a bicicleta por um outro meio de transporte? Gostaria. Gostaria, sim. Com certeza, gostaria.","E existe alguma rua aqui em Fortaleza que o senhor gostaria de ver uma ciclovia? Ah, isso era ótimo, a Fortaleza era bom demais, né? Qual a rua? O senhor sabe? Bom, eu tô morando aqui, tá com 3 meses que eu moro ali, naquele conjunto novo, né? E agora que acabou de entregar, tá com 3 meses que eu tô morando lá. Lá não tem a ciclovia, o senhor quer que implante, né? Exatamente.",Praticidade e conveniência; Preferência pessoal,,,"Sim, tenho medo de acidentes",Não,"Sim, mas não especifica qual meio"
"Qual o seu nome e a sua idade, por favor? É Gilberto Vieira Nogueira, 52 anos. Por que escolheu andar de bicicleta e há quanto tempo utiliza? Utilizo há mais de 10 anos andando de bicicleta e utilizo porque é muito mais rápido que onde, dá para economizar mais o dinheiro. Qual o principal problema que você enfrenta ao andar de bicicleta em Fortaleza? É aquelas águas que ficam na avenida Godofredo Maciel, que as raízes estão subindo Está atrapalhando muito lá. Você tem medo de sofrer acidente andando de bicicleta? Tenho, né, que as negadas só faltam passar por cima da gente. Se a gente não andar na ciclovia, quando não tem ciclovia, os pessoal só falta passar por cima. Você sofreu algum acidente no último ano? Não, graças a Deus, não. Você gostaria de trocar a bicicleta por outro meio de transporte? Não, eu prefiro a minha bicicletinha mesmo. Vou trocar só os pneus. Existe alguma rua em Fortaleza que não tem ciclovia, ciclofaixa, que você gostaria que tivesse? Perimetral, começar com Marte aí. Até São Cristóvão.","Pessoa A: Qual o seu nome e a sua idade, por favor?
Pessoa B: É Gilberto Vieira Nogueira, 52 anos.
Pessoa A: Por que escolheu andar de bicicleta e há quanto tempo utiliza?
Pessoa B: Utilizo há mais de 10 anos andando de bicicleta e utilizo porque é muito mais rápido que onde, dá para economizar mais o dinheiro.
Pessoa A: Qual o principal problema que você enfrenta ao andar de bicicleta em Fortaleza?
Pessoa B: É aquelas águas que ficam na avenida Godofredo Maciel, que as raízes estão subindo Está atrapalhando muito lá.
Pessoa A: Você tem medo de sofrer acidente andando de bicicleta?
Pessoa B: Tenho, né, que as negadas só faltam passar por cima da gente. Se a gente não andar na ciclovia, quando não tem ciclovia, os pessoal só falta passar por cima.
Pessoa A: Você sofreu algum acidente no último ano?
Pessoa B: Não, graças a Deus, não.
Pessoa A: Você gostaria de trocar a bicicleta por outro meio de transporte?
Pessoa B: Não, eu prefiro a minha bicicletinha mesmo. Vou trocar só os pneus.
Pessoa A: Existe alguma rua em Fortaleza que não tem ciclovia, ciclofaixa, que você gostaria que tivesse?
Pessoa B: Perimetral, começar com Marte aí. Até São Cristóvão.",00000006-AUDIO-2025-08-19-16-15-40,Gilberto Vieira Nogueira,52,Masculino,"Utilizo há mais de 10 anos andando de bicicleta e utilizo porque é muito mais rápido que onde, dá para economizar mais o dinheiro.",Utilizo há mais de 10 anos andando de bicicleta,"É aquelas águas que ficam na avenida Godofredo Maciel, que as raízes estão subindo Está atrapalhando muito lá.","Você tem medo de sofrer acidente andando de bicicleta? Tenho, né, que as negadas só faltam passar por cima da gente. Se a gente não andar na ciclovia, quando não tem ciclovia, os pessoal só falta passar por cima.","Você sofreu algum acidente no último ano? Não, graças a Deus, não.","Você gostaria de trocar a bicicleta por outro meio de transporte? Não, eu prefiro a minha bicicletinha mesmo. Vou trocar só os pneus.","Existe alguma rua em Fortaleza que não tem ciclovia, ciclofaixa, que você gostaria que tivesse? Perimetral, começar com Marte aí. Até São Cristóvão.",Rapidez \ Tempo;Custo \ É mais barato,,Outros obstáculos na ciclovia; Má qualidade das ciclovias,"Sim, tenho medo de acidentes",Não,Não
"Boa tarde. O senhor aceita fazer uma entrevista rapidinho aqui? É só em áudio, tá? O seu nome e idade, por favor. Meu nome é Francisco Carlos Moreira da Silva. Por que o senhor... 35? Por que escolheu andar de bicicleta e há quanto tempo você utiliza? Eu acho bom, né? Está com mais de. 20 anos que. Eu ando. Mais de 20 anos? Qual o principal problema que você enfrenta ao andar de bicicleta em Fortaleza? A dificuldade, né? Os carros, né? Referente a andar. É bastante perigoso. Né, também. E você tem medo de sofrer acidente andando de bicicleta em Fortaleza? Não, muito, né? Não? Não. Cuidado. Já sofreu algum acidente no último ano? De bicicleta, não. Não, né? Você gostaria de trocar a bicicleta por outro meio de transporte? Não. Tá satisfeito? Tô. Existe alguma rua em Fortaleza Existe alguma rua em Fortaleza que você gostaria de ver uma ciclovia? Eu. Só ando daqui mesmo pra casa. Não saio pra longe. Não. Tá bom, então muito obrigada, tá?","Pessoa A: Boa tarde. O senhor aceita fazer uma entrevista rapidinho aqui? É só em áudio, tá? O seu nome e idade, por favor.
Pessoa B: Meu nome é Francisco Carlos Moreira da Silva.
Pessoa A: Por que o senhor... 35? Por que escolheu andar de bicicleta e há quanto tempo você utiliza? Eu acho bom, né? Está com mais de.
Pessoa B: 20 anos que.
Pessoa A: Eu ando.
Pessoa B: Mais de 20 anos?
Pessoa A: Qual o principal problema que você enfrenta ao andar de bicicleta em Fortaleza?
Pessoa B: A dificuldade, né?
Pessoa A: Os carros, né? Referente a andar.
Pessoa B: É bastante perigoso.
Pessoa A: Né, também. E você tem medo de sofrer acidente andando de bicicleta em Fortaleza? Não, muito, né? Não?
Pessoa B: Não. Cuidado.
Pessoa A: Já sofreu algum acidente no último ano?
Pessoa B: De bicicleta, não.
Pessoa A: Não, né? Você gostaria de trocar a bicicleta por outro meio de transporte?
Pessoa B: Não.
Pessoa A: Tá satisfeito?
Pessoa B: Tô.
Pessoa A: Existe alguma rua em Fortaleza Existe alguma rua em Fortaleza que você gostaria de ver uma ciclovia?
Pessoa B: Eu.
Pessoa A: Só ando daqui mesmo pra casa.
Pessoa B: Não saio pra longe.
Pessoa A: Não. Tá bom, então muito obrigada, tá?",00000007-AUDIO-2025-08-19-16-16-23,Francisco Carlos Moreira da Silva,35,Masculino,"Eu acho bom, né? Está com mais de. 20 anos que. Eu ando.",Está com mais de. 20 anos que. Eu ando. Mais de 20 anos?,"A dificuldade, né? Os carros, né? Referente a andar. É bastante perigoso.","E você tem medo de sofrer acidente andando de bicicleta em Fortaleza? Não, muito, né? Não? Não. Cuidado.","Já sofreu algum acidente no último ano? De bicicleta, não. Não, né?",Você gostaria de trocar a bicicleta por outro meio de transporte? Não.,Existe alguma rua em Fortaleza Existe alguma rua em Fortaleza que você gostaria de ver uma ciclovia? Eu. Só ando daqui mesmo pra casa. Não saio pra longe. Não.,Preferência pessoal,Mais de 5 anos,Desrespeito dos motoristas;Risco de acidentes,Não,Não,Não
"Qual o seu nome e a sua idade? Luciana Matias. Eu tenho 44 anos. Certo. Por que você escolheu andar de bicicleta e há quanto tempo utiliza? Já está há seis meses que eu utilizo ela, porque achei melhor por causa dos ônibus, demora mais, a lotação, né? Eu chego mais tarde em casa. E de bicicleta nem, depois que fizeram a ciclofa ficou melhor ainda, né? Qual o principal problema que você enfrenta ao andar de bicicleta em Fortaleza? Às vezes tem as pessoas andando na ciclofaixa e também os carroceiros, que a gente tem que sair para poder desviar deles, porque eles não saem. Você tem medo de sofrer acidente? Sim. Você já sofreu algum? Não. Você gostaria de trocar a bicicleta por outro meio de transporte? Não. Tá bom. Existe alguma rua em Fortaleza que você gostaria que tivesse uma ciclovia, uma ciclofaixa, que ainda não tem ou que está muito ruim e que iria melhorar? Muito obrigada, boa tarde!","Pessoa A: Qual o seu nome e a sua idade? Luciana Matias. Eu tenho 44 anos. Certo. Por que você escolheu andar de bicicleta e há quanto tempo utiliza? Já está há seis meses que eu utilizo ela, porque achei melhor por causa dos ônibus, demora mais, a lotação, né? Eu chego mais tarde em casa. E de bicicleta nem, depois que fizeram a ciclofa ficou melhor ainda, né? Qual o principal problema que você enfrenta ao andar de bicicleta em Fortaleza? Às vezes tem as pessoas andando na ciclofaixa e também os carroceiros, que a gente tem que sair para poder desviar deles, porque eles não saem. Você tem medo de sofrer acidente? Sim. Você já sofreu algum? Não. Você gostaria de trocar a bicicleta por outro meio de transporte? Não. Tá bom. Existe alguma rua em Fortaleza que você gostaria que tivesse uma ciclovia, uma ciclofaixa, que ainda não tem ou que está muito ruim e que iria melhorar? Muito obrigada, boa tarde!",00000008-AUDIO-2025-08-19-16-17-21,Luciana Matias.,44,Feminino,"Já está há seis meses que eu utilizo ela, porque achei melhor por causa dos ônibus, demora mais, a lotação, né? Eu chego mais tarde em casa. E de bicicleta nem, depois que fizeram a ciclofa ficou melhor ainda, né?",Já está há seis meses que eu utilizo ela.,"Às vezes tem as pessoas andando na ciclofaixa e também os carroceiros, que a gente tem que sair para poder desviar deles, porque eles não saem.",Você tem medo de sofrer acidente? Sim.,Você já sofreu algum? Não.,Você gostaria de trocar a bicicleta por outro meio de transporte? Não.,"Existe alguma rua em Fortaleza que você gostaria que tivesse uma ciclovia, uma ciclofaixa, que ainda não tem ou que está muito ruim e que iria melhorar?",Rapidez \ Tempo;Praticidade e conveniência,Menos de um ano,Outros obstáculos na ciclovia,"Sim, tenho medo de acidentes",Não,Não
"Você aceita fazer uma entrevista de áudio, rapidinho? Seu nome e idade? Cláudio Barbosa da Silva, 37 anos. Por que você escolheu andar de bicicleta e há quanto tempo você utiliza? Mais rápido. E mais prático pra mim. Melhor pra mim. Há quanto tempo você utiliza? Tá com mais de um ano. Mais de um ano? Qual o principal problema que você enfrenta ao andar de bicicleta em Fortaleza? Trânsito. Você tem medo de sofrer acidentes andando de bicicleta aqui em Fortaleza? Já sofreu algum acidente no último ano? Não. Gostaria de trocar a bicicleta por outro meio de transporte? No momento, não. Tem alguma rua aqui em Fortaleza que você gostaria de ver com uma ciclovia? Pernambuco. Muito obrigada.","Pessoa A: Você aceita fazer uma entrevista de áudio, rapidinho? Seu nome e idade?
Pessoa B: Cláudio Barbosa da Silva, 37 anos.
Pessoa A: Por que você escolheu andar de bicicleta e há quanto tempo você utiliza?
Pessoa B: Mais rápido. E mais prático pra mim. Melhor pra mim.
Pessoa A: Há quanto tempo você utiliza? Tá com mais de um ano. Mais de um ano? Qual o principal problema que você enfrenta ao andar de bicicleta em Fortaleza?
Pessoa B: Trânsito.
Pessoa A: Você tem medo de sofrer acidentes andando de bicicleta aqui em Fortaleza? Já sofreu algum acidente no último ano? Não. Gostaria de trocar a bicicleta por outro meio de transporte?
Pessoa B: No momento, não.
Pessoa A: Tem alguma rua aqui em Fortaleza que você gostaria de ver com uma ciclovia?
Pessoa B: Pernambuco.
Pessoa A: Muito obrigada.",00000010-AUDIO-2025-08-19-16-18-50,Cláudio Barbosa da Silva,37,Masculino,Mais rápido. E mais prático pra mim. Melhor pra mim.,Há quanto tempo você utiliza? Tá com mais de um ano. Mais de um ano?,Trânsito.,Você tem medo de sofrer acidentes andando de bicicleta aqui em Fortaleza? Já sofreu algum acidente no último ano? Não.,Já sofreu algum acidente no último ano? Não.,"Gostaria de trocar a bicicleta por outro meio de transporte? No momento, não.",Tem alguma rua aqui em Fortaleza que você gostaria de ver com uma ciclovia? Pernambuco.,Rapidez \ Tempo; Praticidade e conveniência; Preferência pessoal,Entre 1 e 2 anos,Risco de acidentes;Desrespeito dos motoristas,Não,Não,Não
"Qual o seu nome e sua idade? Mariela Inés de Cardoso, 41 anos. Por que você escolheu andar de bicicleta e há quanto tempo você utiliza? Mais ou menos um ano. É mais fácil, com pouca emoção. Qual o principal problema que você enfrenta ao andar de bicicleta em Fortaleza? Ah, com certeza o trânsito. O pessoal não respeita muito, né? Você tem medo de sofrer acidente andando de bicicleta? Com certeza. Já sofreu algum? Não, graças a Deus não, mas meu filho já. Você gostaria de trocar a bicicleta por outro meio de transporte? Não, até porque eu não tenho outro meio, só a bicicleta. Certo. Existe alguma rua em Fortaleza que você gostaria que tivesse um seguro-faixa e que ainda não tem? Eu não conheço muito bem Fortaleza. Tá bom. Mas no seu caminho, seus caminhos já tem? Já. Tá bom. Muito obrigada. De nada.","Pessoa A: Qual o seu nome e sua idade? Mariela Inés de Cardoso, 41 anos. Por que você escolheu andar de bicicleta e há quanto tempo você utiliza? Mais ou menos um ano. É mais fácil, com pouca emoção. Qual o principal problema que você enfrenta ao andar de bicicleta em Fortaleza? Ah, com certeza o trânsito. O pessoal não respeita muito, né? Você tem medo de sofrer acidente andando de bicicleta? Com certeza. Já sofreu algum? Não, graças a Deus não, mas meu filho já. Você gostaria de trocar a bicicleta por outro meio de transporte? Não, até porque eu não tenho outro meio, só a bicicleta. Certo. Existe alguma rua em Fortaleza que você gostaria que tivesse um seguro-faixa e que ainda não tem? Eu não conheço muito bem Fortaleza. Tá bom. Mas no seu caminho, seus caminhos já tem? Já. Tá bom. Muito obrigada. De nada.",00000011-AUDIO-2025-08-19-16-21-01,Mariela Inés de Cardoso,41,Feminino,"Mais ou menos um ano. É mais fácil, com pouca emoção.",Mais ou menos um ano.,"Ah, com certeza o trânsito. O pessoal não respeita muito, né?",Você tem medo de sofrer acidente andando de bicicleta? Com certeza.,"Já sofreu algum? Não, graças a Deus não, mas meu filho já.","Você gostaria de trocar a bicicleta por outro meio de transporte? Não, até porque eu não tenho outro meio, só a bicicleta.","Existe alguma rua em Fortaleza que você gostaria que tivesse um seguro-faixa e que ainda não tem? Eu não conheço muito bem Fortaleza. Tá bom. Mas no seu caminho, seus caminhos já tem? Já. Tá bom.",Mais fácil,Entre 1 e 2 anos,Desrespeito dos motoristas,"Sim, tenho medo de acidentes",Não,Não
