text,conversation,file,Nome,idade,genero,por_que_escolheu_andar_de_bicicleta?,ha_quanto_tempo_utiliza?,qual_e_o_principal_problema_que_voce_enfrenta_ao_andar_de_bicicleta_em_fortaleza,tem_medo_de_sofrer_acidentes_andando_de_bicicleta_em_Fortaleza?,sofreu_algum_acidente_no_último_ano?,gostaria_de_trocar_a_bicicleta_por_outro_meio_de_transporte,existe_alguma_rua_em_fortaleza_em_que_gostaria_de_ver_uma_ciclovia,por_que_escolheu_ou_escolhe_andar_de_bicicleta_agrupado,ha_quanto_tempo_utiliza_agrupado,qual_e_o_principal_problema_que_voce_enfrenta_ao_andar_de_bicicleta_em_fortaleza_agrupado,tem_medo_de_sofrer_acidentes_andando_de_bicicleta_em_Fortaleza_agrupado,sofreu_algum_acidente_no_último_ano_agrupado,gostaria_de_trocar_a_bicicleta_por_outro_meio_de_transporte_agrupado
"Qual o seu nome e a sua idade, por favor? Antônio David, 36 anos. Por que você escolheu andar de bicicleta e há quanto tempo você usa? Para mim a mobilidade fica melhor de bicicleta do que transporte público. Faz tempo que você usa? Faz. Eu era maratonista. Corria, pedalava. E nadava. Qual o principal problema que você enfrenta ao andar de bicicleta? Motorista mais educado. Você tem medo de acidente? Com certeza. Já sofreu algum? Já. Até contato? Ou não? Foi na Rua Barbosa. O motoqueiro vinha cortando entre os carros e aí acabou indo pro chão eu, ele e a passageira dele. Sinto muito. Você gostaria de trocar a bicicleta por outro meio de transporte? Por outra. Outra bicicleta? Outra bicicleta. Existe alguma rua em Fortaleza que você gostaria de ter uma ciclovia que ainda não tem? Ou alguma que está ruim que podia melhorar? Uma que está... Eu acho que todas, mas uma que merecia um. Pouco melhor ser revitalizada, a. Que vai pra praia de Iracema, que tem uma parte lá. Da Vispresta, que. Ela é um pouco ruim. E a que vai pro Ozeve, que eu venho e vejo que lá a buraqueira é horrível. Muito obrigada. Obrigada a vocês.","Pessoa B: Qual o seu nome e a sua idade, por favor?
Pessoa A: Antônio David, 36 anos.
Pessoa B: Por que você escolheu andar de bicicleta e há quanto tempo você usa?
Pessoa A: Para mim a mobilidade fica melhor de bicicleta do que transporte público.
Pessoa B: Faz tempo que você usa?
Pessoa A: Faz. Eu era maratonista. Corria, pedalava.
Pessoa B: E nadava. Qual o principal problema que você enfrenta ao andar de bicicleta?
Pessoa A: Motorista mais educado.
Pessoa B: Você tem medo de acidente?
Pessoa A: Com certeza.
Pessoa B: Já sofreu algum?
Pessoa A: Já.
Pessoa B: Até contato? Ou não?
Pessoa A: Foi na Rua Barbosa. O motoqueiro vinha cortando entre os carros e aí acabou indo pro chão eu, ele e a passageira dele. Sinto muito.
Pessoa B: Você gostaria de trocar a bicicleta por outro meio de transporte?
Pessoa A: Por outra.
Pessoa B: Outra bicicleta? Outra bicicleta. Existe alguma rua em Fortaleza que você gostaria de ter uma ciclovia que ainda não tem? Ou alguma que está ruim que podia melhorar?
Pessoa A: Uma que está... Eu acho que todas, mas uma que merecia um.
Pessoa B: Pouco melhor ser revitalizada, a.
Pessoa A: Que vai pra praia de Iracema, que tem uma parte lá.
Pessoa B: Da Vispresta, que.
Pessoa A: Ela é um pouco ruim. E a que vai pro Ozeve, que eu venho e vejo que lá a buraqueira é horrível.
Pessoa B: Muito obrigada.
Pessoa A: Obrigada a vocês.",00000056-AUDIO-2025-08-19-17-14-08,Antônio David,36,Masculino,Para mim a mobilidade fica melhor de bicicleta do que transporte público.,"Faz. Eu era maratonista. Corria, pedalava. E nadava.",Motorista mais educado.,Você tem medo de acidente? Com certeza.,"Já sofreu algum? Já. Até contato? Ou não? Foi na Rua Barbosa. O motoqueiro vinha cortando entre os carros e aí acabou indo pro chão eu, ele e a passageira dele.",Você gostaria de trocar a bicicleta por outro meio de transporte? Por outra. Outra bicicleta? Outra bicicleta.,"Existe alguma rua em Fortaleza que você gostaria de ter uma ciclovia que ainda não tem? Ou alguma que está ruim que podia melhorar? Uma que está... Eu acho que todas, mas uma que merecia um. Pouco melhor ser revitalizada, a. Que vai pra praia de Iracema, que tem uma parte lá. Da Vispresta, que. Ela é um pouco ruim. E a que vai pro Ozeve, que eu venho e vejo que lá a buraqueira é horrível.",Praticidade e conveniência,,Desrespeito dos motoristas,"Sim, tenho medo de acidentes",Sim,"Sim, por uma bicicleta melhor"
"Seu nome e idade? É... 51. E o seu nome? É... Gelsério. Fernando Henrique. Por que você escolheu andar de bicicleta e há quanto tempo você utiliza? Já... 20 anos já. Porque aqui é o seguinte, eu não tenho condição de comprar uma moto, né? Aí eu ando com ela, né? Entendeu? Qual é o principal problema que você enfrenta andando de bicicleta no Porto Alegre? Eu ando com fé em Deus, né? Porque a gente é todo dia aqui riscando o trânsito, né? Aí tem gente que não respeita a gente. Mesmo policial, passa por a gente. Mesmo lá na frente, lá, passou três. Passou três, assim, tem que derrubar, entendeu? E já me levei, já, nessa avenida mesmo, lá perto da BR, né? o Caí, aí outro ia atravessando na moto, bateu nessa linda bicicleta, certo? De pé, e eu na bicicleta. Aí eu falei, como é que pode você fazer um negócio desse? Você tá vendo que eu tô na minha mão e você atravessar... Aí é um morenão bem altão, né? Aí tem... não... É, você tá sentindo alguma coisa? Esse acidente foi há... faz um ano? Tem menos de um ano? É, tá com um ano, mais ou menos. Não, mas eu não cheguei a cair não, entendeu? Foi só o sul. E já é muita coisa. É, muita coisa. E sempre, a gente anda na avenida essa daqui, eu sei que fizeram isso aqui, né? Foi bom pra gente, mas eles não respeitam a gente, entendeu? O principal problema hoje é que o pessoal não respeita. É, não respeita, entendeu? Mesmo fazendo isso aqui, esses caras de moda, ainda toma a faixa da gente, né? Aí a gente sempre vem aqui com cuidado, porque eles não respeitam a gente. Mesmo ter feito isso aqui. Você tem medo de sofrer acidente? Tenho, sim, tenho. Mas é o objeto que a gente tem, né? Tem que andar com fé em Deus, né? Porque a gente vai e vem com fé em Deus. Só ele melhora a gente. No último ano, você sofreu algum acidente? No último ano de bicicleta? Foi esse ano meio, um dia domingo eu merendei, né? Aí quando eu fui saindo pra cortar meu cabelo na Messejana, tem o Cambeba, ali em Pouco Sol, ali naqueles condomínios de pessoal rico, aí tem assim. Aí quando eu vou passar aqui, aí tem um posto na Papagana, daqueles pessoal que vende apartamento, né? Aí eu bati a minha cabeça, numa tauba, que eles putaram, certo? Aí caí, não foi essa daqui não, foi a outra que eu tenho em casa, certo? Aí penou o aro, elevei uma chibatada aqui nas costelas, né? Aí passei o domingo todinho lá no hospital, pra tomar uma injeção. Então isso aí, deixa eu entender, foi. Porque você bateu numa... Foi na papagana, entendeu? Mas alguém foi alucinado? Não, não. Foi você sozinho? Eu sozinho, entendeu? Mesmo assim, passando, tem esse aqui, né? Aí tem um posto aqui, outro aqui e outro bem aqui. Pra eu não tacar as costelas nesse meio pedra, aí eu aplumei só no ferro, nesse ferro que tem assim. Aí pra poder evitar mais, né? Pra eu tacar a cabeça e não morrer. Você gostaria de trocar a bicicleta por outro meio de transporte? É, mas só que eu não sei dirigir, entendeu? A minha profissão mais foi bicicleta, certo? Porque eu tenho medo, entendeu? Negócio de moto, né? Porque é um negócio que é riscado, entendeu? Aí aqui eu sou mais acostumado, entendeu? Existe alguma rua em Fortaleza que você gostaria de ver com essa sinalização aqui da ciclovia? É, aí sempre tem um bocado aí que ainda não foi, ainda fez isso aqui, né? Sempre tem que estar fazendo, porque é muito predesto andando, né? Entendeu? Aí sempre é bom a pessoa andar com isso aí, entendeu? Muito obrigada. De nada.","Pessoa A: Seu nome e idade?
Pessoa B: É... 51.
Pessoa A: E o seu nome?
Pessoa B: É... Gelsério. Fernando Henrique.
Pessoa A: Por que você escolheu andar de bicicleta e há quanto tempo você utiliza?
Pessoa B: Já... 20 anos já. Porque aqui é o seguinte, eu não tenho condição de comprar uma moto, né? Aí eu ando com ela, né? Entendeu?
Pessoa A: Qual é o principal problema que você enfrenta andando de bicicleta no Porto Alegre?
Pessoa B: Eu ando com fé em Deus, né? Porque a gente é todo dia aqui riscando o trânsito, né? Aí tem gente que não respeita a gente. Mesmo policial, passa por a gente. Mesmo lá na frente, lá, passou três. Passou três, assim, tem que derrubar, entendeu? E já me levei, já, nessa avenida mesmo, lá perto da BR, né? o Caí, aí outro ia atravessando na moto, bateu nessa linda bicicleta, certo? De pé, e eu na bicicleta. Aí eu falei, como é que pode você fazer um negócio desse? Você tá vendo que eu tô na minha mão e você atravessar... Aí é um morenão bem altão, né? Aí tem... não... É, você tá sentindo alguma coisa?
Pessoa A: Esse acidente foi há... faz um ano? Tem menos de um ano?
Pessoa B: É, tá com um ano, mais ou menos. Não, mas eu não cheguei a cair não, entendeu? Foi só o sul.
Pessoa A: E já é muita coisa.
Pessoa B: É, muita coisa. E sempre, a gente anda na avenida essa daqui, eu sei que fizeram isso aqui, né? Foi bom pra gente, mas eles não respeitam a gente, entendeu?
Pessoa A: O principal problema hoje é que o pessoal não respeita.
Pessoa B: É, não respeita, entendeu? Mesmo fazendo isso aqui, esses caras de moda, ainda toma a faixa da gente, né? Aí a gente sempre vem aqui com cuidado, porque eles não respeitam a gente. Mesmo ter feito isso aqui.
Pessoa A: Você tem medo de sofrer acidente?
Pessoa B: Tenho, sim, tenho. Mas é o objeto que a gente tem, né? Tem que andar com fé em Deus, né? Porque a gente vai e vem com fé em Deus. Só ele melhora a gente.
Pessoa A: No último ano, você sofreu algum acidente? No último ano de bicicleta?
Pessoa B: Foi esse ano meio, um dia domingo eu merendei, né? Aí quando eu fui saindo pra cortar meu cabelo na Messejana, tem o Cambeba, ali em Pouco Sol, ali naqueles condomínios de pessoal rico, aí tem assim. Aí quando eu vou passar aqui, aí tem um posto na Papagana, daqueles pessoal que vende apartamento, né? Aí eu bati a minha cabeça, numa tauba, que eles putaram, certo? Aí caí, não foi essa daqui não, foi a outra que eu tenho em casa, certo? Aí penou o aro, elevei uma chibatada aqui nas costelas, né? Aí passei o domingo todinho lá no hospital, pra tomar uma injeção.
Pessoa A: Então isso aí, deixa eu entender, foi.
Pessoa B: Porque você bateu numa... Foi na papagana, entendeu?
Pessoa A: Mas alguém foi alucinado?
Pessoa B: Não, não.
Pessoa A: Foi você sozinho?
Pessoa B: Eu sozinho, entendeu? Mesmo assim, passando, tem esse aqui, né? Aí tem um posto aqui, outro aqui e outro bem aqui. Pra eu não tacar as costelas nesse meio pedra, aí eu aplumei só no ferro, nesse ferro que tem assim. Aí pra poder evitar mais, né? Pra eu tacar a cabeça e não morrer.
Pessoa A: Você gostaria de trocar a bicicleta por outro meio de transporte?
Pessoa B: É, mas só que eu não sei dirigir, entendeu? A minha profissão mais foi bicicleta, certo? Porque eu tenho medo, entendeu? Negócio de moto, né? Porque é um negócio que é riscado, entendeu? Aí aqui eu sou mais acostumado, entendeu?
Pessoa A: Existe alguma rua em Fortaleza que você gostaria de ver com essa sinalização aqui da ciclovia?
Pessoa B: É, aí sempre tem um bocado aí que ainda não foi, ainda fez isso aqui, né? Sempre tem que estar fazendo, porque é muito predesto andando, né? Entendeu? Aí sempre é bom a pessoa andar com isso aí, entendeu?
Pessoa A: Muito obrigada.
Pessoa B: De nada.",00000057-AUDIO-2025-08-19-17-17-35,Gelsério. Fernando Henrique.,51,Masculino,"Porque aqui é o seguinte, eu não tenho condição de comprar uma moto, né? Aí eu ando com ela, né? Entendeu?",Já... 20 anos já.,"O principal problema hoje é que o pessoal não respeita. É, não respeita, entendeu? Mesmo fazendo isso aqui, esses caras de moda, ainda toma a faixa da gente, né? Aí a gente sempre vem aqui com cuidado, porque eles não respeitam a gente.","Você tem medo de sofrer acidente? Tenho, sim, tenho. Mas é o objeto que a gente tem, né? Tem que andar com fé em Deus, né? Porque a gente vai e vem com fé em Deus. Só ele melhora a gente.","No último ano, você sofreu algum acidente? No último ano de bicicleta? Foi esse ano meio, um dia domingo eu merendei, né? Aí quando eu fui saindo pra cortar meu cabelo na Messejana, tem o Cambeba, ali em Pouco Sol, ali naqueles condomínios de pessoal rico, aí tem assim. Aí quando eu vou passar aqui, aí tem um posto na Papagana, daqueles pessoal que vende apartamento, né? Aí eu bati a minha cabeça, numa tauba, que eles putaram, certo? Aí caí, não foi essa daqui não, foi a outra que eu tenho em casa, certo? Aí penou o aro, elevei uma chibatada aqui nas costelas, né? Aí passei o domingo todinho lá no hospital, pra tomar uma injeção.","Você gostaria de trocar a bicicleta por outro meio de transporte? É, mas só que eu não sei dirigir, entendeu? A minha profissão mais foi bicicleta, certo? Porque eu tenho medo, entendeu? Negócio de moto, né? Porque é um negócio que é riscado, entendeu? Aí aqui eu sou mais acostumado, entendeu?","Existe alguma rua em Fortaleza que você gostaria de ver com essa sinalização aqui da ciclovia? É, aí sempre tem um bocado aí que ainda não foi, ainda fez isso aqui, né? Sempre tem que estar fazendo, porque é muito predesto andando, né? Entendeu? Aí sempre é bom a pessoa andar com isso aí, entendeu?",Custo \ É mais barato; Única opção,Mais de 5 anos,Desrespeito dos motoristas; Invasão de carros ou motos na ciclovia,"Sim, tenho medo de acidentes",Sim,Não
"Qual o teu nome e a tua idade, por favor? Genil, 38 anos. Por que que você escolheu andar de bicicleta e faz quanto tempo? Estou aqui em Fortaleza há 4 anos e só uso esse tipo de bicicleta. O ônibus aqui é muito complicado, difícil. Qual o principal problema que tu enfrenta quando anda de bicicleta em Fortaleza? Alguns motoristas imprudentes aí que... é perigoso para os biciclistas. Você tem medo de sofrer acidente? Bastante. Já sofreu algum? Mês passado eu sofri um outro... Um rapaz passou de suor vermelho, eu tava descansando e ele bateu em mim. Por enquanto. A bicicleta já tá amassada, ele pegou da frente. Sinto muito. Você gostaria de trocar de bicicleta por outro meio de transporte? Por. Enquanto, não. Porque é o que... Seria o trajeto mais rápido do planeta. Porque o ônibus vai ter que pegar 2, 3 horas pra chegar o tempo da fase. Certo. Existe alguma rua em Fortaleza que tu gostaria que tivesse uma ciclovia que ainda não tem? Tem um aqui, agora eu não soube o nome da rua, tem um aqui que o trajeto é meio perigoso com o bus, a gente vai ter que correr pelo catacombo. Você lembra algum ponto de referência dela? Pode ser que a gente descubra. Só de aqui perto. Tá bom, muito obrigada, valeu, boa tarde.","Pessoa B: Qual o teu nome e a tua idade, por favor?
Pessoa A: Genil, 38 anos.
Pessoa B: Por que que você escolheu andar de bicicleta e faz quanto tempo?
Pessoa A: Estou aqui em Fortaleza há 4 anos e só uso esse tipo de bicicleta. O ônibus aqui é muito complicado, difícil.
Pessoa B: Qual o principal problema que tu enfrenta quando anda de bicicleta em Fortaleza?
Pessoa A: Alguns motoristas imprudentes aí que... é perigoso para os biciclistas.
Pessoa B: Você tem medo de sofrer acidente?
Pessoa A: Bastante.
Pessoa B: Já sofreu algum?
Pessoa A: Mês passado eu sofri um outro... Um rapaz passou de suor vermelho, eu tava descansando e ele bateu em mim.
Pessoa B: Por enquanto.
Pessoa A: A bicicleta já tá amassada, ele pegou da frente.
Pessoa B: Sinto muito. Você gostaria de trocar de bicicleta por outro meio de transporte? Por.
Pessoa A: Enquanto, não. Porque é o que... Seria o trajeto mais rápido do planeta. Porque o ônibus vai ter que pegar 2, 3 horas pra chegar o tempo da fase.
Pessoa B: Certo. Existe alguma rua em Fortaleza que tu gostaria que tivesse uma ciclovia que ainda não tem?
Pessoa A: Tem um aqui, agora eu não soube o nome da rua, tem um aqui que o trajeto é meio perigoso com o bus, a gente vai ter que correr pelo catacombo.
Pessoa B: Você lembra algum ponto de referência dela? Pode ser que a gente descubra.
Pessoa A: Só de aqui perto.
Pessoa B: Tá bom, muito obrigada, valeu, boa tarde.",00000058-AUDIO-2025-08-19-17-17-54,Genil,38,Masculino,"Estou aqui em Fortaleza há 4 anos e só uso esse tipo de bicicleta. O ônibus aqui é muito complicado, difícil.",Estou aqui em Fortaleza há 4 anos e só uso esse tipo de bicicleta.,Alguns motoristas imprudentes aí que... é perigoso para os biciclistas.,Você tem medo de sofrer acidente? Bastante.,"Mês passado eu sofri um outro... Um rapaz passou de suor vermelho, eu tava descansando e ele bateu em mim. Por enquanto. A bicicleta já tá amassada, ele pegou da frente.","Você gostaria de trocar de bicicleta por outro meio de transporte? Por. Enquanto, não. Porque é o que... Seria o trajeto mais rápido do planeta. Porque o ônibus vai ter que pegar 2, 3 horas pra chegar o tempo da fase.","Existe alguma rua em Fortaleza que tu gostaria que tivesse uma ciclovia que ainda não tem? Tem um aqui, agora eu não soube o nome da rua, tem um aqui que o trajeto é meio perigoso com o bus, a gente vai ter que correr pelo catacombo.",Praticidade e conveniência; Mais fácil; Única opção,Entre 3 e 5 anos,Desrespeito dos motoristas;Risco de acidentes,"Sim, tenho medo de acidentes",Sim,Não
"Qual o nome do senhor e a idade? Luiz Carlos Santos. Qual a sua idade? 64 anos e 76. Certo. Por que que você escolheu andar de bicicleta e quanto tempo faz? Faz mais de 20 anos. Certo. Qual o principal problema que você enfrenta quando anda de bicicleta? Carro e moto. Carro e moto. Você tem medo de sofrer acidente? Tenho. Já sofreu algum? Sofri na sorte. Pois eu vou, graças a Deus. Você gostaria de trocar a bicicleta por outro meio de transporte? Tudo bem. Certo. Existe alguma rua em Fortaleza que você gostaria que tivesse uma ciclovía assim, uma ciclofaixa? Que ainda não tem? Ainda não tem, não. Tem alguma via que o senhor lembra? Alguma rua? Não, não, não. Muito obrigada.","Pessoa A: Qual o nome do senhor e a idade?
Pessoa B: Luiz Carlos Santos.
Pessoa A: Qual a sua idade?
Pessoa B: 64 anos e 76.
Pessoa A: Certo. Por que que você escolheu andar de bicicleta e quanto tempo faz?
Pessoa B: Faz mais de 20 anos.
Pessoa A: Certo. Qual o principal problema que você enfrenta quando anda de bicicleta?
Pessoa B: Carro e moto.
Pessoa A: Carro e moto. Você tem medo de sofrer acidente?
Pessoa B: Tenho.
Pessoa A: Já sofreu algum?
Pessoa B: Sofri na sorte.
Pessoa A: Pois eu vou, graças a Deus. Você gostaria de trocar a bicicleta por outro meio de transporte?
Pessoa B: Tudo bem.
Pessoa A: Certo. Existe alguma rua em Fortaleza que você gostaria que tivesse uma ciclovía assim, uma ciclofaixa? Que ainda não tem?
Pessoa B: Ainda não tem, não.
Pessoa A: Tem alguma via que o senhor lembra? Alguma rua?
Pessoa B: Não, não, não.
Pessoa A: Muito obrigada.",00000059-AUDIO-2025-08-19-17-19-17,Luiz Carlos Santos,64,Masculino,Faz mais de 20 anos.,Faz mais de 20 anos.,Qual o principal problema que você enfrenta quando anda de bicicleta? Carro e moto.,Você tem medo de sofrer acidente? Tenho.,"Já sofreu algum? Sofri na sorte. Pois eu vou, graças a Deus.",Você gostaria de trocar a bicicleta por outro meio de transporte? Tudo bem.,"Existe alguma rua em Fortaleza que você gostaria que tivesse uma ciclovía assim, uma ciclofaixa? Que ainda não tem? Ainda não tem, não. Tem alguma via que o senhor lembra? Alguma rua? Não, não, não.",,Mais de 5 anos,Invasão de carros ou motos na ciclovia;Desrespeito dos motoristas,"Sim, tenho medo de acidentes",Sim,
