text,conversation,file,Nome,idade,genero,por_que_escolheu_andar_de_bicicleta?,ha_quanto_tempo_utiliza?,qual_e_o_principal_problema_que_voce_enfrenta_ao_andar_de_bicicleta_em_fortaleza,tem_medo_de_sofrer_acidentes_andando_de_bicicleta_em_Fortaleza?,sofreu_algum_acidente_no_último_ano?,gostaria_de_trocar_a_bicicleta_por_outro_meio_de_transporte,existe_alguma_rua_em_fortaleza_em_que_gostaria_de_ver_uma_ciclovia,por_que_escolheu_ou_escolhe_andar_de_bicicleta_agrupado,ha_quanto_tempo_utiliza_agrupado,qual_e_o_principal_problema_que_voce_enfrenta_ao_andar_de_bicicleta_em_fortaleza_agrupado,tem_medo_de_sofrer_acidentes_andando_de_bicicleta_em_Fortaleza_agrupado,sofreu_algum_acidente_no_último_ano_agrupado,gostaria_de_trocar_a_bicicleta_por_outro_meio_de_transporte_agrupado
"Qual o seu nome e a sua idade? Augusto, 35. O que você escolheu andar de bicicleta e há quanto tempo? Eu estava sedentário há 5 anos. Qual o principal problema que você enfrenta? O desrespeito. Tem medo de sofrer acidente? Tenho. Já sofreu algum? Dois. Quer contar como foi? Eu estava parado na ciclofage e o motorista entrou e bateu-me. E o outro foi o motoqueiro que me deu um gol, do mesmo jeito, na segunda faixa. Sinto muito. Você gostaria de trocar a bicicleta por outro meio de transporte? Existe alguma rua em Fortaleza que você gostaria que tivesse uma segunda faixa que ainda não tem? Na Perimetral. Tá certo. Muito obrigada. Boa tarde.","Pessoa A: Qual o seu nome e a sua idade? Augusto, 35. O que você escolheu andar de bicicleta e há quanto tempo?
Pessoa B: Eu estava sedentário há 5 anos.
Pessoa A: Qual o principal problema que você enfrenta?
Pessoa B: O desrespeito.
Pessoa A: Tem medo de sofrer acidente?
Pessoa B: Tenho.
Pessoa A: Já sofreu algum?
Pessoa B: Dois.
Pessoa A: Quer contar como foi?
Pessoa B: Eu estava parado na ciclofage e o motorista entrou e bateu-me. E o outro foi o motoqueiro que me deu um gol, do mesmo jeito, na segunda faixa.
Pessoa A: Sinto muito. Você gostaria de trocar a bicicleta por outro meio de transporte? Existe alguma rua em Fortaleza que você gostaria que tivesse uma segunda faixa que ainda não tem?
Pessoa B: Na Perimetral.
Pessoa A: Tá certo. Muito obrigada. Boa tarde.",00000035-AUDIO-2025-08-19-16-49-58,Augusto,35,Masculino,Eu estava sedentário há 5 anos.,Eu estava sedentário há 5 anos.,O desrespeito.,Tem medo de sofrer acidente? Tenho.,"Já sofreu algum? Dois. Quer contar como foi? Eu estava parado na ciclofage e o motorista entrou e bateu-me. E o outro foi o motoqueiro que me deu um gol, do mesmo jeito, na segunda faixa.",Você gostaria de trocar a bicicleta por outro meio de transporte?,Existe alguma rua em Fortaleza que você gostaria que tivesse uma segunda faixa que ainda não tem? Na Perimetral.,Exercício e saúde,Mais de 5 anos,Desrespeito dos motoristas,"Sim, tenho medo de acidentes",Sim,
"Posso fazer umas perguntas pra você, só que em áudio? Seu nome e idade, por favor? William da Silva, 36 anos. Por que você escolheu mandar de bicicleta e há quanto tempo utiliza? O transporte mais fácil e mais econômico, né? Faz tempo, quando ela tá com 30 anos, eu acho. Qual o principal problema que você enfrenta com a mandar de bicicleta? O. Trânsito, às vezes. Às vezes... O transporte do carro e moto me respeitam, né? A faixa também. Tem medo de atar? De sofrer acidente? Depende do horário, né? Mas medo. Não. Sofreu algum acidente no último ano? Não, não. Não. Gostaria de trocar a bicicleta por outro meio de transporte? Aí depende das condições, né? Vamos trocar. Existe alguma rua em Fortaleza que você gostaria de ver uma ciclovia? A maioria, né? Porque tem uns que tem e outros não. A maioria. Eu não posso te dizer se é um arroz específico, porque a maioria não tem. Obrigada, tá?","Pessoa A: Posso fazer umas perguntas pra você, só que em áudio? Seu nome e idade, por favor?
Pessoa B: William da Silva, 36 anos.
Pessoa A: Por que você escolheu mandar de bicicleta e há quanto tempo utiliza?
Pessoa B: O transporte mais fácil e mais econômico, né? Faz tempo, quando ela tá com 30 anos, eu acho.
Pessoa A: Qual o principal problema que você enfrenta com a mandar de bicicleta? O.
Pessoa B: Trânsito, às vezes. Às vezes... O transporte do carro e moto me respeitam, né? A faixa também.
Pessoa A: Tem medo de atar? De sofrer acidente?
Pessoa B: Depende do horário, né? Mas medo.
Pessoa A: Não. Sofreu algum acidente no último ano?
Pessoa B: Não, não.
Pessoa A: Não. Gostaria de trocar a bicicleta por outro meio de transporte?
Pessoa B: Aí depende das condições, né? Vamos trocar.
Pessoa A: Existe alguma rua em Fortaleza que você gostaria de ver uma ciclovia?
Pessoa B: A maioria, né? Porque tem uns que tem e outros não. A maioria. Eu não posso te dizer se é um arroz específico, porque a maioria não tem.
Pessoa A: Obrigada, tá?",00000036-AUDIO-2025-08-19-16-52-15,William da Silva,36,Masculino,"O transporte mais fácil e mais econômico, né?","Faz tempo, quando ela tá com 30 anos, eu acho.","O. Trânsito, às vezes. Às vezes... O transporte do carro e moto me respeitam, né? A faixa também.","Tem medo de atar? De sofrer acidente? Depende do horário, né? Mas medo. Não.","Sofreu algum acidente no último ano? Não, não. Não.","Gostaria de trocar a bicicleta por outro meio de transporte? Aí depende das condições, né? Vamos trocar.","Existe alguma rua em Fortaleza que você gostaria de ver uma ciclovia? A maioria, né? Porque tem uns que tem e outros não. A maioria. Eu não posso te dizer se é um arroz específico, porque a maioria não tem.",Mais fácil; Custo \ É mais barato,Mais de 5 anos,Desrespeito dos motoristas; Invasão de carros ou motos na ciclovia,Não,Não,Não
"Qual o seu nome e a sua idade, por favor? Antônio Wills, 50 anos. Por que o senhor escolheu andar de bicicleta e há quanto. Tempo? Para melhorar a saúde da gente e a mobilidade, que é mais rápida do que o trânsito que está hoje em Fortaleza. Qual o principal problema. Que você enfrenta? A falta de. Respeito dos. Poucos motoristas, carro e moto, não respeita o ciclista. Você tem medo de sofrer acidente? Tenho, tenho medo sim. Já sofreu algum? Não. Graças a Deus. É, mas é assim, porque também a gente respeita também o espaço da gente também, né? Com cuidado, a gente tem que ter muito cuidado também. Não se, como se diz, se enfrenta tanto os carros, porque são bem mais numerosos e mais pesados do que a gente, né? Tá certo. Você gostaria de trocar bicicleta por outro meio de transporte? No momento, não. No meu trabalho, não. E até porque eu também pedalo, né? Eu faço cic... Eu faço... A gente faz ciclismo, né? De noite, a gente sai, tem um. Grupo, a gente... Eu faço trilha também, e aí... Tá certo. Tem algum rum em Fortaleza que você gostaria que tivesse uma segunda faixa, que ainda não tem, ou que tá muito. Ruim, que precisa melhorar? Seria essa daqui. Ó, da continuidade dela aqui, da Silo Rumbum, né? Ela é uma via muito apertada pra carro e. Ciclista, né? Realmente ela precisa melhorar muito. Muito obrigada.","Pessoa A: Qual o seu nome e a sua idade, por favor? Antônio Wills, 50 anos. Por que o senhor escolheu andar de bicicleta e há quanto.
Pessoa B: Tempo?
Pessoa A: Para melhorar a saúde da gente e a mobilidade, que é mais rápida do que o trânsito que está hoje em Fortaleza. Qual o principal problema.
Pessoa B: Que você enfrenta?
Pessoa A: A falta de.
Pessoa B: Respeito dos.
Pessoa A: Poucos motoristas, carro e moto, não respeita o ciclista. Você tem medo de sofrer acidente? Tenho, tenho medo sim. Já sofreu algum? Não. Graças a Deus. É, mas é assim, porque também a gente respeita também o espaço da gente também, né? Com cuidado, a gente tem que ter muito cuidado também. Não se, como se diz, se enfrenta tanto os carros, porque são bem mais numerosos e mais pesados do que a gente, né? Tá certo. Você gostaria de trocar bicicleta por outro meio de transporte? No momento, não. No meu trabalho, não. E até porque eu também pedalo, né? Eu faço cic... Eu faço... A gente faz ciclismo, né? De noite, a gente sai, tem um.
Pessoa B: Grupo, a gente...
Pessoa A: Eu faço trilha também, e aí... Tá certo. Tem algum rum em Fortaleza que você gostaria que tivesse uma segunda faixa, que ainda não tem, ou que tá muito.
Pessoa B: Ruim, que precisa melhorar?
Pessoa A: Seria essa daqui.
Pessoa B: Ó, da continuidade dela aqui, da Silo Rumbum, né?
Pessoa A: Ela é uma via muito apertada pra carro e.
Pessoa B: Ciclista, né?
Pessoa A: Realmente ela precisa melhorar muito. Muito obrigada.",00000037-AUDIO-2025-08-19-16-54-10,Antônio Wills,50,Masculino,"Para melhorar a saúde da gente e a mobilidade, que é mais rápida do que o trânsito que está hoje em Fortaleza.","O tempo em que a pessoa anda de bicicleta não é especificado na conversa. A resposta à pergunta ""há quanto tempo?"" foca no motivo (""Para melhorar a saúde da gente e a mobilidade"").","A falta de. Respeito dos. Poucos motoristas, carro e moto, não respeita o ciclista.","Você tem medo de sofrer acidente? Tenho, tenho medo sim. Já sofreu algum? Não. Graças a Deus.",Já sofreu algum? Não. Graças a Deus.,"Você gostaria de trocar bicicleta por outro meio de transporte? No momento, não. No meu trabalho, não. E até porque eu também pedalo, né? Eu faço cic... Eu faço... A gente faz ciclismo, né? De noite, a gente sai, tem um. Grupo, a gente... Eu faço trilha também, e aí... Tá certo.","Tem algum rum em Fortaleza que você gostaria que tivesse uma segunda faixa, que ainda não tem, ou que tá muito. Ruim, que precisa melhorar? Seria essa daqui. Ó, da continuidade dela aqui, da Silo Rumbum, né? Ela é uma via muito apertada pra carro e. Ciclista, né? Realmente ela precisa melhorar muito.",Exercício e saúde; Rapidez \ Tempo,,Desrespeito dos motoristas,"Sim, tenho medo de acidentes",Não,Não
"Boa tarde, posso fazer umas perguntas pra você aqui em áudio? Seu nome e idade, por favor? Rodrigo, 36. Rodrigo. De Souza, 36. Por que, Rodrigo, você escolheu andar de bicicleta? E há quanto tempo? É porque é horrível andar de ônibus, viu? Aí eu prefiro andar de bicicleta. Faz quanto tempo? O quê? Eu tenho 8 anos, essa bicicleta. Tem mais de 11 ou 8 anos, mais ou menos. Eu acho que é mais, viu? Qual. É o principal problema que você enfrenta andando de bicicleta? É. Os carros, às vezes, não respeitam, viu? As motos. Mas, enquanto isso, não tá filé. Tem medo de sofrer um acidente? Muito. Já. Sofreu algum acidente? Não. Gostaria de trocar a bicicleta por outro meio de transporte. Se eu tivesse condições de uma moto, não era? Existe alguma rua em Fortaleza que você gostaria que a gente dê uma ciclovia? Não, não. Já passou lá, onde eu queria. Tá certo. Não tem nada? Nada.","Pessoa A: Boa tarde, posso fazer umas perguntas pra você aqui em áudio? Seu nome e idade, por favor?
Pessoa B: Rodrigo, 36.
Pessoa A: Rodrigo.
Pessoa B: De Souza, 36.
Pessoa A: Por que, Rodrigo, você escolheu andar de bicicleta? E há quanto tempo?
Pessoa B: É porque é horrível andar de ônibus, viu? Aí eu prefiro andar de bicicleta.
Pessoa A: Faz quanto tempo?
Pessoa B: O quê? Eu tenho 8 anos, essa bicicleta.
Pessoa A: Tem mais de 11 ou 8 anos, mais ou menos.
Pessoa B: Eu acho que é mais, viu? Qual.
Pessoa A: É o principal problema que você enfrenta andando de bicicleta? É.
Pessoa B: Os carros, às vezes, não respeitam, viu? As motos. Mas, enquanto isso, não tá filé.
Pessoa A: Tem medo de sofrer um acidente?
Pessoa B: Muito. Já.
Pessoa A: Sofreu algum acidente?
Pessoa B: Não.
Pessoa A: Gostaria de trocar a bicicleta por outro meio de transporte.
Pessoa B: Se eu tivesse condições de uma moto, não era?
Pessoa A: Existe alguma rua em Fortaleza que você gostaria que a gente dê uma ciclovia?
Pessoa B: Não, não. Já passou lá, onde eu queria.
Pessoa A: Tá certo. Não tem nada?
Pessoa B: Nada.",00000038-AUDIO-2025-08-19-16-54-11,Rodrigo de Souza,36,Masculino,"É porque é horrível andar de ônibus, viu? Aí eu prefiro andar de bicicleta.","Faz quanto tempo? O quê? Eu tenho 8 anos, essa bicicleta. Tem mais de 11 ou 8 anos, mais ou menos. Eu acho que é mais, viu?","Os carros, às vezes, não respeitam, viu? As motos.",Tem medo de sofrer um acidente? Muito.,Já. Sofreu algum acidente? Não.,"Gostaria de trocar a bicicleta por outro meio de transporte. Se eu tivesse condições de uma moto, não era?","Existe alguma rua em Fortaleza que você gostaria que a gente dê uma ciclovia? Não, não. Já passou lá, onde eu queria.",Preferência pessoal,Mais de 5 anos,Desrespeito dos motoristas;Invasão de carros ou motos na ciclovia,"Sim, tenho medo de acidentes",Não,"Sim, por uma moto"
"Qual o seu nome e sua idade, por favor? Pabllo Silva Rocha, 34 anos. Por que que você escolheu andar de bicicleta e há quanto tempo? Desde 16. Anos de idade. Qual é o principal problema que você enfrenta com o ando de bicicleta? O trânsito. Você tem medo de sofrer acidente? Não. Sério? Eu não. Já soprou algum? Não. Certo. Você gostaria de trocar a bicicleta por outro meio de transporte? Não. Pronto. Existe alguma rua em Fortaleza que você gostaria que tivesse uma ciclovia e que ainda não tem? Onde eu ando, todos têm. Uma coisa boa. Está bom. Muito obrigado.","Pessoa A: Qual o seu nome e sua idade, por favor? Pabllo Silva Rocha, 34 anos. Por que que você escolheu andar de bicicleta e há quanto tempo? Desde 16.
Pessoa B: Anos de idade.
Pessoa A: Qual é o principal problema que você enfrenta com o ando de bicicleta?
Pessoa B: O trânsito.
Pessoa A: Você tem medo de sofrer acidente?
Pessoa B: Não.
Pessoa A: Sério? Eu não. Já soprou algum?
Pessoa B: Não.
Pessoa A: Certo. Você gostaria de trocar a bicicleta por outro meio de transporte?
Pessoa B: Não.
Pessoa A: Pronto. Existe alguma rua em Fortaleza que você gostaria que tivesse uma ciclovia e que ainda não tem? Onde eu ando, todos têm. Uma coisa boa. Está bom. Muito obrigado.",00000039-AUDIO-2025-08-19-16-55-21,Pabllo Silva Rocha,34,Masculino,Desde 16. Anos de idade.,Desde 16. Anos de idade.,Qual é o principal problema que você enfrenta com o ando de bicicleta? O trânsito.,Você tem medo de sofrer acidente? Não. Sério? Eu não. Já soprou algum? Não.,Você tem medo de sofrer acidente? Não. Sério? Eu não. Já soprou algum? Não.,Você gostaria de trocar a bicicleta por outro meio de transporte? Não. Pronto.,"Existe alguma rua em Fortaleza que você gostaria que tivesse uma ciclovia e que ainda não tem? Onde eu ando, todos têm. Uma coisa boa.",,Mais de 5 anos,Risco de acidentes,Não,Não,Não
"Qual o seu nome e a sua idade, por favor? Olavo, 62. Por que que você escolheu andar de bicicleta e há quanto tempo? Porque eu gosto. Faz tempo? Faz. Qual o principal problema que você enfrenta quando anda de bicicleta em Fortaleza? A fase normal é. Quando as motos avançam o sinal. Eu sempre espero alguns segundos que eu sei que vai sempre alguém avançar o sinal. Você tem medo de sofrer acidente? Todo mundo tem, é. Já sofreu algum? Graças a Deus, não. Vamos!","Pessoa A: Qual o seu nome e a sua idade, por favor?
Pessoa B: Olavo, 62.
Pessoa A: Por que que você escolheu andar de bicicleta e há quanto tempo?
Pessoa B: Porque eu gosto.
Pessoa A: Faz tempo?
Pessoa B: Faz.
Pessoa A: Qual o principal problema que você enfrenta quando anda de bicicleta em Fortaleza? A fase normal é.
Pessoa B: Quando as motos avançam o sinal. Eu sempre espero alguns segundos que eu sei que vai sempre alguém avançar o sinal.
Pessoa A: Você tem medo de sofrer acidente?
Pessoa B: Todo mundo tem, é.
Pessoa A: Já sofreu algum?
Pessoa B: Graças a Deus, não. Vamos!",00000040-AUDIO-2025-08-19-16-57-51,Olavo,62,Masculino,Porque eu gosto.,Faz tempo? Faz.,Quando as motos avançam o sinal. Eu sempre espero alguns segundos que eu sei que vai sempre alguém avançar o sinal.,"Você tem medo de sofrer acidente? Todo mundo tem, é.","Já sofreu algum? Graças a Deus, não.",A informação não está presente no texto.,O texto não menciona se a pessoa gostaria de ter ciclovia em alguma rua de Fortaleza.,Preferência pessoal,,Desrespeito dos motoristas;Risco de acidentes,"Sim, tenho medo de acidentes",Não,Não
"O senhor aceita responder umas perguntas? Aceito sim, é fácil? É, são fáceis. Seu nome e idade? Meu nome é Nelson Firmino Coelho. A idade eu sou de 1976. A matemática eu não sou boa não. Não sou boa não. 50 anos, né? Não, eu faço 50 anos, né? Eu tenho 49. Eu vou fazer 50 anos agora e mais. No próximo ano. Tenho 49 anos. Isso. Porque você escolheu andar de bicicleta e há quanto tempo você utiliza? Faz muito tempo eu gosto de andar de bicicleta, faz muito tempo que eu ando de bicicleta. Aí quando eu trabalho é mais perto, porque eu trabalho e faço estrutura. Eu sou montador, aí quando é mais perto eu vou de bike, porque mais longe é mais perigoso. Faz muito tempo, tipo uns 5 anos, 10? Hã? Quanto tempo, uns 5 anos, 10? Ah, faz muitos anos, desde que eu sou criança que eu gosto de andar de bicicleta. Qual o principal problema que você enfrenta ao andar de bicicleta em Fortaleza? O pior problema é os carros, né? Depois que fez a ciclovia ficou melhor pra nós, né? Porque antigamente, quando não tinha, era muito perigoso andar de bicicleta. Agora andar de bicicleta de manhã é perigoso só mais de um vagabundo, né? Segurança, né? É, segurança, né? Você tem medo de sofrer algum acidente andando de bicicleta? Tem, né? Todo mundo tem, né? Mas a gente anda tranquilo e anda com segurança, né? A gente tem que ter cuidado, né? Há muita atenção, né? Que a gente tem que ter atenção na gente e nos outros, né? Já sofreu alguma situação? Não, graças a Deus não. Nunca. Você gostaria de trocar a bicicleta por outro meio de transporte? Não, por enquanto não. Eu tenho a minha bicicletazinha mesmo aqui. Existe alguma rua em Fortaleza que você gostaria de ver uma ciclovia dessas? Eu gostaria de ver as que não tem, né? Porque ainda tem muitas que não tem, né? E facilita muito pra gente, né? Porque antigamente a gente não podia andar de jeito nenhum, né? Porque os carros faltavam pra pegar a gente, né? E agora eles respeitam, né? Logo no começo os motoqueiros não respeitavam não, né? Os motoqueiros sempre entraram nesse convívio, né? Mas agora eu acho que é por causa de multa que eles estão levando, né? Muito obrigada, tá? De nada.","Pessoa A: O senhor aceita responder umas perguntas?
Pessoa B: Aceito sim, é fácil?
Pessoa A: É, são fáceis. Seu nome e idade?
Pessoa B: Meu nome é Nelson Firmino Coelho. A idade eu sou de 1976.
Pessoa A: A matemática eu não sou boa não.
Pessoa B: Não sou boa não. 50 anos, né? Não, eu faço 50 anos, né? Eu tenho 49. Eu vou fazer 50 anos agora e mais. No próximo ano. Tenho 49 anos. Isso.
Pessoa A: Porque você escolheu andar de bicicleta e há quanto tempo você utiliza?
Pessoa B: Faz muito tempo eu gosto de andar de bicicleta, faz muito tempo que eu ando de bicicleta. Aí quando eu trabalho é mais perto, porque eu trabalho e faço estrutura. Eu sou montador, aí quando é mais perto eu vou de bike, porque mais longe é mais perigoso.
Pessoa A: Faz muito tempo, tipo uns 5 anos, 10?
Pessoa B: Hã?
Pessoa A: Quanto tempo, uns 5 anos, 10?
Pessoa B: Ah, faz muitos anos, desde que eu sou criança que eu gosto de andar de bicicleta.
Pessoa A: Qual o principal problema que você enfrenta ao andar de bicicleta em Fortaleza?
Pessoa B: O pior problema é os carros, né? Depois que fez a ciclovia ficou melhor pra nós, né? Porque antigamente, quando não tinha, era muito perigoso andar de bicicleta. Agora andar de bicicleta de manhã é perigoso só mais de um vagabundo, né? Segurança, né? É, segurança, né?
Pessoa A: Você tem medo de sofrer algum acidente andando de bicicleta?
Pessoa B: Tem, né? Todo mundo tem, né? Mas a gente anda tranquilo e anda com segurança, né? A gente tem que ter cuidado, né? Há muita atenção, né? Que a gente tem que ter atenção na gente e nos outros, né?
Pessoa A: Já sofreu alguma situação?
Pessoa B: Não, graças a Deus não. Nunca.
Pessoa A: Você gostaria de trocar a bicicleta por outro meio de transporte?
Pessoa B: Não, por enquanto não. Eu tenho a minha bicicletazinha mesmo aqui.
Pessoa A: Existe alguma rua em Fortaleza que você gostaria de ver uma ciclovia dessas?
Pessoa B: Eu gostaria de ver as que não tem, né? Porque ainda tem muitas que não tem, né? E facilita muito pra gente, né? Porque antigamente a gente não podia andar de jeito nenhum, né? Porque os carros faltavam pra pegar a gente, né? E agora eles respeitam, né? Logo no começo os motoqueiros não respeitavam não, né? Os motoqueiros sempre entraram nesse convívio, né? Mas agora eu acho que é por causa de multa que eles estão levando, né? Muito obrigada, tá? De nada.",00000041-AUDIO-2025-08-19-16-59-26,Nelson Firmino Coelho,49,Masculino,"Faz muito tempo eu gosto de andar de bicicleta, faz muito tempo que eu ando de bicicleta. Aí quando eu trabalho é mais perto, porque eu trabalho e faço estrutura. Eu sou montador, aí quando é mais perto eu vou de bike, porque mais longe é mais perigoso. Faz muito tempo, tipo uns 5 anos, 10? Hã? Quanto tempo, uns 5 anos, 10? Ah, faz muitos anos, desde que eu sou criança que eu gosto de andar de bicicleta.","""Faz muito tempo eu gosto de andar de bicicleta, faz muito tempo que eu ando de bicicleta. ... Faz muito tempo, tipo uns 5 anos, 10? Hã? Quanto tempo, uns 5 anos, 10? Ah, faz muitos anos, desde que eu sou criança que eu gosto de andar de bicicleta.""","O pior problema é os carros, né? Depois que fez a ciclovia ficou melhor pra nós, né? Porque antigamente, quando não tinha, era muito perigoso andar de bicicleta. Agora andar de bicicleta de manhã é perigoso só mais de um vagabundo, né? Segurança, né? É, segurança, né?","Você tem medo de sofrer algum acidente andando de bicicleta? Tem, né? Todo mundo tem, né? Mas a gente anda tranquilo e anda com segurança, né? A gente tem que ter cuidado, né? Há muita atenção, né? Que a gente tem que ter atenção na gente e nos outros, né? Já sofreu alguma situação? Não, graças a Deus não. Nunca.","Já sofreu alguma situação? Não, graças a Deus não. Nunca.","Não, por enquanto não. Eu tenho a minha bicicletazinha mesmo aqui.","Eu gostaria de ver as que não tem, né? Porque ainda tem muitas que não tem, né? E facilita muito pra gente, né? Porque antigamente a gente não podia andar de jeito nenhum, né? Porque os carros faltavam pra pegar a gente, né? E agora eles respeitam, né? Logo no começo os motoqueiros não respeitavam não, né? Os motoqueiros sempre entraram nesse convívio, né? Mas agora eu acho que é por causa de multa que eles estão levando, né?",Preferência pessoal; Rapidez \ Tempo; Segurança no trânsito,,Desrespeito dos motoristas;Falta de ciclovias;Medo de assaltos,"Sim, tenho medo de acidentes",Não,Não
