text,conversation,file,Nome,idade,genero,por_que_escolheu_andar_de_bicicleta?,ha_quanto_tempo_utiliza?,qual_e_o_principal_problema_que_voce_enfrenta_ao_andar_de_bicicleta_em_fortaleza,tem_medo_de_sofrer_acidentes_andando_de_bicicleta_em_Fortaleza?,sofreu_algum_acidente_no_último_ano?,gostaria_de_trocar_a_bicicleta_por_outro_meio_de_transporte,existe_alguma_rua_em_fortaleza_em_que_gostaria_de_ver_uma_ciclovia,por_que_escolheu_ou_escolhe_andar_de_bicicleta_agrupado,ha_quanto_tempo_utiliza_agrupado,qual_e_o_principal_problema_que_voce_enfrenta_ao_andar_de_bicicleta_em_fortaleza_agrupado,tem_medo_de_sofrer_acidentes_andando_de_bicicleta_em_Fortaleza_agrupado,sofreu_algum_acidente_no_último_ano_agrupado,gostaria_de_trocar_a_bicicleta_por_outro_meio_de_transporte_agrupado
"Boa tarde, eu posso te fazer umas perguntas aqui? Seu nome e idade, por favor. Ednardo Andrade Barbosa. 32 anos. Por que você escolheu andar de bicicleta e há quanto tempo utiliza? Já tem cinco. Anos que eu ando. De bicicleta. Cinco anos, por quê? Porque as condições que tem. Qual o principal problema que você enfrenta ao andar de bicicleta. Em Fortaleza? É o pouco. De espaço. Tem medo de sofrer acidente andando de bicicleta? Tem. Já sofreu algum acidente? Não, graças a. Deus, nenhum. Gostaria de trocar a bicicleta por outro meio de transporte? Tenho, sim. Deu se quiser. Existe alguma rua em Fortaleza que você gostaria de ver uma ciclovia? Hã? Existe alguma rua em Fortaleza que você. Gostaria de ver uma ciclovia dessas? É... Ali no. Freixo e Lírio. Freixo e Lírio? Ali não tem. Obrigada viu!","Pessoa A: Boa tarde, eu posso te fazer umas perguntas aqui? Seu nome e idade, por favor. Ednardo Andrade Barbosa.
Pessoa C: 32 anos.
Pessoa A: Por que você escolheu andar de bicicleta e há quanto tempo utiliza?
Pessoa C: Já tem cinco.
Pessoa A: Anos que eu ando.
Pessoa C: De bicicleta.
Pessoa A: Cinco anos, por quê? Porque as condições que tem. Qual o principal problema que você enfrenta ao andar de bicicleta.
Pessoa B: Em Fortaleza?
Pessoa C: É o pouco.
Pessoa A: De espaço. Tem medo de sofrer acidente andando de bicicleta?
Pessoa C: Tem.
Pessoa A: Já sofreu algum acidente?
Pessoa C: Não, graças a.
Pessoa A: Deus, nenhum. Gostaria de trocar a bicicleta por outro meio de transporte? Tenho, sim. Deu se quiser. Existe alguma rua em Fortaleza que você gostaria de ver uma ciclovia?
Pessoa C: Hã?
Pessoa A: Existe alguma rua em Fortaleza que você.
Pessoa B: Gostaria de ver uma ciclovia dessas?
Pessoa A: É... Ali no.
Pessoa C: Freixo e Lírio.
Pessoa B: Freixo e Lírio?
Pessoa A: Ali não tem. Obrigada viu!",00000019-AUDIO-2025-08-19-16-33-22,Ednardo Andrade Barbosa,32,Masculino,Porque as condições que tem.,Já tem cinco. Anos que eu ando. De bicicleta. Cinco anos.,É o pouco. De espaço.,Tem medo de sofrer acidente andando de bicicleta? Tem.,"Já sofreu algum acidente? Não, graças a. Deus, nenhum.","Gostaria de trocar a bicicleta por outro meio de transporte? Tenho, sim. Deu se quiser.",Existe alguma rua em Fortaleza que você gostaria de ver uma ciclovia? Hã? Existe alguma rua em Fortaleza que você. Gostaria de ver uma ciclovia dessas? É... Ali no. Freixo e Lírio. Freixo e Lírio? Ali não tem.,Única opção,,Falta de ciclovias,"Sim, tenho medo de acidentes",Não,"Sim, mas não especifica qual meio"
"Seu nome e idade? Aila Maria da Silva Oliveira. 62 anos. Maravilha. Por que você escolheu andar de bicicleta e quanto tempo você utiliza? Tem mais de 10 anos. E a bicicleta pra mim é muito rápida. Vou no Mercantil, vou no São Cristóvão, vou na Boa Vista. Vou em vários lugares. Legal. E qual é o teu principal problema que tu enfrenta pra andar de bicicleta aqui em Contalete? É os carros que não respeitam a. Gente, nem as motos. Até naquela faixa que foi feito pra gente andar de bicicleta, aí aquela faixa nem os motoqueiros querem respeitar. E você tem medo de sofrer acidente pedalando? Muito. Já sofreu algum acidente? Não. Que bom. Graças a Deus. Você gostaria de trocar a bicicleta por outro meio de transporte? Gostaria, eu gostaria, mas não tenho condições. Entendi. Se pudesse, trocaria? Trocaria. Existe alguma rua aqui em Fortaleza que não tem ciclofaixa e que você gostaria que tivesse? Tem. Quando chega ali, na entrada de São Cristóvão, pra lá, junto com Palmeiras, ali merecia uma faixa, porque existe uma feira lá. Aí a gente inclui muita bicicleta pra ir fazer... Comprar na feira, né? Dia de sábado. Tá bom, obrigada, viu? Nada!","Pessoa B: Seu nome e idade?
Pessoa A: Aila Maria da Silva Oliveira. 62 anos.
Pessoa B: Maravilha. Por que você escolheu andar de bicicleta e quanto tempo você utiliza?
Pessoa A: Tem mais de 10 anos. E a bicicleta pra mim é muito rápida. Vou no Mercantil, vou no São Cristóvão, vou na Boa Vista. Vou em vários lugares.
Pessoa B: Legal. E qual é o teu principal problema que tu enfrenta pra andar de bicicleta aqui em Contalete? É os carros que não respeitam a.
Pessoa A: Gente, nem as motos. Até naquela faixa que foi feito pra gente andar de bicicleta, aí aquela faixa nem os motoqueiros querem respeitar.
Pessoa B: E você tem medo de sofrer acidente pedalando? Muito. Já sofreu algum acidente? Não. Que bom.
Pessoa A: Graças a Deus.
Pessoa B: Você gostaria de trocar a bicicleta por outro meio de transporte?
Pessoa A: Gostaria, eu gostaria, mas não tenho condições. Entendi.
Pessoa B: Se pudesse, trocaria?
Pessoa A: Trocaria.
Pessoa B: Existe alguma rua aqui em Fortaleza que não tem ciclofaixa e que você gostaria que tivesse? Tem.
Pessoa A: Quando chega ali, na entrada de São Cristóvão, pra lá, junto com Palmeiras, ali merecia uma faixa, porque existe uma feira lá. Aí a gente inclui muita bicicleta pra ir fazer... Comprar na feira, né? Dia de sábado.
Pessoa B: Tá bom, obrigada, viu?
Pessoa A: Nada!",00000020-AUDIO-2025-08-19-16-33-26,Aila Maria da Silva Oliveira,62,Feminino,"Tem mais de 10 anos. E a bicicleta pra mim é muito rápida. Vou no Mercantil, vou no São Cristóvão, vou na Boa Vista. Vou em vários lugares.",Tem mais de 10 anos.,"É os carros que não respeitam a. Gente, nem as motos. Até naquela faixa que foi feito pra gente andar de bicicleta, aí aquela faixa nem os motoqueiros querem respeitar.",E você tem medo de sofrer acidente pedalando? Muito. Já sofreu algum acidente? Não. Que bom. Graças a Deus.,Já sofreu algum acidente? Não. Que bom. Graças a Deus.,"Você gostaria de trocar a bicicleta por outro meio de transporte? Gostaria, eu gostaria, mas não tenho condições. Entendi. Se pudesse, trocaria? Trocaria.","Existe alguma rua aqui em Fortaleza que não tem ciclofaixa e que você gostaria que tivesse? Tem. Quando chega ali, na entrada de São Cristóvão, pra lá, junto com Palmeiras, ali merecia uma faixa, porque existe uma feira lá.",Rapidez \ Tempo; Praticidade e conveniência,Mais de 5 anos,Desrespeito dos motoristas; Invasão de carros ou motos na ciclovia,"Sim, tenho medo de acidentes",Não,"Sim, mas não especifica qual meio"
"Teu nome e tua idade? Meu nome é Francisco José Mendes Bezerra. 44 anos. Por que tu escolheu andar de bicicleta e há quanto tempo tu utiliza? Há dois anos, né? Porque o trabalho é melhor pra mim, porque Leto Lombre é muito lotado. E qual o principal problema que tu enfrenta pedalando na cidade? A falta de respeito dos carros e motos. E tu tem medo de sofrer algum acidente andando de bike? Sim, já fiz três. Já três? Quer falar um pouco sobre? Assim, teve algum assim que tu... Não, um carro bateu em mim, mas ele pegou, ele roubou o hospital, pagou a bicicleta, pagou meu óculos. E o que não foi mais, também? Faz tempo isso? Faz seis meses. Seis meses. Você. Gostaria. De trocar a bicicleta por um outro modo de transporte? Não, não, eu tô bem com a bicicleta. Existe alguma rua de Fortaleza que não tem sítulo ou faixa que tu gostaria que tivesse? Sim, gostaria. E qual? Aqui na Perimetral não tem. Perimetral. É verdade. Obrigada, viu?","Pessoa A: Teu nome e tua idade?
Pessoa B: Meu nome é Francisco José Mendes Bezerra. 44 anos.
Pessoa A: Por que tu escolheu andar de bicicleta e há quanto tempo tu utiliza?
Pessoa B: Há dois anos, né? Porque o trabalho é melhor pra mim, porque Leto Lombre é muito lotado.
Pessoa A: E qual o principal problema que tu enfrenta pedalando na cidade?
Pessoa B: A falta de respeito dos carros e motos.
Pessoa A: E tu tem medo de sofrer algum acidente andando de bike?
Pessoa B: Sim, já fiz três.
Pessoa A: Já três? Quer falar um pouco sobre? Assim, teve algum assim que tu...
Pessoa B: Não, um carro bateu em mim, mas ele pegou, ele roubou o hospital, pagou a bicicleta, pagou meu óculos.
Pessoa A: E o que não foi mais, também? Faz tempo isso?
Pessoa B: Faz seis meses. Seis meses.
Pessoa A: Você.
Pessoa B: Gostaria.
Pessoa A: De trocar a bicicleta por um outro modo de transporte?
Pessoa B: Não, não, eu tô bem com a bicicleta.
Pessoa A: Existe alguma rua de Fortaleza que não tem sítulo ou faixa que tu gostaria que tivesse?
Pessoa B: Sim, gostaria.
Pessoa A: E qual?
Pessoa B: Aqui na Perimetral não tem.
Pessoa A: Perimetral. É verdade. Obrigada, viu?",00000021-AUDIO-2025-08-19-16-35-38,Francisco José Mendes Bezerra,44,Masculino,"Há dois anos, né? Porque o trabalho é melhor pra mim, porque Leto Lombre é muito lotado.","Há dois anos, né?",A falta de respeito dos carros e motos.,"E tu tem medo de sofrer algum acidente andando de bike? Sim, já fiz três.","E tu tem medo de sofrer algum acidente andando de bike? Sim, já fiz três. Já três? Quer falar um pouco sobre? Assim, teve algum assim que tu... Não, um carro bateu em mim, mas ele pegou, ele roubou o hospital, pagou a bicicleta, pagou meu óculos. E o que não foi mais, também? Faz tempo isso? Faz seis meses.","Você. Gostaria. De trocar a bicicleta por um outro modo de transporte? Não, não, eu tô bem com a bicicleta.","Existe alguma rua de Fortaleza que não tem sítulo ou faixa que tu gostaria que tivesse? Sim, gostaria. E qual? Aqui na Perimetral não tem. Perimetral.",Praticidade e conveniência; Mais fácil,Entre 2 e 3 anos,Desrespeito dos motoristas,"Sim, tenho medo de acidentes",Sim,Não
"Seu nome e sua idade, por favor. Isabel, 16 anos. É a idade? 28. Você escolheu andar de bicicleta por quê? E há quanto tempo tu utiliza? Uns dois meses, mas pela saúde, pela praticidade mesmo, porque eu trabalho aqui próximo, então, em relação ao trânsito, é mil vezes mais prático e mais rápido. Qual o principal problema que tu enfrenta quando tu anda de bicicleta? Segurança na frente. Às vezes só as pessoas mesmo, né, que ficam andando na ciclofaixa. Sim. Somente. Certo. Tu tem medo de sofrer acidente? Tenho. Já sofreu algum? Até então, não. Tomara que não aconteça. Você gostaria de trocar a bicicleta por outro meio de transporte? Não. Até o momento, não. Certo. Existe alguma rua aqui em Fortaleza que tu gostaria que tivesse uma ciclofaixa que ainda não tem? Ou uma que tá ruim que tu gostaria de melhorar nos teus caminhos? Acho que só a parte ali de cima, né? Que tá um pouquinho, meio ruim, mas só. Porque eu só ando por aqui mesmo, então é de boa. Tá bom. Muito obrigada. Obrigada também.","Pessoa A: Seu nome e sua idade, por favor. Isabel, 16 anos. É a idade? 28. Você escolheu andar de bicicleta por quê? E há quanto tempo tu utiliza? Uns dois meses, mas pela saúde, pela praticidade mesmo, porque eu trabalho aqui próximo, então, em relação ao trânsito, é mil vezes mais prático e mais rápido. Qual o principal problema que tu enfrenta quando tu anda de bicicleta? Segurança na frente. Às vezes só as pessoas mesmo, né, que ficam andando na ciclofaixa. Sim. Somente. Certo. Tu tem medo de sofrer acidente? Tenho. Já sofreu algum? Até então, não. Tomara que não aconteça. Você gostaria de trocar a bicicleta por outro meio de transporte? Não. Até o momento, não. Certo. Existe alguma rua aqui em Fortaleza que tu gostaria que tivesse uma ciclofaixa que ainda não tem? Ou uma que tá ruim que tu gostaria de melhorar nos teus caminhos? Acho que só a parte ali de cima, né? Que tá um pouquinho, meio ruim, mas só. Porque eu só ando por aqui mesmo, então é de boa. Tá bom. Muito obrigada. Obrigada também.",00000022-AUDIO-2025-08-19-16-35-38,Isabel,28,Feminino,"pela saúde, pela praticidade mesmo, porque eu trabalho aqui próximo, então, em relação ao trânsito, é mil vezes mais prático e mais rápido.","Uns dois meses, mas pela saúde, pela praticidade mesmo, porque eu trabalho aqui próximo, então, em relação ao trânsito, é mil vezes mais prático e mais rápido.","Segurança na frente. Às vezes só as pessoas mesmo, né, que ficam andando na ciclofaixa.","Tu tem medo de sofrer acidente? Tenho. Já sofreu algum? Até então, não. Tomara que não aconteça.","Já sofreu algum? Até então, não. Tomara que não aconteça.","Você gostaria de trocar a bicicleta por outro meio de transporte? Não. Até o momento, não.","Existe alguma rua aqui em Fortaleza que tu gostaria que tivesse uma ciclofaixa que ainda não tem? Ou uma que tá ruim que tu gostaria de melhorar nos teus caminhos? Acho que só a parte ali de cima, né? Que tá um pouquinho, meio ruim, mas só. Porque eu só ando por aqui mesmo, então é de boa.",Exercício e saúde; Praticidade e conveniência; Rapidez \ Tempo,Menos de um ano,Outros obstáculos na ciclovia; Risco de acidentes,"Sim, tenho medo de acidentes",Não,Não
"Qual o seu nome e a sua idade, por favor? Antônio Silva Souza, 70. E 30. Por que o senhor escolheu andar de bicicleta e há quanto tempo? Pai, eu só tô com 18 dias. Que consegui. Andar de bicicleta, porque eu vou ver se eu consigo aprender a andar de bicicleta de novo com isso. Certo. Qual o principal problema que você enfrenta quando anda de bicicleta aqui? Problema? Às vezes é contra a mão dos outros, né? Certo. Você tem medo de sofrer acidente? Sim. Já sofreu algum? Não. Ainda bem. Você gostaria de trocar a bicicleta por. Outro meio de transporte? Com. Certeza, sim. Certo. Existe alguma rua em Fortaleza que você gostaria que tivesse uma ciclovia, que ainda não tem? No momento, não. Tá bom. Muito obrigada. Se agora, não. Certo.","Pessoa A: Qual o seu nome e a sua idade, por favor?
Pessoa C: Antônio Silva Souza, 70.
Pessoa A: E 30. Por que o senhor escolheu andar de bicicleta e há quanto tempo?
Pessoa C: Pai, eu só tô com 18 dias.
Pessoa A: Que consegui.
Pessoa C: Andar de bicicleta, porque eu vou ver se eu consigo aprender a andar de bicicleta de novo com isso.
Pessoa A: Certo. Qual o principal problema que você enfrenta quando anda de bicicleta aqui?
Pessoa C: Problema? Às vezes é contra a mão dos outros, né? Certo.
Pessoa A: Você tem medo de sofrer acidente?
Pessoa B: Sim.
Pessoa A: Já sofreu algum?
Pessoa C: Não.
Pessoa A: Ainda bem. Você gostaria de trocar a bicicleta por.
Pessoa B: Outro meio de transporte? Com.
Pessoa A: Certeza, sim.
Pessoa C: Certo.
Pessoa A: Existe alguma rua em Fortaleza que você gostaria que tivesse uma ciclovia, que ainda não tem?
Pessoa C: No momento, não. Tá bom.
Pessoa A: Muito obrigada. Se agora, não.
Pessoa C: Certo.",00000023-AUDIO-2025-08-19-16-37-14,Antônio Silva Souza,70,Masculino,"Pai, eu só tô com 18 dias. Que consegui. Andar de bicicleta, porque eu vou ver se eu consigo aprender a andar de bicicleta de novo com isso.","Pai, eu só tô com 18 dias. Que consegui. Andar de bicicleta, porque eu vou ver se eu consigo aprender a andar de bicicleta de novo com isso. Certo.","Às vezes é contra a mão dos outros, né?",Você tem medo de sofrer acidente? Sim. Já sofreu algum? Não. Ainda bem.,Já sofreu algum? Não. Ainda bem.,"Você gostaria de trocar a bicicleta por. Outro meio de transporte? Com. Certeza, sim. Certo.","Existe alguma rua em Fortaleza que você gostaria que tivesse uma ciclovia, que ainda não tem? No momento, não.",Preferência pessoal,Menos de um ano,Risco de acidentes,"Sim, tenho medo de acidentes",Não,"Sim, mas não especifica qual meio"
"Você aceita responder algumas perguntas? É só em áudio, tá? Seu nome e idade, por favor. Meu nome é Antônio Cássio Souza Reinaldo. Idade? 51. Por que você escolheu andar de bicicleta e há quanto tempo você faz isso? Eu tô com lugar de tempo já e é porque é melhor do que andar de ônibus, né? No meu trabalho eu chego, mas é porque de ônibus você atrasa muito. Mas eu sempre na... Respeitando o trânsito, sapato quando dá pra passar, né? Eu tô trabalhando onde vocês trabalham. Ah, é? É, só limpando lá. Qual é o principal problema que você enfrenta andar de bicicleta em Fortaleza? Mas é... Tem vezes que os carros não respeitam, né? Mesmo que a gente esteja na ciclovia, como uma vez eu fui pego dentro da ciclovia, o carro bateu em mim, eu dentro da ciclovia, o carro bateu na minha bicicleta e empenou o aro. Mas foi só isso mesmo, só... Foi. Agora recente o seu acidente? Não, não, só está com sete meses. Foi ali de frente da sede do Fortaleza. Você então tem medo de andar, de sofrer acidente andando de bicicleta? Então você falou que sofreu esse acidente no último ano. Como é que foi? Você pode explicar? Eu vinha na ciclovia, né? Aí o rapaz foi passar e não respeitou e foi batendo. Bateu na frente? Foi. Você gostaria de trocar a bicicleta por outro meio de transporte? Porque eu não sei andar, né? De outros transportes, eu sei andar mais de bicicleta. Eu já comprei uma moto, mas não deu certo, eu fui e vendi. Existe alguma rua em Fortaleza que você gostaria de ver uma ciclovia? Eu ali perto do terminal da Parangaba, que ali é mais complicado. A gente tem que sair muito cedo para não pegar o trânsito, que ali é muito estreito. Muito obrigada.","Pessoa A: Você aceita responder algumas perguntas? É só em áudio, tá? Seu nome e idade, por favor.
Pessoa B: Meu nome é Antônio Cássio Souza Reinaldo.
Pessoa A: Idade?
Pessoa B: 51.
Pessoa A: Por que você escolheu andar de bicicleta e há quanto tempo você faz isso?
Pessoa B: Eu tô com lugar de tempo já e é porque é melhor do que andar de ônibus, né? No meu trabalho eu chego, mas é porque de ônibus você atrasa muito. Mas eu sempre na... Respeitando o trânsito, sapato quando dá pra passar, né? Eu tô trabalhando onde vocês trabalham.
Pessoa A: Ah, é?
Pessoa B: É, só limpando lá.
Pessoa A: Qual é o principal problema que você enfrenta andar de bicicleta em Fortaleza?
Pessoa B: Mas é... Tem vezes que os carros não respeitam, né? Mesmo que a gente esteja na ciclovia, como uma vez eu fui pego dentro da ciclovia, o carro bateu em mim, eu dentro da ciclovia, o carro bateu na minha bicicleta e empenou o aro. Mas foi só isso mesmo, só... Foi.
Pessoa A: Agora recente o seu acidente?
Pessoa B: Não, não, só está com sete meses. Foi ali de frente da sede do Fortaleza.
Pessoa A: Você então tem medo de andar, de sofrer acidente andando de bicicleta? Então você falou que sofreu esse acidente no último ano. Como é que foi? Você pode explicar?
Pessoa B: Eu vinha na ciclovia, né? Aí o rapaz foi passar e não respeitou e foi batendo. Bateu na frente? Foi.
Pessoa A: Você gostaria de trocar a bicicleta por outro meio de transporte?
Pessoa B: Porque eu não sei andar, né? De outros transportes, eu sei andar mais de bicicleta. Eu já comprei uma moto, mas não deu certo, eu fui e vendi.
Pessoa A: Existe alguma rua em Fortaleza que você gostaria de ver uma ciclovia?
Pessoa B: Eu ali perto do terminal da Parangaba, que ali é mais complicado. A gente tem que sair muito cedo para não pegar o trânsito, que ali é muito estreito.
Pessoa A: Muito obrigada.",00000024-AUDIO-2025-08-19-16-37-28,Antônio Cássio Souza Reinaldo,51,Masculino,"Eu tô com lugar de tempo já e é porque é melhor do que andar de ônibus, né? No meu trabalho eu chego, mas é porque de ônibus você atrasa muito.",Eu tô com lugar de tempo já,"Mas é... Tem vezes que os carros não respeitam, né? Mesmo que a gente esteja na ciclovia, como uma vez eu fui pego dentro da ciclovia, o carro bateu em mim, eu dentro da ciclovia, o carro bateu na minha bicicleta e empenou o aro. Mas foi só isso mesmo, só... Foi.","Você então tem medo de andar, de sofrer acidente andando de bicicleta?","Tem vezes que os carros não respeitam, né? Mesmo que a gente esteja na ciclovia, como uma vez eu fui pego dentro da ciclovia, o carro bateu em mim, eu dentro da ciclovia, o carro bateu na minha bicicleta e empenou o aro. Mas foi só isso mesmo, só... Foi. Agora recente o seu acidente? Não, não, só está com sete meses. Foi ali de frente da sede do Fortaleza. Você então tem medo de andar, de sofrer acidente andando de bicicleta? Então você falou que sofreu esse acidente no último ano. Como é que foi? Você pode explicar? Eu vinha na ciclovia, né? Aí o rapaz foi passar e não respeitou e foi batendo. Bateu na frente? Foi.","Porque eu não sei andar, né? De outros transportes, eu sei andar mais de bicicleta. Eu já comprei uma moto, mas não deu certo, eu fui e vendi.","Existe alguma rua em Fortaleza que você gostaria de ver uma ciclovia? Eu ali perto do terminal da Parangaba, que ali é mais complicado. A gente tem que sair muito cedo para não pegar o trânsito, que ali é muito estreito.",Rapidez \ Tempo;Praticidade e conveniência,Menos de um ano,Desrespeito dos motoristas; Invasão de carros ou motos na ciclovia; Risco de acidentes,"Sim, tenho medo de acidentes",Sim,Não
"Seu nome e tua idade? Dennis, tenho 42 anos. Por que tu escolheu andar de bicicleta e quanto tempo tu anda? 45 minutos eu ando, e o transporte faz bem a saúde. E. Faz quantos anos que tu anda de bicicleta? Anos. Bem de novo. Bem novinho. É. Era quando antigamente era bike, andava na bike. Agora, bike menor, né? Sim. Aí, agora, a grande. Tá. E qual o principal problema que tu enfrenta pedalando na cidade hoje? Na cidade, é só que nem todo canto tem ciclo, nem ciclofaixa, nem ciclovia. Não tem. Sim. É, é isso, a dificuldade. Tá. Porque, né, a gente tá no caminho, geralmente, Acaba. Quando acaba os carros passam pela gente e só falta atropelar. E tu tem medo de sofrer algum acidente andando de bicicleta? Sim. Já sofreu? Já. Faz tempo? Faz, faz tempo. Tu gostaria de trocar a bicicleta por outro meio de transporte? Não, agora não. Existe alguma via em Fortaleza que não tem ciclofaxe que tu gostaria que tivesse? Sim, mais lá na frente. Mais lá na frente é outro nome. Aqui é Oliveira Paiva, né? Não, aqui é Paulino Rocha. Silomão Guga. Legal. Obrigada.","Pessoa B: Seu nome e tua idade?
Pessoa A: Dennis, tenho 42 anos.
Pessoa B: Por que tu escolheu andar de bicicleta e quanto tempo tu anda?
Pessoa A: 45 minutos eu ando, e o transporte faz bem a saúde. E.
Pessoa B: Faz quantos anos que tu anda de bicicleta?
Pessoa A: Anos.
Pessoa B: Bem de novo.
Pessoa A: Bem novinho.
Pessoa B: É.
Pessoa A: Era quando antigamente era bike, andava na bike. Agora, bike menor, né?
Pessoa B: Sim.
Pessoa A: Aí, agora, a grande.
Pessoa B: Tá. E qual o principal problema que tu enfrenta pedalando na cidade hoje?
Pessoa A: Na cidade, é só que nem todo canto tem ciclo, nem ciclofaixa, nem ciclovia. Não tem.
Pessoa B: Sim.
Pessoa A: É, é isso, a dificuldade.
Pessoa B: Tá.
Pessoa A: Porque, né, a gente tá no caminho, geralmente, Acaba. Quando acaba os carros passam pela gente e só falta atropelar.
Pessoa B: E tu tem medo de sofrer algum acidente andando de bicicleta?
Pessoa A: Sim.
Pessoa B: Já sofreu?
Pessoa A: Já.
Pessoa B: Faz tempo?
Pessoa A: Faz, faz tempo.
Pessoa B: Tu gostaria de trocar a bicicleta por outro meio de transporte?
Pessoa A: Não, agora não.
Pessoa B: Existe alguma via em Fortaleza que não tem ciclofaxe que tu gostaria que tivesse?
Pessoa A: Sim, mais lá na frente. Mais lá na frente é outro nome. Aqui é Oliveira Paiva, né?
Pessoa B: Não, aqui é Paulino Rocha.
Pessoa A: Silomão Guga. Legal.
Pessoa B: Obrigada.",00000025-AUDIO-2025-08-19-16-39-31,Dennis,42,Masculino,"45 minutos eu ando, e o transporte faz bem a saúde.","Faz quantos anos que tu anda de bicicleta? Anos. Bem de novo. Bem novinho. É. Era quando antigamente era bike, andava na bike. Agora, bike menor, né? Sim. Aí, agora, a grande.","Na cidade, é só que nem todo canto tem ciclo, nem ciclofaixa, nem ciclovia. Não tem. Sim. É, é isso, a dificuldade.",E tu tem medo de sofrer algum acidente andando de bicicleta? Sim. Já sofreu? Já.,"""E tu tem medo de sofrer algum acidente andando de bicicleta? Sim. Já sofreu? Já. Faz tempo? Faz, faz tempo.""","Tu gostaria de trocar a bicicleta por outro meio de transporte? Não, agora não.","Existe alguma via em Fortaleza que não tem ciclofaxe que tu gostaria que tivesse? Sim, mais lá na frente. Mais lá na frente é outro nome. Aqui é Oliveira Paiva, né? Não, aqui é Paulino Rocha. Silomão Guga.",Exercício e saúde;Rapidez \ Tempo,,Falta de ciclovias,"Sim, tenho medo de acidentes",Sim,Não
